A1: Stt | B1: Mssv | C1: Họ và tên | E1: Ngày sinh | F1: Tên lớp | G1: ĐRL | H1: ĐTBHK | I1: tchk(s) | J1: TCTL | K1: dtbcmr | L1: Mức HB | N1: Số CMND
A2: 1 | B2: 21003218 | C2: Nguyễn Xuân | D2: Thịnh | E2: 240392 | F2: CK10KSCD | G2: 100.00 | H2: 9.33 | I2: 12 | J2: 146 | K2: 9.46 | L2: 4860000 | N2: 215165552
A3: =A2+1 -> 2 | B3: 21003235 | C3: Hồ Đức | D3: Thọ | E3: 140192 | F3: CK10KSCD | G3: 95.00 | H3: 9.40 | I3: 10 | J3: 146 | K3: 9.42 | L3: 4860000 | N3: 024699962
A4: =A3+1 -> 3 | B4: 21001135 | C4: Trần Ngọc | D4: Hoàng | E4: 250392 | F4: CK10KSCD | G4: 100.00 | H4: 9.18 | I4: 14 | J4: 146 | K4: 9.34 | L4: 4860000 | N4: 331665079
A5: =A4+1 -> 4 | B5: 21001186 | C5: Nguyễn Hoàng | D5: Huân | E5: 090492 | F5: CK10KSCD | G5: 95.00 | H5: 9.30 | I5: 10 | J5: 146 | K5: 9.34 | L5: 4860000 | N5: 280984131
A6: =A5+1 -> 5 | B6: 21000895 | C6: Đặng Thị Mỹ | D6: Hạnh | E6: 290292 | F6: CK10CD1 | G6: 100.00 | H6: 9.12 | I6: 17 | J6: 147 | K6: 9.30 | L6: 4860000 | N6: 215236191
A7: =A6+1 -> 6 | B7: 21004057 | C7: Lê | D7: Vũ | E7: 230992 | F7: CK10KSCD | G7: 95.00 | H7: 9.25 | I7: 12 | J7: 146 | K7: 9.30 | L7: 4860000 | N7: 264414779
A8: =A7+1 -> 7 | B8: 21002118 | C8: Nguyễn Trọng | D8: Nghĩa | E8: 060692 | F8: CK10KSCD | G8: 95.00 | H8: 9.17 | I8: 15 | J8: 149 | K8: 9.24 | L8: 4860000 | N8: 215223654
A9: =A8+1 -> 8 | B9: 21003432 | C9: Phan Trung | D9: Tính | E9: 92 | F9: CK10CD1 | G9: 96.00 | H9: 9.15 | I9: 10 | J9: 146 | K9: 9.24 | L9: 4860000 | N9: 312151057
A10: =A9+1 -> 9 | B10: 21000350 | C10: Vũ Trần Thành | D10: Công | E10: 261192 | F10: CK10CD1 | G10: 96.00 | H10: 9.05 | I10: 10 | J10: 146 | K10: 9.16 | L10: 4860000 | N10: 024712545
A11: =A10+1 -> 10 | B11: 21000524 | C11: Lương Quý Phi | D11: Dũng | E11: 040992 | F11: CK10KSCD | G11: 95.00 | H11: 9.08 | I11: 12 | J11: 146 | K11: 9.16 | L11: 4860000 | N11: 272125907
A12: =A11+1 -> 11 | B12: 21000127 | C12: Nguyễn Duy | D12: ánh | E12: 280292 | F12: CK10KSCD | G12: 95.00 | H12: 9.04 | I12: 12 | J12: 146 | K12: 9.13 | L12: 4860000 | N12: 233161557
A13: =A12+1 -> 12 | B13: 21000340 | C13: Nguyễn Sinh | D13: Công | E13: 190492 | F13: CK10CD1 | G13: 95.00 | H13: 8.96 | I13: 12 | J13: 146 | K13: 9.07 | L13: 4860000 | N13: 215162767
A14: =A13+1 -> 13 | B14: 21001951 | C14: Nguyễn Đăng | D14: Minh | E14: 100292 | F14: CK10KSCD | G14: 95.00 | H14: 8.96 | I14: 12 | J14: 146 | K14: 9.07 | L14: 4860000 | N14: 194493889
A15: =A14+1 -> 14 | B15: 21000890 | C15: Nguyễn Xuân | D15: Hạ | E15: 100892 | F15: CK10KSCD | G15: 95.00 | H15: 8.95 | I15: 10 | J15: 146 | K15: 9.06 | L15: 4860000 | N15: 212752983
A16: =A15+1 -> 15 | B16: 21001458 | C16: Hồ Ngọc | D16: Khanh | E16: 070692 | F16: CK10CD1 | G16: 96.00 | H16: 8.90 | I16: 10 | J16: 146 | K16: 9.04 | L16: 4860000 | N16: 250923801
A17: =A16+1 -> 16 | B17: 21000122 | C17: Trương Hoài Vũ | D17: Anh | E17: 241292 | F17: CK10CD1 | G17: 95.00 | H17: 8.90 | I17: 10 | J17: 148 | K17: 9.02 | L17: 4860000 | N17: 225477325
A18: =A17+1 -> 17 | B18: 21003177 | C18: Phan Phước | D18: Thiện | E18: 080192 | F18: CK10KSTN | G18: 100.00 | H18: 8.77 | I18: 13 | J18: 146 | K18: 9.02 | L18: 4860000 | N18: 341524185
A19: =A18+1 -> 18 | B19: 21003340 | C19: Trần Ngọc Công | D19: Thương | E19: 251292 | F19: CK10KSCD | G19: 95.00 | H19: 8.83 | I19: 12 | J19: 146 | K19: 8.96 | L19: 4050000 | N19: 212598164
A20: =A19+1 -> 19 | B20: 21003348 | C20: Nguyễn Công | D20: Thức | E20: 261192 | F20: CK10KSTN | G20: 95.00 | H20: 8.80 | I20: 15 | J20: 146 | K20: 8.94 | L20: 4050000 | N20: 312135186
A21: =A20+1 -> 20 | B21: 21000883 | C21: Nguyễn Xuân | D21: Hảo | E21: 020692 | F21: CK10CD2 | G21: 95.00 | H21: 8.77 | I21: 11 | J21: 147 | K21: 8.92 | L21: 4050000 | N21: 301432665
A22: =A21+1 -> 21 | B22: 21004124 | C22: Nguyễn Châu | D22: Vương | E22: 060592 | F22: CK10CD2 | G22: 95.00 | H22: 8.77 | I22: 13 | J22: 146 | K22: 8.92 | L22: 4050000 | N22: 261239938
A23: =A22+1 -> 22 | B23: 21002059 | C23: Trịnh Hoài | D23: Nam | E23: 170392 | F23: CK10KSCD | G23: 100.00 | H23: 8.63 | I23: 15 | J23: 149 | K23: 8.90 | L23: 4050000 | N23: 024655512
A24: =A23+1 -> 23 | B24: 21000345 | C24: Trần Quốc | D24: Công | E24: 010892 | F24: CK10HT2 | G24: 100.00 | H24: 9.25 | I24: 16 | J24: 147 | K24: 9.40 | L24: 4860000 | N24: 381673922
A25: =A24+1 -> 24 | B25: 21001688 | C25: Trần Quỳnh | D25: Lê | E25: 220292 | F25: CK10HT1 | G25: 100.00 | H25: 8.72 | I25: 16 | J25: 147 | K25: 8.98 | L25: 4050000 | N25: 215213713
A26: =A25+1 -> 25 | B26: 21003501 | C26: Phạm Thùy | D26: Trang | E26: 250792 | F26: CK10HT1 | G26: 100.00 | H26: 8.53 | I26: 16 | J26: 142 | K26: 8.82 | L26: 4050000 | N26: 385525298
A27: =A26+1 -> 26 | B27: 21003229 | C27: Phạm Thị | D27: Thoa | E27: 221192 | F27: CK10HT2 | G27: 95.00 | H27: 8.56 | I27: 16 | J27: 147 | K27: 8.75 | L27: 4050000 | N27: 301438432
A28: =A27+1 -> 27 | B28: 21004542 | C28: Võ Thị Bích | D28: Phượng | E28: 130992 | F28: CK10SOI | G28: 90.00 | H28: 8.77 | I28: 11 | J28: 146 | K28: 8.82 | L28: 4050000 | N28: 024439994
A29: =A28+1 -> 28 | B29: 21004559 | C29: Ngô Thị Hương | D29: Trà | E29: 020592 | F29: CK10MAY | G29: 90.00 | H29: 8.42 | I29: 18 | J29: 146 | K29: 8.54 | L29: 4050000 | N29: 197275197
A30: =A29+1 -> 29 | B30: 21004534 | C30: Trần Thị Hồng | D30: Nhung | E30: 150692 | F30: CK10SOI | G30: 95.00 | H30: 8.23 | I30: 15 | J30: 146 | K30: 8.48 | L30: 4050000 | N30: 291002970
A31: =A30+1 -> 30 | B31: 21103389 | C31: Bùi Đức | D31: Thịnh | E31: 020493 | F31: CK11KSCD | G31: 100.00 | H31: 8.94 | I31: 16 | J31: 114 | K31: 9.15 | L31: 4860000 | N31: 272298637
A32: =A31+1 -> 31 | B32: 21109006 | C32: Kiều Ng Phương | D32: Đại | E32: 210490 | F32: CK11LTH | G32: 85.00 | H32: 9.28 | I32: 10 | J32: 156 | K32: 9.12 | L32: 4860000 | N32: 024345344
A33: =A32+1 -> 32 | B33: 21103374 | C33: Phan Văn | D33: Thiện | E33: 200193 | F33: CK11KSCD | G33: 100.00 | H33: 8.81 | I33: 18 | J33: 116 | K33: 9.05 | L33: 4860000 | N33: 215205209
A34: =A33+1 -> 33 | B34: 21103809 | C34: Phan Văn | D34: Trí | E34: 110293 | F34: CK11KSCD | G34: 95.00 | H34: 8.91 | I34: 16 | J34: 116 | K34: 9.03 | L34: 4860000 | N34: 321419767
A35: =A34+1 -> 34 | B35: 21100677 | C35: Trần Đoàn Bình | D35: Dương | E35: 310392 | F35: CK11KSCD | G35: 100.00 | H35: 8.73 | I35: 20 | J35: 117 | K35: 8.98 | L35: 4050000 | N35: 261178300
A36: =A35+1 -> 35 | B36: 21103227 | C36: Thái Mai | D36: Thành | E36: 180893 | F36: CK11KSCD | G36: 100.00 | H36: 8.72 | I36: 16 | J36: 112 | K36: 8.98 | L36: 4050000 | N36: 205605308
A37: =A36+1 -> 36 | B37: 21100816 | C37: Nguyễn Hồng | D37: Đoan | E37: 260893 | F37: CK11KSTN | G37: 95.00 | H37: 8.67 | I37: 18 | J37: 115 | K37: 8.84 | L37: 4050000 | N37: 250910503
A38: =A37+1 -> 37 | B38: 21102175 | C38: Vũ Thành | D38: Nam | E38: 040793 | F38: CK11KSTN | G38: 100.00 | H38: 8.53 | I38: 16 | J38: 111 | K38: 8.82 | L38: 4050000 | N38: 273471832
A39: =A38+1 -> 38 | B39: 21100679 | C39: Trần Hoàng | D39: Dương | E39: 080193 | F39: CK11KSCD | G39: 95.00 | H39: 8.64 | I39: 18 | J39: 114 | K39: 8.81 | L39: 4050000 | N39: 024992768
A40: =A39+1 -> 39 | B40: 21103487 | C40: Phạm Văn | D40: Thuân | E40: 060993 | F40: CK11KSCD | G40: 95.00 | H40: 8.63 | I40: 16 | J40: 114 | K40: 8.80 | L40: 4050000 | N40: 173164489
A41: =A40+1 -> 40 | B41: 21100845 | C41: Nguyễn Hữu | D41: Được | E41: 150693 | F41: CK11KSCD | G41: 95.00 | H41: 8.61 | I41: 18 | J41: 114 | K41: 8.79 | L41: 4050000 | N41: 273451145
A42: =A41+1 -> 41 | B42: 21100143 | C42: Trần Hồng | D42: Anh | E42: 310593 | F42: CK11KSTN | G42: 100.00 | H42: 8.47 | I42: 18 | J42: 117 | K42: 8.78 | L42: 4050000 | N42: 250968523
A43: =A42+1 -> 42 | B43: 21100697 | C43: Mai Thành | D43: Đảm | E43: 061093 | F43: CK11NH | G43: 100.00 | H43: 8.47 | I43: 18 | J43: 110 | K43: 8.78 | L43: 4050000 | N43: 312162674
A44: =A43+1 -> 43 | B44: 21100733 | C44: Nguyễn Đăng Minh | D44: Đạt | E44: 151193 | F44: CK11KSTN | G44: 100.00 | H44: 8.47 | I44: 15 | J44: 110 | K44: 8.78 | L44: 4050000 | N44: 201628567
A45: =A44+1 -> 44 | B45: 21100701 | C45: Nguyễn Hữu Quốc | D45: Đại | E45: 040591 | F45: CK11KSTN | G45: 100.00 | H45: 8.36 | I45: 18 | J45: 118 | K45: 8.69 | L45: 4050000 | N45: 215081824
A46: =A45+1 -> 45 | B46: 21103293 | C46: Hoàng Minh | D46: Thắng | E46: 180193 | F46: CK11KSCD | G46: 95.00 | H46: 8.47 | I46: 16 | J46: 114 | K46: 8.68 | L46: 4050000 | N46: 273452252
A47: =A46+1 -> 46 | B47: 21100704 | C47: Nguyễn Tấn | D47: Đại | E47: 201193 | F47: CK11KSCD | G47: 100.00 | H47: 8.33 | I47: 18 | J47: 117 | K47: 8.66 | L47: 4050000 | N47: 241294264
A48: =A47+1 -> 47 | B48: 21101957 | C48: Trần Anh | D48: Lộc | E48: 290993 | F48: CK11KSCD | G48: 95.00 | H48: 8.41 | I48: 16 | J48: 117 | K48: 8.63 | L48: 4050000 | N48: 273451905
A49: =A48+1 -> 48 | B49: 21103044 | C49: Nguyễn Nhật | D49: Tâm | E49: 170893 | F49: CK11KSTN | G49: 100.00 | H49: 8.26 | I49: 17 | J49: 112 | K49: 8.61 | L49: 4050000 | N49: 025109121
A50: =A49+1 -> 49 | B50: 21104009 | C50: Nguyễn Thanh | D50: Tuấn | E50: 300193 | F50: CK11KSTN | G50: 100.00 | H50: 8.25 | I50: 16 | J50: 113 | K50: 8.60 | L50: 4050000 | N50: 321434090
A51: =A50+1 -> 50 | B51: 21100263 | C51: Đoàn Văn | D51: Bi | E51: 290393 | F51: CK11CTM1 | G51: 95.00 | H51: 8.33 | I51: 20 | J51: 121 | K51: 8.56 | L51: 4050000 | N51: 291032669
A52: =A51+1 -> 51 | B52: 21101647 | C52: Nguyễn Nhật Đăng | D52: Khoa | E52: 200193 | F52: CK11KSCD | G52: 95.00 | H52: 8.33 | I52: 18 | J52: 112 | K52: 8.56 | L52: 4050000 | N52: 321591606
A53: =A52+1 -> 52 | B53: 21102141 | C53: Nguyễn Kỳ | D53: Nam | E53: 070893 | F53: CK11KSTN | G53: 100.00 | H53: 8.17 | I53: 15 | J53: 115 | K53: 8.54 | L53: 4050000 | N53: 331750827
A54: =A53+1 -> 53 | B54: 21104301 | C54: Nguyễn Bá | D54: Vũ | E54: 291093 | F54: CK11CD1 | G54: 100.00 | H54: 8.18 | I54: 19 | J54: 117 | K54: 8.54 | L54: 4050000 | N54: 215270597
A55: =A54+1 -> 54 | B55: 21102451 | C55: Đỗ Quỳnh | D55: Như | E55: 100693 | F55: CK11MAY | G55: 95.00 | H55: 8.84 | I55: 16 | J55: 114 | K55: 8.97 | L55: 4050000 | N55: 312181055
A56: =A55+1 -> 55 | B56: 21104420 | C56: Nguyễn Thị Huyền | D56: Trang | E56: 061293 | F56: CK11MAY | G56: 95.00 | H56: 8.64 | I56: 14 | J56: 117 | K56: 8.81 | L56: 4050000 | N56: 321453799
A57: =A56+1 -> 56 | B57: 21102101 | C57: Đoàn Thị Thu | D57: Mơ | E57: 150993 | F57: CK11SOI | G57: 95.00 | H57: 8.56 | I57: 17 | J57: 119 | K57: 8.75 | L57: 4050000 | N57: 250859323
A58: =A57+1 -> 57 | B58: 21103963 | C58: Đặng Thanh | D58: Tuấn | E58: 131093 | F58: CK11HT2 | G58: 100.00 | H58: 9.22 | I58: 16 | J58: 110 | K58: 9.38 | L58: 4860000 | N58: 321475659
A59: =A58+1 -> 58 | B59: 21102449 | C59: Trần Thiên Quế | D59: Nhung | E59: 130693 | F59: CK11HT2 | G59: 100.00 | H59: 8.84 | I59: 16 | J59: 113 | K59: 9.07 | L59: 4860000 | N59: 024923003
A60: =A59+1 -> 59 | B60: 21102661 | C60: Ngô Anh | D60: Phương | E60: 030393 | F60: CK11HT2 | G60: 100.00 | H60: 8.66 | I60: 16 | J60: 118 | K60: 8.93 | L60: 4050000 | N60: 280985485
A61: =A60+1 -> 60 | B61: 21102336 | C61: Trần Minh | D61: Nguyệt | E61: 080489 | F61: CK11HT2 | G61: 100.00 | H61: 8.44 | I61: 16 | J61: 122 | K61: 8.75 | L61: 4050000 | N61: 312031139
A62: =A61+1 -> 61 | B62: 21202269 | C62: Nguyễn Tất | D62: Nam | E62: 210794 | F62: CK12KSTN | G62: 100.00 | H62: 9.09 | I62: 22 | J62: 79 | K62: 9.27 | L62: 4860000 | N62: 025031772
A63: =A62+1 -> 62 | B63: 21200889 | C63: Trương Trường | D63: Giang | E63: 020294 | F63: CK12KSCD | G63: 100.00 | H63: 8.85 | I63: 17 | J63: 81 | K63: 9.08 | L63: 4860000 | N63: 125573589
A64: =A63+1 -> 63 | B64: 21203870 | C64: Nguyễn Hữu LêQuang | D64: Tín | E64: 230494 | F64: CK12KSCD | G64: 100.00 | H64: 8.68 | I64: 17 | J64: 81 | K64: 8.94 | L64: 4050000 | N64: 025100912
A65: =A64+1 -> 64 | B65: 21202245 | C65: Mai Hoàng | D65: Nam | E65: 120594 | F65: CK12CD2 | G65: 100.00 | H65: 8.65 | I65: 17 | J65: 74 | K65: 8.92 | L65: 4050000 | N65: 285401412
A66: =A65+1 -> 65 | B66: 21204069 | C66: Trần Hữu | D66: Trí | E66: 020194 | F66: CK12NH | G66: 100.00 | H66: 8.61 | I66: 18 | J66: 75 | K66: 8.89 | L66: 4050000 | N66: 215343408
A67: =A66+1 -> 66 | B67: 21204236 | C67: Trần Mạnh | D67: Trưởng | E67: 071094 | F67: CK12KSCD | G67: 90.00 | H67: 8.79 | I67: 17 | J67: 76 | K67: 8.83 | L67: 4050000 | N67: 250940507
A68: =A67+1 -> 67 | B68: 21200776 | C68: Nguyễn Văn | D68: Điền | E68: 100794 | F68: CK12CD1 | G68: 90.00 | H68: 8.68 | I68: 19 | J68: 78 | K68: 8.74 | L68: 4050000 | N68: 221277472
A69: =A68+1 -> 68 | B69: 21204098 | C69: Nguyễn Quốc | D69: Trọng | E69: 250894 | F69: CK12CD2 | G69: 90.00 | H69: 8.66 | I69: 19 | J69: 76 | K69: 8.73 | L69: 4050000 | N69: 301508909
A70: =A69+1 -> 69 | B70: 21200363 | C70: Nguyễn Đức | D70: Chính | E70: 060894 | F70: CK12CD1 | G70: 95.00 | H70: 8.52 | I70: 23 | J70: 82 | K70: 8.72 | L70: 4050000 | N70: 025115381
A71: =A70+1 -> 70 | B71: 21200924 | C71: Phạm Thái | D71: Hà | E71: 200894 | F71: CK12KSTN | G71: 95.00 | H71: 8.53 | I71: 18 | J71: 80 | K71: 8.72 | L71: 4050000 | N71: 273586232
A72: =A71+1 -> 71 | B72: 21201911 | C72: Nguyễn Vàng | D72: Linh | E72: 120894 | F72: CK12NH | G72: 100.00 | H72: 8.35 | I72: 20 | J72: 71 | K72: 8.68 | L72: 4050000 | N72: 221331644
A73: =A72+1 -> 72 | B73: 21202221 | C73: Bùi Công | D73: Nam | E73: 150393 | F73: CK12KSTN | G73: 90.00 | H73: 8.59 | I73: 22 | J73: 77 | K73: 8.67 | L73: 4050000 | N73: 291053364
A74: =A73+1 -> 73 | B74: 21201229 | C74: Nguyễn Văn | D74: Hoàng | E74: 200694 | F74: CK12KSCD | G74: 95.00 | H74: 8.45 | I74: 19 | J74: 72 | K74: 8.66 | L74: 4050000 | N74: 221338891
A75: =A74+1 -> 74 | B75: 21203181 | C75: Phạm Hoàng | D75: Sơn | E75: 260694 | F75: CK12KSCD | G75: 95.00 | H75: 8.45 | I75: 21 | J75: 78 | K75: 8.66 | L75: 4050000 | N75: 215275578
A76: =A75+1 -> 75 | B76: 21203476 | C76: Huỳnh Kim | D76: Thạch | E76: 020194 | F76: CK12KSCD | G76: 100.00 | H76: 8.32 | I76: 19 | J76: 76 | K76: 8.66 | L76: 4050000 | N76: 225600963
A77: =A76+1 -> 76 | B77: 21201441 | C77: Đào Nguyễn Nhật | D77: Huỳnh | E77: 080894 | F77: CK12KSTN | G77: 95.00 | H77: 8.41 | I77: 17 | J77: 76 | K77: 8.63 | L77: 4050000 | N77: 025182319
A78: =A77+1 -> 77 | B78: 21203601 | C78: Nguyễn Xuân | D78: Thiệu | E78: 230994 | F78: CK12KSCD | G78: 95.00 | H78: 8.34 | I78: 19 | J78: 76 | K78: 8.57 | L78: 4050000 | N78: 272477346
A79: =A78+1 -> 78 | B79: 21201455 | C79: Nguyễn Mạnh | D79: Hùng | E79: 171294 | F79: CK12KSCD | G79: 95.00 | H79: 8.32 | I79: 17 | J79: 78 | K79: 8.56 | L79: 4050000 | N79: 272479286
A80: =A79+1 -> 79 | B80: 21201579 | C80: Lương Duy | D80: Khang | E80: 010194 | F80: CK12KSCD | G80: 90.00 | H80: 8.45 | I80: 19 | J80: 78 | K80: 8.56 | L80: 4050000 | N80: 301510223
A81: =A80+1 -> 80 | B81: 21203090 | C81: Đoàn Việt | D81: Sang | E81: 100694 | F81: CK12KSTN | G81: 95.00 | H81: 8.33 | I81: 18 | J81: 76 | K81: 8.56 | L81: 4050000 | N81: 173968041
A82: =A81+1 -> 81 | B82: 21204194 | C82: Phạm Văn | D82: Trương | E82: 031094 | F82: CK12KSTN | G82: 90.00 | H82: 8.45 | I82: 19 | J82: 74 | K82: 8.56 | L82: 4050000 | N82: 221374489
A83: =A82+1 -> 82 | B83: 21201274 | C83: Trương Đức | D83: Hòa | E83: 230794 | F83: CK12CTM1 | G83: 100.00 | H83: 8.08 | I83: 19 | J83: 76 | K83: 8.46 | L83: 4050000 | N83: 273533586
A84: =A83+1 -> 83 | B84: 21200448 | C84: Nguyễn Vũ | D84: Cường | E84: 241094 | F84: CK12CD1 | G84: 100.00 | H84: 8.05 | I84: 21 | J84: 79 | K84: 8.44 | L84: 4050000 | N84: 281041936
A85: =A84+1 -> 84 | B85: 21200273 | C85: Trần Quốc | D85: Bình | E85: 020994 | F85: CK12CD1 | G85: 90.00 | H85: 8.26 | I85: 19 | J85: 76 | K85: 8.41 | L85: 4050000 | N85: 281061929
A86: =A85+1 -> 85 | B86: 21201138 | C86: Nguyễn Minh | D86: Hiền | E86: 230794 | F86: CK12CD1 | G86: 85.00 | H86: 8.39 | I86: 19 | J86: 78 | K86: 8.41 | L86: 4050000 | N86: 273553122
A87: =A86+1 -> 86 | B87: 21201434 | C87: Nguyễn Thị Thu | D87: Huyền | E87: 100194 | F87: CK12MAY | G87: 100.00 | H87: 8.78 | I87: 20 | J87: 81 | K87: 9.02 | L87: 4860000 | N87: 281076136
A88: =A87+1 -> 87 | B88: 21200595 | C88: Nguyễn Thị | D88: Duyên | E88: 021094 | F88: CK12MAY | G88: 98.00 | H88: 8.40 | I88: 20 | J88: 81 | K88: 8.68 | L88: 4050000 | N88: 272441451
A89: =A88+1 -> 88 | B89: 21204346 | C89: Võ Thị Ngọc | D89: Tuyền | E89: 010194 | F89: CK12MAY | G89: 100.00 | H89: 8.33 | I89: 20 | J89: 79 | K89: 8.66 | L89: 4050000 | N89: 273492595
A90: =A89+1 -> 89 | B90: 21204420 | C90: Đặng Thị Xuân | D90: Tươi | E90: 260894 | F90: CK12HT1 | G90: 95.00 | H90: 8.50 | I90: 14 | J90: 72 | K90: 8.70 | L90: 4050000 | N90: 301519538
A91: =A90+1 -> 90 | B91: 21200523 | C91: Trần Ngọc Kim | D91: Dung | E91: 211194 | F91: CK12HT1 | G91: 90.00 | H91: 8.61 | I91: 14 | J91: 79 | K91: 8.69 | L91: 4050000 | N91: 225803655
A92: =A91+1 -> 91 | B92: 21203908 | C92: Dương Minh | D92: Toàn | E92: 221294 | F92: CK12HT2 | G92: 90.00 | H92: 8.48 | I92: 20 | J92: 72 | K92: 8.58 | L92: 4050000 | N92: 025094327
A93: =A92+1 -> 92 | B93: 21203871 | C93: Nguyễn Kim | D93: Tín | E93: 050294 | F93: CK12HT1 | G93: 90.00 | H93: 8.39 | I93: 18 | J93: 78 | K93: 8.51 | L93: 4050000 | N93: 025042199
A94: =A93+1 -> 93 | B94: 21300331 | C94: Bùi Ngọc | D94: Can | E94: 070995 | F94: CK13CK03 | G94: 95.00 | H94: 9.00 | I94: 20 | J94: 40 | K94: 9.10 | L94: 4860000 | N94: 212570033
A95: =A94+1 -> 94 | B95: 21303012 | C95: Võ Khắc | D95: Phú | E95: 100595 | F95: CK13CK09 | G95: 95.00 | H95: 8.88 | I95: 20 | J95: 40 | K95: 9.00 | L95: 4860000 | N95: 251021876
A96: =A95+1 -> 95 | B96: 21303338 | C96: Lê Tấn | D96: Sang | E96: 170795 | F96: CK13CK09 | G96: 95.00 | H96: 8.85 | I96: 20 | J96: 40 | K96: 8.98 | L96: 4050000 | N96: 301540719
A97: =A96+1 -> 96 | B97: 21302848 | C97: Trần Minh | D97: Nhựt | E97: 060195 | F97: CK13CK10 | G97: 95.00 | H97: 8.83 | I97: 20 | J97: 36 | K97: 8.96 | L97: 4050000 | N97: 301525127
A98: =A97+1 -> 97 | B98: 21300434 | C98: Võ Duy | D98: Công | E98: 050895 | F98: CK13CK05 | G98: 100.00 | H98: 8.65 | I98: 20 | J98: 36 | K98: 8.92 | L98: 4050000 | N98: 212671186
A99: =A98+1 -> 98 | B99: 21301056 | C99: Nguyễn Văn Sơn | D99: Hải | E99: 111194 | F99: CK13CK06 | G99: 95.00 | H99: 8.58 | I99: 18 | J99: 34 | K99: 8.76 | L99: 4050000 | N99: 250887383
A100: =A99+1 -> 99 | B100: 21303503 | C100: Huỳnh Thanh | D100: Tâm | E100: 290695 | F100: CK13CK11 | G100: 95.00 | H100: 8.58 | I100: 20 | J100: 36 | K100: 8.76 | L100: 4050000 | N100: 321514486
A101: =A100+1 -> 100 | B101: 21301963 | C101: Trần Tuấn | D101: Kiệt | E101: 240895 | F101: CK13CK03 | G101: 100.00 | H101: 8.44 | I101: 18 | J101: 42 | K101: 8.75 | L101: 4050000 | N101: 212496357
A102: =A101+1 -> 101 | B102: 21300319 | C102: Phạm Trường | D102: Bình | E102: 101095 | F102: CK13CK04 | G102: 100.00 | H102: 8.42 | I102: 18 | J102: 34 | K102: 8.74 | L102: 4050000 | N102: 205704425
A103: =A102+1 -> 102 | B103: 21302037 | C103: Nguyễn Văn | D103: Liêm | E103: 200295 | F103: CK13CK08 | G103: 100.00 | H103: 8.38 | I103: 20 | J103: 36 | K103: 8.70 | L103: 4050000 | N103: 381791410
A104: =A103+1 -> 103 | B104: 21301995 | C104: Ngô Triết | D104: Lãm | E104: 061295 | F104: CK13CK08 | G104: 100.00 | H104: 8.35 | I104: 20 | J104: 36 | K104: 8.68 | L104: 4050000 | N104: 362444529
A105: =A104+1 -> 104 | B105: 21300007 | C105: Hoàng Văn | D105: An | E105: 181295 | F105: CK13CK02 | G105: 90.00 | H105: 8.58 | I105: 20 | J105: 36 | K105: 8.66 | L105: 4050000 | N105: 250943263
A106: =A105+1 -> 105 | B106: 21304661 | C106: Phan Hữu Thanh | D106: Tú | E106: 140295 | F106: CK13CK13 | G106: 100.00 | H106: 8.33 | I106: 20 | J106: 36 | K106: 8.66 | L106: 4050000 | N106: 281053888
A107: =A106+1 -> 106 | B107: 21303683 | C107: Phạm Minh Thiên | D107: Thành | E107: 160695 | F107: CK13CK11 | G107: 90.00 | H107: 8.56 | I107: 18 | J107: 34 | K107: 8.65 | L107: 4050000 | N107: 225756906
A108: =A107+1 -> 107 | B108: 21300382 | C108: Trần Minh | D108: Chiến | E108: 181095 | F108: CK13CK02 | G108: 90.00 | H108: 8.55 | I108: 20 | J108: 38 | K108: 8.64 | L108: 4050000 | N108: 301537591
A109: =A108+1 -> 108 | B109: 21302843 | C109: Nguyễn Minh | D109: Nhựt | E109: 010895 | F109: CK13CK05 | G109: 95.00 | H109: 8.43 | I109: 20 | J109: 38 | K109: 8.64 | L109: 4050000 | N109: 312269742
A110: =A109+1 -> 109 | B110: 21304292 | C110: Nguyễn Trọng | D110: Trân | E110: 200795 | F110: CK13CK12 | G110: 85.00 | H110: 8.67 | I110: 18 | J110: 34 | K110: 8.64 | L110: 4050000 | N110: 212822272
A111: =A110+1 -> 110 | B111: 21301299 | C111: Trần Minh | D111: Hoài | E111: 240595 | F111: CK13CK07 | G111: 100.00 | H111: 8.28 | I111: 20 | J111: 36 | K111: 8.62 | L111: 4050000 | N111: 261323543
A112: =A111+1 -> 111 | B112: 21303538 | C112: Huỳnh Nhựt | D112: Tân | E112: 281195 | F112: CK13CK11 | G112: 95.00 | H112: 8.36 | I112: 18 | J112: 34 | K112: 8.59 | L112: 4050000 | N112: 352318537
A113: =A112+1 -> 112 | B113: 21303184 | C113: Trần | D113: Quang | E113: 221295 | F113: CK13CK09 | G113: 95.00 | H113: 8.35 | I113: 20 | J113: 40 | K113: 8.58 | L113: 4050000 | N113: 272546150
A114: =A113+1 -> 113 | B114: 21302163 | C114: Phạm Thành | D114: Long | E114: 291195 | F114: CK13CK04 | G114: 85.00 | H114: 8.55 | I114: 20 | J114: 38 | K114: 8.54 | L114: 4050000 | N114: 281079151
A115: =A114+1 -> 114 | B115: 21303394 | C115: Bùi Hoàng | D115: Sơn | E115: 290495 | F115: CK13CK11 | G115: 90.00 | H115: 8.43 | I115: 20 | J115: 38 | K115: 8.54 | L115: 4050000 | N115: 334825018
A116: =A115+1 -> 115 | B116: 21303402 | C116: Huỳnh Văn Ngọc | D116: Sơn | E116: 071095 | F116: CK13CK09 | G116: 95.00 | H116: 8.28 | I116: 20 | J116: 40 | K116: 8.52 | L116: 4050000 | N116: 321524524
A117: =A116+1 -> 116 | B117: 21303961 | C117: Tô Văn | D117: Thông | E117: 030995 | F117: CK13CK12 | G117: 92.00 | H117: 8.30 | I117: 20 | J117: 36 | K117: 8.48 | L117: 4050000 | N117: 281081701
A118: =A117+1 -> 117 | B118: 21303498 | C118: Dương Thị Minh | D118: Tâm | E118: 050295 | F118: CK13DM | G118: 90.00 | H118: 8.02 | I118: 21 | J118: 39 | K118: 8.22 | L118: 4050000 | N118: 321577703
A119: =A118+1 -> 118 | B119: 21304325 | C119: Lưu Đỗ Khánh | D119: Trinh | E119: 071195 | F119: CK13DM | G119: 90.00 | H119: 8.02 | I119: 21 | J119: 37 | K119: 8.22 | L119: 4050000 | N119: 272458538
A120: =A119+1 -> 119 | B120: 21303979 | C120: Dương Cẩm | D120: Thu | E120: 201295 | F120: CK13DM | G120: 90.00 | H120: 7.88 | I120: 21 | J120: 37 | K120: 8.10 | L120: 4050000 | N120: 331740998
A121: =A120+1 -> 120 | B121: 21301688 | C121: Trần Võ Thảo | D121: Hương | E121: 020895 | F121: CK13HT2 | G121: 100.00 | H121: 8.95 | I121: 20 | J121: 40 | K121: 9.16 | L121: 4860000 | N121: 025668230
A122: =A121+1 -> 121 | B122: 21300149 | C122: Trần Tuyết | D122: Anh | E122: 270395 | F122: CK13HT1 | G122: 90.00 | H122: 7.90 | I122: 20 | J122: 38 | K122: 8.12 | L122: 4050000 | N122: 272530005
A123: =A122+1 -> 122 | B123: 21302012 | C123: Nguyễn ánh | D123: Lâm | E123: 010295 | F123: CK13HT1 | G123: 100.00 | H123: 7.64 | I123: 18 | J123: 34 | K123: 8.11 | L123: 4050000 | N123: 212715246
A124: =A123+1 -> 123 | B124: 31000754 | C124: Phạm Đình | D124: Đức | E124: 300492 | F124: DC10KK | G124: 95.00 | H124: 9.24 | I124: 17 | J124: 144 | K124: 9.29 | L124: 4860000 | N124: 241332312
A125: =A124+1 -> 124 | B125: 31000223 | C125: Nguyễn Duy | D125: Bình | E125: 251192 | F125: DC10KK | G125: 100.00 | H125: 9.10 | I125: 15 | J125: 144 | K125: 9.28 | L125: 4860000 | N125: 221336947
A126: =A125+1 -> 125 | B126: 31000626 | C126: Nghiêm Xuân | D126: Đạt | E126: 300992 | F126: DC10DK | G126: 100.00 | H126: 8.88 | I126: 16 | J126: 146 | K126: 9.10 | L126: 4860000 | N126: 241208269
A127: =A126+1 -> 126 | B127: 31001265 | C127: Phạm Quốc | D127: Huy | E127: 120992 | F127: DC10DK | G127: 95.00 | H127: 8.94 | I127: 16 | J127: 146 | K127: 9.05 | L127: 4860000 | N127: 025348666
A128: =A127+1 -> 127 | B128: 31002300 | C128: Lê Hoàng | D128: Nhu | E128: 191292 | F128: DC10DK | G128: 100.00 | H128: 8.78 | I128: 18 | J128: 146 | K128: 9.02 | L128: 4860000 | N128: 341662561
A129: =A128+1 -> 128 | B129: 31002056 | C129: Trần Thành | D129: Nam | E129: 190492 | F129: DC10DK | G129: 100.00 | H129: 8.72 | I129: 16 | J129: 146 | K129: 8.98 | L129: 4050000 | N129: 024760241
A130: =A129+1 -> 129 | B130: 31004133 | C130: Trần Quốc | D130: Vương | E130: 081192 | F130: DC10KS | G130: 95.00 | H130: 8.71 | I130: 12 | J130: 143 | K130: 8.87 | L130: 4050000 | N130: 215213023
A131: =A130+1 -> 130 | B131: 31100614 | C131: Đào Quốc | D131: Dũng | E131: 290993 | F131: DC11KK | G131: 100.00 | H131: 8.75 | I131: 16 | J131: 111 | K131: 9.00 | L131: 4860000 | N131: 187349272
A132: =A131+1 -> 131 | B132: 31102082 | C132: Phan Huỳnh Nhất | D132: Minh | E132: 260393 | F132: DC11KK | G132: 100.00 | H132: 8.72 | I132: 18 | J132: 113 | K132: 8.98 | L132: 4050000 | N132: 362412305
A133: =A132+1 -> 132 | B133: 31101219 | C133: Hồ Huy | D133: Hoàng | E133: 310193 | F133: DC11KK | G133: 100.00 | H133: 8.59 | I133: 16 | J133: 109 | K133: 8.87 | L133: 4050000 | N133: 250883455
A134: =A133+1 -> 133 | B134: 31101592 | C134: Nguyễn Trường | D134: Khánh | E134: 260593 | F134: DC11DK | G134: 97.00 | H134: 8.59 | I134: 17 | J134: 131 | K134: 8.81 | L134: 4050000 | N134: 191800739
A135: =A134+1 -> 134 | B135: 31103956 | C135: Bùi Huỳnh | D135: Tuấn | E135: 210693 | F135: DC11DK | G135: 100.00 | H135: 8.48 | I135: 20 | J135: 115 | K135: 8.78 | L135: 4050000 | N135: 215371608
A136: =A135+1 -> 135 | B136: 31100183 | C136: Trần Bảo | D136: Ân | E136: 140893 | F136: DC11DK | G136: 100.00 | H136: 8.39 | I136: 18 | J136: 111 | K136: 8.71 | L136: 4050000 | N136: 024941328
A137: =A136+1 -> 136 | B137: 31101635 | C137: Lê Nguyên | D137: Khoa | E137: 060393 | F137: DC11DK | G137: 97.00 | H137: 8.34 | I137: 16 | J137: 111 | K137: 8.61 | L137: 4050000 | N137: 225485557
A138: =A137+1 -> 137 | B138: 31104403 | C138: Phạm Văn | D138: Yên | E138: 280593 | F138: DC11DK | G138: 97.00 | H138: 8.34 | I138: 22 | J138: 111 | K138: 8.61 | L138: 4050000 | N138: 212789894
A139: =A138+1 -> 138 | B139: 31200422 | C139: Huỳnh Minh | D139: Cường | E139: 121194 | F139: DC12DK | G139: 100.00 | H139: 8.90 | I139: 15 | J139: 75 | K139: 9.12 | L139: 4860000 | N139: 025445617
A140: =A139+1 -> 139 | B140: 31100228 | C140: Nguyễn Ngọc | D140: Bảo | E140: 150593 | F140: DC11KT | G140: 100.00 | H140: 8.89 | I140: 23 | J140: 140 | K140: 9.11 | L140: 4860000 | N140: 250901377
A141: =A140+1 -> 140 | B141: 31202852 | C141: Nguyễn Hoàng | D141: Phương | E141: 290694 | F141: DC12KK | G141: 100.00 | H141: 8.69 | I141: 21 | J141: 81 | K141: 8.95 | L141: 4050000 | N141: 025791026
A142: =A141+1 -> 141 | B142: 31200383 | C142: Nguyễn Nguyên | D142: Chương | E142: 121194 | F142: DC12DK | G142: 100.00 | H142: 8.60 | I142: 15 | J142: 77 | K142: 8.88 | L142: 4050000 | N142: 025189921
A143: =A142+1 -> 142 | B143: 31202784 | C143: Hồ Hoàng | D143: Phúc | E143: 200694 | F143: DC12KK | G143: 90.00 | H143: 8.80 | I143: 15 | J143: 75 | K143: 8.84 | L143: 4050000 | N143: 233184001
A144: =A143+1 -> 143 | B144: 31204217 | C144: Nguyễn Nhật | D144: Trường | E144: 271094 | F144: DC12DK | G144: 100.00 | H144: 8.47 | I144: 15 | J144: 75 | K144: 8.78 | L144: 4050000 | N144: 221363117
A145: =A144+1 -> 144 | B145: 31204446 | C145: Phan Thị Thanh | D145: Uyên | E145: 280394 | F145: DC12DK | G145: 100.00 | H145: 8.47 | I145: 15 | J145: 75 | K145: 8.78 | L145: 4050000 | N145: 205900020
A146: =A145+1 -> 145 | B146: 31301541 | C146: Trương Minh | D146: Huy | E146: 051095 | F146: DC1301 | G146: 100.00 | H146: 8.85 | I146: 20 | J146: 40 | K146: 9.08 | L146: 4860000 | N146: 025308659
A147: =A146+1 -> 146 | B147: 31303854 | C147: Nguyễn Hữu | D147: Thiện | E147: 140795 | F147: DC1301 | G147: 100.00 | H147: 8.80 | I147: 20 | J147: 40 | K147: 9.04 | L147: 4860000 | N147: 225750477
A148: =A147+1 -> 147 | B148: 31304532 | C148: Kiều Quang | D148: Tuấn | E148: 300695 | F148: DC1301 | G148: 100.00 | H148: 8.73 | I148: 20 | J148: 40 | K148: 8.98 | L148: 4050000 | N148: 225553798
A149: =A148+1 -> 148 | B149: 31304724 | C149: Lê Văn | D149: Tỷ | E149: 290895 | F149: DC1304 | G149: 100.00 | H149: 8.61 | I149: 18 | J149: 38 | K149: 8.89 | L149: 4050000 | N149: 025213705
A150: =A149+1 -> 149 | B150: 31303383 | C150: Lê Thiên | D150: Sinh | E150: 150895 | F150: DC1303 | G150: 100.00 | H150: 8.60 | I150: 20 | J150: 36 | K150: 8.88 | L150: 4050000 | N150: 197339986
A151: =A150+1 -> 150 | B151: 31304142 | C151: Hồ Trọng | D151: Tín | E151: 270695 | F151: DC1304 | G151: 100.00 | H151: 8.58 | I151: 20 | J151: 36 | K151: 8.86 | L151: 4050000 | N151: 273567100
A152: =A151+1 -> 151 | B152: 31302689 | C152: Hà Danh | D152: Nhân | E152: 170195 | F152: DC1301 | G152: 100.00 | H152: 8.18 | I152: 20 | J152: 40 | K152: 8.54 | L152: 4050000 | N152: 321546637
A153: =A152+1 -> 152 | B153: 31304512 | C153: Phạm Bá | D153: Tuân | E153: 021095 | F153: DC1301 | G153: 95.00 | H153: 8.28 | I153: 18 | J153: 42 | K153: 8.52 | L153: 4050000 | N153: 025628704
A154: =A153+1 -> 153 | B154: 41003703 | C154: Cao Văn | D154: Trường | E154: 200992 | F154: DD10KSKT | G154: 90.00 | H154: 9.88 | I154: 4 | J154: 148 | K154: 9.70 | L154: 4860000 | N154: 221325626
A155: =A154+1 -> 154 | B155: 41001165 | C155: Phạm Ngọc | D155: Hòa | E155: 050992 | F155: DD10KSTD | G155: 100.00 | H155: 9.58 | I155: 12 | J155: 145 | K155: 9.66 | L155: 4860000 | N155: 273384710
A156: =A155+1 -> 155 | B156: 41002115 | C156: Nguyễn Trần Trọng | D156: Nghĩa | E156: 130292 | F156: DD10KSTD | G156: 100.00 | H156: 9.58 | I156: 12 | J156: 145 | K156: 9.66 | L156: 4860000 | N156: 341673761
A157: =A156+1 -> 156 | B157: 41004080 | C157: Nguyễn Khắc | D157: Vũ | E157: 271192 | F157: DD10KSTD | G157: 100.00 | H157: 9.50 | I157: 10 | J157: 145 | K157: 9.60 | L157: 4860000 | N157: 221327243
A158: =A157+1 -> 157 | B158: 41001270 | C158: Quách Gia | D158: Huy | E158: 210792 | F158: DD10KSTD | G158: 100.00 | H158: 9.38 | I158: 12 | J158: 145 | K158: 9.50 | L158: 4860000 | N158: 371457671
A159: =A158+1 -> 158 | B159: 41001554 | C159: Phan Đăng | D159: Khoa | E159: 190192 | F159: DD10KSTD | G159: 100.00 | H159: 9.37 | I159: 15 | J159: 153 | K159: 9.50 | L159: 4860000 | N159: 334649657
A160: =A159+1 -> 159 | B160: 41001160 | C160: Nguyễn Khánh | D160: Hòa | E160: 290392 | F160: DD10KTD2 | G160: 100.00 | H160: 9.36 | I160: 14 | J160: 141 | K160: 9.49 | L160: 4860000 | N160: 225486299
A161: =A160+1 -> 160 | B161: 41003266 | C161: Trần Minh | D161: Thông | E161: 270592 | F161: DD10KSTD | G161: 100.00 | H161: 9.35 | I161: 10 | J161: 145 | K161: 9.48 | L161: 4860000 | N161: 321421059
A162: =A161+1 -> 161 | B162: 41003388 | C162: Trần Trung | D162: Tiến | E162: 271092 | F162: DD10KSTD | G162: 100.00 | H162: 9.31 | I162: 16 | J162: 147 | K162: 9.45 | L162: 4860000 | N162: 331654222
A163: =A162+1 -> 162 | B163: 41003699 | C163: Nguyễn Văn | D163: Trúc | E163: 211292 | F163: DD10KSKT | G163: 95.00 | H163: 9.41 | I163: 16 | J163: 143 | K163: 9.43 | L163: 4860000 | N163: 215217823
A164: =A163+1 -> 163 | B164: 41001018 | C164: Trương Thanh | D164: Hiền | E164: 160392 | F164: DD10TD2 | G164: 100.00 | H164: 9.25 | I164: 8 | J164: 145 | K164: 9.40 | L164: 4860000 | N164: 191784659
A165: =A164+1 -> 164 | B165: 41000709 | C165: Ngô Quang | D165: Đông | E165: 240692 | F165: DD10KSTD | G165: 100.00 | H165: 9.13 | I165: 12 | J165: 145 | K165: 9.30 | L165: 4860000 | N165: 341542496
A166: =A165+1 -> 165 | B166: 41000859 | C166: Nguyễn Trọng | D166: Hải | E166: 120291 | F166: DD10KSKT | G166: 100.00 | H166: 9.13 | I166: 15 | J166: 146 | K166: 9.30 | L166: 4860000 | N166: 272170608
A167: =A166+1 -> 166 | B167: 41002904 | C167: Nguyễn Ngọc | D167: Tân | E167: 020492 | F167: DD10KSTD | G167: 100.00 | H167: 9.11 | I167: 14 | J167: 145 | K167: 9.29 | L167: 4860000 | N167: 191757031
A168: =A167+1 -> 167 | B168: 41001694 | C168: Phan Trọng | D168: Lễ | E168: 040492 | F168: DD10DV3 | G168: 95.00 | H168: 9.21 | I168: 12 | J168: 146 | K168: 9.27 | L168: 4860000 | N168: 024782393
A169: =A168+1 -> 168 | B169: 41001988 | C169: Vũ Nhật | D169: Minh | E169: 210792 | F169: DD10KSTD | G169: 100.00 | H169: 9.08 | I169: 12 | J169: 149 | K169: 9.26 | L169: 4860000 | N169: 225523034
A170: =A169+1 -> 169 | B170: 41003960 | C170: Ưng Văn | D170: Viên | E170: 070192 | F170: DD10TD2 | G170: 100.00 | H170: 9.08 | I170: 12 | J170: 145 | K170: 9.26 | L170: 4860000 | N170: 250914068
A171: =A170+1 -> 170 | B171: 41002525 | C171: Nguyễn Lê | D171: Phương | E171: 100692 | F171: DD10TD1 | G171: 90.00 | H171: 9.29 | I171: 12 | J171: 145 | K171: 9.23 | L171: 4860000 | N171: 221299378
A172: =A171+1 -> 171 | B172: 41000101 | C172: Phạm Trần | D172: Anh | E172: 270192 | F172: DD10KSTD | G172: 100.00 | H172: 9.00 | I172: 12 | J172: 145 | K172: 9.20 | L172: 4860000 | N172: 212568415
A173: =A172+1 -> 172 | B173: 41000189 | C173: Trần Hữu | D173: Bảo | E173: 100492 | F173: DD10KSKT | G173: 90.00 | H173: 9.25 | I173: 10 | J173: 148 | K173: 9.20 | L173: 4860000 | N173: 250823845
A174: =A173+1 -> 173 | B174: 41000711 | C174: Nguyễn Tấn | D174: Đông | E174: 251192 | F174: DD10KSTD | G174: 100.00 | H174: 9.00 | I174: 19 | J174: 155 | K174: 9.20 | L174: 4860000 | N174: 212360556
A175: =A174+1 -> 174 | B175: 41003905 | C175: Vũ Anh | D175: Tùng | E175: 041292 | F175: DD10KSTD | G175: 100.00 | H175: 9.00 | I175: 14 | J175: 151 | K175: 9.20 | L175: 4860000 | N175: 024641785
A176: =A175+1 -> 175 | B176: 41002494 | C176: Nguyễn Đặng Anh | D176: Phụng | E176: 060292 | F176: DD10KTD4 | G176: 90.00 | H176: 9.21 | I176: 12 | J176: 148 | K176: 9.17 | L176: 4860000 | N176: 024703594
A177: =A176+1 -> 176 | B177: 41000722 | C177: Cù Xuân | D177: Đức | E177: 071292 | F177: DD10TD1 | G177: 95.00 | H177: 9.07 | I177: 14 | J177: 147 | K177: 9.16 | L177: 4860000 | N177: 025098694
A178: =A177+1 -> 177 | B178: 41000372 | C178: Nguyễn Quốc | D178: Cường | E178: 101092 | F178: DD10KTD1 | G178: 95.00 | H178: 9.06 | I178: 9 | J178: 150 | K178: 9.15 | L178: 4860000 | N178: 273405929
A179: =A178+1 -> 178 | B179: 41003705 | C179: Lê Quang | D179: Trường | E179: 280392 | F179: DD10KSVT | G179: 100.00 | H179: 8.91 | I179: 11 | J179: 147 | K179: 9.13 | L179: 4860000 | N179: 321442956
A180: =A179+1 -> 179 | B180: 41001122 | C180: Nguyễn Vũ Nhật | D180: Hoàng | E180: 210892 | F180: DD10KSTD | G180: 100.00 | H180: 8.88 | I180: 12 | J180: 145 | K180: 9.10 | L180: 4860000 | N180: 191759342
A181: =A180+1 -> 180 | B181: 41102802 | C181: Trần Văn | D181: Quốc | E181: 93 | F181: DD11KSTD | G181: 95.00 | H181: 9.22 | I181: 18 | J181: 113 | K181: 9.28 | L181: 4860000 | N181: 281010238
A182: =A181+1 -> 181 | B182: 41103854 | C182: Đỗ Hữu Phương | D182: Trung | E182: 280393 | F182: DD11KSTD | G182: 95.00 | H182: 8.95 | I182: 20 | J182: 118 | K182: 9.06 | L182: 4860000 | N182: 024941008
A183: =A182+1 -> 182 | B183: 41101528 | C183: Lê Trọng | D183: Hữu | E183: 280393 | F183: DD11KSTD | G183: 100.00 | H183: 8.81 | I183: 18 | J183: 113 | K183: 9.05 | L183: 4860000 | N183: 272147559
A184: =A183+1 -> 183 | B184: 41101154 | C184: Đinh Thái | D184: Hiển | E184: 070193 | F184: DD11TD2 | G184: 100.00 | H184: 8.75 | I184: 18 | J184: 113 | K184: 9.00 | L184: 4860000 | N184: 371454820
A185: =A184+1 -> 184 | B185: 41102895 | C185: Bùi Đức | D185: Sinh | E185: 191293 | F185: DD11KSVT | G185: 100.00 | H185: 8.59 | I185: 17 | J185: 112 | K185: 8.87 | L185: 4050000 | N185: 215267708
A186: =A185+1 -> 185 | B186: 41102309 | C186: Phan Nhật | D186: Nguyên | E186: 050893 | F186: DD11KSTD | G186: 100.00 | H186: 8.58 | I186: 18 | J186: 113 | K186: 8.86 | L186: 4050000 | N186: 273526840
A187: =A186+1 -> 186 | B187: 41100326 | C187: Vũ Văn | D187: Bình | E187: 111093 | F187: DD11TD1 | G187: 98.00 | H187: 8.56 | I187: 18 | J187: 113 | K187: 8.81 | L187: 4050000 | N187: 285378183
A188: =A187+1 -> 187 | B188: 41101271 | C188: Bùi Thái | D188: Hòa | E188: 060893 | F188: DD11KTD2 | G188: 100.00 | H188: 8.44 | I188: 18 | J188: 121 | K188: 8.75 | L188: 4050000 | N188: 024788179
A189: =A188+1 -> 188 | B189: 41103373 | C189: Phan Ngọc | D189: Thiện | E189: 160293 | F189: DD11KSVT | G189: 100.00 | H189: 8.44 | I189: 17 | J189: 112 | K189: 8.75 | L189: 4050000 | N189: 215210337
A190: =A189+1 -> 189 | B190: 41102148 | C190: Nguyễn Phạm Hải | D190: Nam | E190: 230693 | F190: DD11KSTD | G190: 100.00 | H190: 8.41 | I190: 16 | J190: 117 | K190: 8.73 | L190: 4050000 | N190: 362387252
A191: =A190+1 -> 190 | B191: 41101365 | C191: Nguyễn Quốc | D191: Huy | E191: 110493 | F191: DD11KSTD | G191: 85.00 | H191: 8.78 | I191: 18 | J191: 116 | K191: 8.72 | L191: 4050000 | N191: 024881363
A192: =A191+1 -> 191 | B192: 41103744 | C192: Nguyễn Đỗ Thanh | D192: Trà | E192: 150593 | F192: DD11KSTD | G192: 90.00 | H192: 8.64 | I192: 18 | J192: 116 | K192: 8.71 | L192: 4050000 | N192: 024864014
A193: =A192+1 -> 192 | B193: 41100531 | C193: Ng Trọng Ngô Nhật | D193: Du | E193: 060993 | F193: DD11KSVT | G193: 100.00 | H193: 8.38 | I193: 17 | J193: 119 | K193: 8.70 | L193: 4050000 | N193: 321453635
A194: =A193+1 -> 193 | B194: 41101313 | C194: Nguyễn Đình | D194: Huân | E194: 201193 | F194: DD11KSTD | G194: 100.00 | H194: 8.31 | I194: 18 | J194: 112 | K194: 8.65 | L194: 4050000 | N194: 025133961
A195: =A194+1 -> 194 | B195: 41101844 | C195: Nguyễn Thị Tài | D195: Linh | E195: 270793 | F195: DD11TD2 | G195: 100.00 | H195: 8.28 | I195: 20 | J195: 115 | K195: 8.62 | L195: 4050000 | N195: 321530994
A196: =A195+1 -> 195 | B196: 41101478 | C196: Nguyễn Gia | D196: Hưng | E196: 140993 | F196: DD11KSTD | G196: 80.00 | H196: 8.75 | I196: 18 | J196: 113 | K196: 8.60 | L196: 4050000 | N196: 291093476
A197: =A196+1 -> 196 | B197: 41101686 | C197: Nguyễn Văn | D197: Khởi | E197: 220693 | F197: DD11KTD3 | G197: 85.00 | H197: 8.63 | I197: 19 | J197: 111 | K197: 8.60 | L197: 4050000 | N197: 215323814
A198: =A197+1 -> 197 | B198: 41104115 | C198: Nguyễn Thanh | D198: Tùng | E198: 130893 | F198: DD11KSVT | G198: 90.00 | H198: 8.50 | I198: 15 | J198: 117 | K198: 8.60 | L198: 4050000 | N198: 272352775
A199: =A198+1 -> 198 | B199: 41103138 | C199: Nguyễn Phi Quốc | D199: Thanh | E199: 260893 | F199: DD11KSVT | G199: 90.00 | H199: 8.41 | I199: 17 | J199: 112 | K199: 8.53 | L199: 4050000 | N199: 025432306
A200: =A199+1 -> 199 | B200: 41102617 | C200: Nguyễn Phạm Hồng | D200: Phúc | E200: 081193 | F200: DD11KSTD | G200: 90.00 | H200: 8.38 | I200: 20 | J200: 115 | K200: 8.50 | L200: 4050000 | N200: 321471263
A201: =A200+1 -> 200 | B201: 41103164 | C201: Dương Nguyễn Thành | D201: Thái | E201: 281193 | F201: DD11KSVT | G201: 100.00 | H201: 8.10 | I201: 15 | J201: 112 | K201: 8.48 | L201: 4050000 | N201: 272185633
A202: =A201+1 -> 201 | B202: 41101968 | C202: Trần Lê Trọng | D202: Lợi | E202: 190993 | F202: DD11KTD3 | G202: 90.00 | H202: 8.31 | I202: 18 | J202: 113 | K202: 8.45 | L202: 4050000 | N202: 215199942
A203: =A202+1 -> 202 | B203: 41104317 | C203: Phan Tuấn | D203: Vũ | E203: 101093 | F203: DD11KSTD | G203: 90.00 | H203: 8.31 | I203: 18 | J203: 112 | K203: 8.45 | L203: 4050000 | N203: 321483583
A204: =A203+1 -> 203 | B204: 41103202 | C204: Huỳnh Văn | D204: Thành | E204: 200493 | F204: DD11DV6 | G204: 100.00 | H204: 8.03 | I204: 17 | J204: 109 | K204: 8.42 | L204: 4050000 | N204: 245185020
A205: =A204+1 -> 204 | B205: 41103618 | C205: Trương Quốc | D205: Tiến | E205: 250293 | F205: DD11KTD5 | G205: 95.00 | H205: 8.11 | I205: 18 | J205: 112 | K205: 8.39 | L205: 4050000 | N205: 272159886
A206: =A205+1 -> 205 | B206: 41102964 | C206: Trương Ngọc | D206: Sơn | E206: 231093 | F206: DD11KSTD | G206: 80.00 | H206: 8.48 | I206: 20 | J206: 114 | K206: 8.38 | L206: 4050000 | N206: 205771906
A207: =A206+1 -> 206 | B207: 41100306 | C207: Nguyễn Thanh | D207: Bình | E207: 181293 | F207: DD11KSTD | G207: 95.00 | H207: 8.08 | I207: 20 | J207: 109 | K207: 8.36 | L207: 4050000 | N207: 371523192
A208: =A207+1 -> 207 | B208: 41103573 | C208: Nguyễn Văn | D208: Tiên | E208: 160493 | F208: DD11KSTD | G208: 90.00 | H208: 8.17 | I208: 18 | J208: 115 | K208: 8.34 | L208: 4050000 | N208: 205648067
A209: =A208+1 -> 208 | B209: 41103611 | C209: Trần Hữu | D209: Tiến | E209: 310793 | F209: DD11KTD5 | G209: 90.00 | H209: 8.18 | I209: 19 | J209: 113 | K209: 8.34 | L209: 4050000 | N209: 312149844
A210: =A209+1 -> 209 | B210: 41100371 | C210: Dương Duy | D210: Chiến | E210: 220993 | F210: DD11TD1 | G210: 95.00 | H210: 8.00 | I210: 16 | J210: 107 | K210: 8.30 | L210: 4050000 | N210: 273518343
A211: =A210+1 -> 210 | B211: 41101858 | C211: Trần Nguyễn Nhật | D211: Linh | E211: 260393 | F211: DD11KSVT | G211: 100.00 | H211: 7.85 | I211: 17 | J211: 109 | K211: 8.28 | L211: 4050000 | N211: 225543689
A212: =A211+1 -> 211 | B212: 41102924 | C212: Lê Quang | D212: Sơn | E212: 061093 | F212: DD11KSTD | G212: 85.00 | H212: 8.17 | I212: 18 | J212: 114 | K212: 8.24 | L212: 4050000 | N212: 321443218
A213: =A212+1 -> 212 | B213: 41203579 | C213: Nguyễn Hoàng | D213: Thiện | E213: 070194 | F213: DD12KSTD | G213: 100.00 | H213: 9.03 | I213: 20 | J213: 81 | K213: 9.22 | L213: 4860000 | N213: 025068982
A214: =A213+1 -> 213 | B214: 41202184 | C214: Trương Tất Nhật | D214: Minh | E214: 300994 | F214: DD12KSTD | G214: 100.00 | H214: 9.00 | I214: 16 | J214: 75 | K214: 9.20 | L214: 4860000 | N214: 191821343
A215: =A214+1 -> 214 | B215: 41201356 | C215: Ngô Nguyễn Vũ | D215: Huy | E215: 121194 | F215: DD12LT06 | G215: 100.00 | H215: 8.94 | I215: 16 | J215: 77 | K215: 9.15 | L215: 4860000 | N215: 261304964
A216: =A215+1 -> 215 | B216: 41200189 | C216: Nguyễn Hoài | D216: Bảo | E216: 300994 | F216: DD12KSTD | G216: 90.00 | H216: 9.03 | I216: 16 | J216: 75 | K216: 9.02 | L216: 4860000 | N216: 212362396
A217: =A216+1 -> 216 | B217: 41201757 | C217: Nguyễn Hoàng | D217: Khương | E217: 090294 | F217: DD12KSTD | G217: 95.00 | H217: 8.75 | I217: 16 | J217: 75 | K217: 8.90 | L217: 4050000 | N217: 025040725
A218: =A217+1 -> 217 | B218: 41200648 | C218: Phan Trùng | D218: Dương | E218: 180594 | F218: DD12KSKT | G218: 100.00 | H218: 8.59 | I218: 16 | J218: 82 | K218: 8.87 | L218: 4050000 | N218: 341740853
A219: =A218+1 -> 218 | B219: 41201121 | C219: Tăng Quang | D219: Hiếu | E219: 150194 | F219: DD12KSVT | G219: 100.00 | H219: 8.50 | I219: 16 | J219: 75 | K219: 8.80 | L219: 4050000 | N219: 225572763
A220: =A219+1 -> 219 | B220: 41202785 | C220: Huỳnh Công | D220: Phúc | E220: 240794 | F220: DD12BK01 | G220: 95.00 | H220: 8.56 | I220: 16 | J220: 75 | K220: 8.75 | L220: 4050000 | N220: 024959326
A221: =A220+1 -> 220 | B221: 41200388 | C221: Lê Văn | D221: Chức | E221: 200694 | F221: DD12KSTD | G221: 100.00 | H221: 8.41 | I221: 16 | J221: 76 | K221: 8.73 | L221: 4050000 | N221: 212769979
A222: =A221+1 -> 221 | B222: 41201616 | C222: Đinh Gia | D222: Khánh | E222: 030294 | F222: DD12KSVT | G222: 95.00 | H222: 8.50 | I222: 20 | J222: 79 | K222: 8.70 | L222: 4050000 | N222: 205827926
A223: =A222+1 -> 222 | B223: 41204296 | C223: Nguyễn Văn | D223: Tuấn | E223: 071294 | F223: DD12KSTD | G223: 95.00 | H223: 8.44 | I223: 18 | J223: 75 | K223: 8.65 | L223: 4050000 | N223: 205900674
A224: =A223+1 -> 223 | B224: 41203533 | C224: Võ Phương | D224: Thế | E224: 290594 | F224: DD12KSTD | G224: 100.00 | H224: 8.28 | I224: 18 | J224: 75 | K224: 8.62 | L224: 4050000 | N224: 385567169
A225: =A224+1 -> 224 | B225: 41202287 | C225: Trần Đình | D225: Nam | E225: 221094 | F225: DD12BK01 | G225: 95.00 | H225: 8.39 | I225: 18 | J225: 78 | K225: 8.61 | L225: 4050000 | N225: 230983474
A226: =A225+1 -> 225 | B226: 41200723 | C226: Nguyễn Thành | D226: Đạt | E226: 261094 | F226: DD12KSTD | G226: 95.00 | H226: 8.38 | I226: 16 | J226: 75 | K226: 8.60 | L226: 4050000 | N226: 194494620
A227: =A226+1 -> 226 | B227: 41202820 | C227: Trương Hồng | D227: Phúc | E227: 180194 | F227: DD12LT07 | G227: 95.00 | H227: 8.36 | I227: 18 | J227: 84 | K227: 8.59 | L227: 4050000 | N227: 215223996
A228: =A227+1 -> 227 | B228: 41203697 | C228: Hồ Đắc | D228: Thuận | E228: 071294 | F228: DD12KSKT | G228: 95.00 | H228: 8.34 | I228: 16 | J228: 75 | K228: 8.57 | L228: 4050000 | N228: 272333687
A229: =A228+1 -> 228 | B229: 41200423 | C229: Lê Minh | D229: Cường | E229: 210294 | F229: DD12LT02 | G229: 90.00 | H229: 8.41 | I229: 16 | J229: 73 | K229: 8.53 | L229: 4050000 | N229: 285363896
A230: =A229+1 -> 229 | B230: 41202868 | C230: Nguyễn Tuấn | D230: Phương | E230: 100194 | F230: DD12KSVT | G230: 95.00 | H230: 8.28 | I230: 16 | J230: 80 | K230: 8.52 | L230: 4050000 | N230: 321450083
A231: =A230+1 -> 230 | B231: 41202697 | C231: Trần Thanh | D231: Phát | E231: 120394 | F231: DD12BK01 | G231: 90.00 | H231: 8.33 | I231: 18 | J231: 77 | K231: 8.46 | L231: 4050000 | N231: 025201988
A232: =A231+1 -> 231 | B232: 41204268 | C232: Lê Anh | D232: Tuấn | E232: 050694 | F232: DD12KSTD | G232: 100.00 | H232: 8.08 | I232: 18 | J232: 75 | K232: 8.46 | L232: 4050000 | N232: 212471028
A233: =A232+1 -> 232 | B233: 41204110 | C233: Trương Quang | D233: Trọng | E233: 041094 | F233: DD12LT14 | G233: 95.00 | H233: 8.09 | I233: 16 | J233: 75 | K233: 8.37 | L233: 4050000 | N233: 273552680
A234: =A233+1 -> 233 | B234: 41203668 | C234: Vũ Đức | D234: Thông | E234: 221094 | F234: DD12BK02 | G234: 100.00 | H234: 7.93 | I234: 20 | J234: 86 | K234: 8.34 | L234: 4050000 | N234: 025067865
A235: =A234+1 -> 234 | B235: 41201125 | C235: Trần Trung | D235: Hiếu | E235: 100694 | F235: DD12KSTD | G235: 95.00 | H235: 8.03 | I235: 19 | J235: 85 | K235: 8.32 | L235: 4050000 | N235: 291063862
A236: =A235+1 -> 235 | B236: 41203304 | C236: Nguyễn Trương Khắc | D236: Tân | E236: 171094 | F236: DD12KSTD | G236: 90.00 | H236: 8.09 | I236: 16 | J236: 75 | K236: 8.27 | L236: 4050000 | N236: 024973652
A237: =A236+1 -> 236 | B237: 41201095 | C237: Nguyễn Duy | D237: Hiếu | E237: 130494 | F237: CT12NAGA | G237: 90.00 | H237: 8.07 | I237: 14 | J237: 80 | K237: 8.26 | L237: 4050000 | N237: 025164380
A238: =A237+1 -> 237 | B238: 41204579 | C238: Nguyễn Duy | D238: Vĩnh | E238: 070394 | F238: DD12KSTD | G238: 100.00 | H238: 7.81 | I238: 18 | J238: 75 | K238: 8.25 | L238: 4050000 | N238: 225497581
A239: =A238+1 -> 238 | B239: 41201401 | C239: Trần Quang | D239: Huy | E239: 010794 | F239: DD12KSTD | G239: 95.00 | H239: 7.91 | I239: 16 | J239: 75 | K239: 8.23 | L239: 4050000 | N239: 272278717
A240: =A239+1 -> 239 | B240: 41201568 | C240: Trần | D240: Kha | E240: 300794 | F240: DD12LT08 | G240: 100.00 | H240: 7.78 | I240: 16 | J240: 73 | K240: 8.22 | L240: 4050000 | N240: 291073576
A241: =A240+1 -> 240 | B241: 41202058 | C241: Trần Hoàng | D241: Luân | E241: 021294 | F241: DD12KSTD | G241: 95.00 | H241: 7.88 | I241: 16 | J241: 75 | K241: 8.20 | L241: 4050000 | N241: 215328864
A242: =A241+1 -> 241 | B242: 41203386 | C242: Đào Đức | D242: Thành | E242: 180194 | F242: DD12LT08 | G242: 100.00 | H242: 7.75 | I242: 16 | J242: 71 | K242: 8.20 | L242: 4050000 | N242: 215248035
A243: =A242+1 -> 242 | B243: 41303135 | C243: Nguyễn Hồng | D243: Phước | E243: 110595 | F243: DD13BK01 | G243: 100.00 | H243: 9.22 | I243: 18 | J243: 34 | K243: 9.38 | L243: 4860000 | N243: 025249041
A244: =A243+1 -> 243 | B244: 41300948 | C244: Võ Hồng | D244: Đức | E244: 241095 | F244: DD13LT04 | G244: 100.00 | H244: 9.18 | I244: 20 | J244: 36 | K244: 9.34 | L244: 4860000 | N244: 241423111
A245: =A244+1 -> 244 | B245: 41300895 | C245: Nguyễn Phúc Anh | D245: Đồng | E245: 080495 | F245: DD13LT05 | G245: 95.00 | H245: 9.23 | I245: 20 | J245: 40 | K245: 9.28 | L245: 4860000 | N245: 273521972
A246: =A245+1 -> 245 | B246: 41300918 | C246: Lê Vạn | D246: Đức | E246: 040195 | F246: DD13LT04 | G246: 95.00 | H246: 9.03 | I246: 18 | J246: 34 | K246: 9.12 | L246: 4860000 | N246: 174710613
A247: =A246+1 -> 246 | B247: 41300679 | C247: Phạm Anh | D247: Dũng | E247: 060195 | F247: DD13LT09 | G247: 95.00 | H247: 9.00 | I247: 20 | J247: 36 | K247: 9.10 | L247: 4860000 | N247: 285467798
A248: =A247+1 -> 247 | B248: 41303057 | C248: Phan Hồng | D248: Phúc | E248: 120195 | F248: DD13LT10 | G248: 92.00 | H248: 8.98 | I248: 20 | J248: 38 | K248: 9.02 | L248: 4860000 | N248: 291096213
A249: =A248+1 -> 248 | B249: 41303609 | C249: Phạm Nguyễn Nhựt | D249: Thanh | E249: 210895 | F249: DD13LT03 | G249: 100.00 | H249: 8.78 | I249: 20 | J249: 40 | K249: 9.02 | L249: 4860000 | N249: 341849046
A250: =A249+1 -> 249 | B250: 41304865 | C250: Thái Bảo Hồng | D250: Võ | E250: 210695 | F250: DD13LT03 | G250: 100.00 | H250: 8.78 | I250: 20 | J250: 40 | K250: 9.02 | L250: 4860000 | N250: 312231044
A251: =A250+1 -> 250 | B251: 41304754 | C251: Lê Anh | D251: Văn | E251: 130295 | F251: DD13LT14 | G251: 95.00 | H251: 8.89 | I251: 18 | J251: 34 | K251: 9.01 | L251: 4860000 | N251: 212708719
A252: =A251+1 -> 251 | B252: 41300946 | C252: Trần Văn | D252: Đức | E252: 280395 | F252: DD13LT07 | G252: 95.00 | H252: 8.80 | I252: 20 | J252: 38 | K252: 8.94 | L252: 4050000 | N252: 241491765
A253: =A252+1 -> 252 | B253: 41301458 | C253: Lê Đình Gia | D253: Huy | E253: 250995 | F253: DD13LT01 | G253: 85.00 | H253: 9.05 | I253: 20 | J253: 40 | K253: 8.94 | L253: 4050000 | N253: 215304476
A254: =A253+1 -> 253 | B254: 41304716 | C254: Nguyễn Khánh | D254: Tường | E254: 290995 | F254: DD13LT03 | G254: 100.00 | H254: 8.65 | I254: 20 | J254: 40 | K254: 8.92 | L254: 4050000 | N254: 291134832
A255: =A254+1 -> 254 | B255: 41304696 | C255: Nguyễn Sơn | D255: Tùng | E255: 311095 | F255: DD13LT03 | G255: 100.00 | H255: 8.63 | I255: 20 | J255: 40 | K255: 8.90 | L255: 4050000 | N255: 025212590
A256: =A255+1 -> 255 | B256: 41300177 | C256: Bùi Hoàng Thiên | D256: Ân | E256: 230295 | F256: DD13LT06 | G256: 95.00 | H256: 8.73 | I256: 20 | J256: 38 | K256: 8.88 | L256: 4050000 | N256: 272288447
A257: =A256+1 -> 256 | B257: 41304858 | C257: Uông Sĩ | D257: Vinh | E257: 170395 | F257: DD13LT03 | G257: 100.00 | H257: 8.60 | I257: 20 | J257: 40 | K257: 8.88 | L257: 4050000 | N257: 225568175
A258: =A257+1 -> 257 | B258: 41303115 | C258: Ong Thế | D258: Phương | E258: 010595 | F258: DD13LT10 | G258: 95.00 | H258: 8.70 | I258: 20 | J258: 38 | K258: 8.86 | L258: 4050000 | N258: 272500466
A259: =A258+1 -> 258 | B259: 41300885 | C259: Nguyễn | D259: Đôn | E259: 270495 | F259: DD13LT01 | G259: 90.00 | H259: 8.80 | I259: 20 | J259: 40 | K259: 8.84 | L259: 4050000 | N259: 225567641
A260: =A259+1 -> 259 | B260: 41302626 | C260: Ngô Đức | D260: Nguyên | E260: 020995 | F260: DD13LT09 | G260: 95.00 | H260: 8.67 | I260: 18 | J260: 34 | K260: 8.84 | L260: 4050000 | N260: 241423010
A261: =A260+1 -> 260 | B261: 41303166 | C261: Lý Hớn | D261: Quang | E261: 070195 | F261: DD13BK02 | G261: 100.00 | H261: 8.53 | I261: 20 | J261: 40 | K261: 8.82 | L261: 4050000 | N261: 025304490
A262: =A261+1 -> 261 | B262: 41303019 | C262: Bùi Văn | D262: Phúc | E262: 280695 | F262: DD13LT11 | G262: 100.00 | H262: 8.50 | I262: 20 | J262: 36 | K262: 8.80 | L262: 4050000 | N262: 152113449
A263: =A262+1 -> 262 | B263: 41300166 | C263: Hồ Thiện | D263: ái | E263: 300395 | F263: DD13LT06 | G263: 100.00 | H263: 8.48 | I263: 20 | J263: 38 | K263: 8.78 | L263: 4050000 | N263: 321489755
A264: =A263+1 -> 263 | B264: 41301256 | C264: Lương Chấn | D264: Hiệp | E264: 270195 | F264: DD13LT01 | G264: 100.00 | H264: 8.45 | I264: 20 | J264: 40 | K264: 8.76 | L264: 4050000 | N264: 273524441
A265: =A264+1 -> 264 | B265: 41303823 | C265: Nguyễn Ân | D265: Thiên | E265: 030595 | F265: DD13LT11 | G265: 100.00 | H265: 8.45 | I265: 20 | J265: 38 | K265: 8.76 | L265: 4050000 | N265: 025311935
A266: =A265+1 -> 265 | B266: 41303684 | C266: Phạm Ngọc | D266: Thành | E266: 060495 | F266: DD13LT11 | G266: 96.00 | H266: 8.50 | I266: 20 | J266: 38 | K266: 8.72 | L266: 4050000 | N266: 273537392
A267: =A266+1 -> 266 | B267: 41303890 | C267: Lý Trường | D267: Thịnh | E267: 041295 | F267: DD13LT03 | G267: 95.00 | H267: 8.50 | I267: 20 | J267: 40 | K267: 8.70 | L267: 4050000 | N267: 312239968
A268: =A267+1 -> 267 | B268: 41300255 | C268: Phan Văn | D268: Bảo | E268: 130795 | F268: DD13LT02 | G268: 80.00 | H268: 8.85 | I268: 20 | J268: 36 | K268: 8.68 | L268: 4050000 | N268: 285561720
A269: =A268+1 -> 268 | B269: 41300543 | C269: Nguyễn Văn | D269: Dung | E269: 261295 | F269: DD13LT06 | G269: 90.00 | H269: 8.60 | I269: 20 | J269: 38 | K269: 8.68 | L269: 4050000 | N269: 212711781
A270: =A269+1 -> 269 | B270: 41301071 | C270: Đặng Kỳ | D270: Hảo | E270: 010395 | F270: DD13LT01 | G270: 90.00 | H270: 8.60 | I270: 20 | J270: 40 | K270: 8.68 | L270: 4050000 | N270: 272417591
A271: =A270+1 -> 270 | B271: 41301972 | C271: Võ Vạn | D271: Kim | E271: 051295 | F271: DD13BK01 | G271: 95.00 | H271: 8.47 | I271: 18 | J271: 34 | K271: 8.68 | L271: 4050000 | N271: 321510872
A272: =A271+1 -> 271 | B272: 41303125 | C272: Võ Trương Hoàng | D272: Phương | E272: 090295 | F272: DD13BK02 | G272: 100.00 | H272: 8.35 | I272: 20 | J272: 40 | K272: 8.68 | L272: 4050000 | N272: 025154592
A273: =A272+1 -> 272 | B273: 51000240 | C273: Vũ Lê Thanh | D273: Bình | E273: 121092 | F273: MT10KHTN | G273: 100.00 | H273: 9.50 | I273: 6 | J273: 139 | K273: 9.60 | L273: 4860000 | N273: 212566846
A274: =A273+1 -> 273 | B274: 51001048 | C274: Lê Vinh | D274: Hiệp | E274: 290392 | F274: MT10KHTN | G274: 100.00 | H274: 9.50 | I274: 9 | J274: 139 | K274: 9.60 | L274: 4860000 | N274: 352132422
A275: =A274+1 -> 274 | B275: 51003740 | C275: Đinh Quang | D275: Tuấn | E275: 080192 | F275: MT10KHTN | G275: 100.00 | H275: 9.50 | I275: 9 | J275: 139 | K275: 9.60 | L275: 4860000 | N275: 191746200
A276: =A275+1 -> 275 | B276: 51001127 | C276: Phan Nhật | D276: Hoàng | E276: 220192 | F276: MT10KHTN | G276: 100.00 | H276: 9.25 | I276: 12 | J276: 145 | K276: 9.40 | L276: 4860000 | N276: 201620774
A277: =A276+1 -> 276 | B277: 51004203 | C277: Lục Minh | D277: Tuấn | E277: 210791 | F277: MT10KH04 | G277: 95.00 | H277: 9.25 | I277: 10 | J277: 149 | K277: 9.30 | L277: 4860000 | N277: 250858466
A278: =A277+1 -> 277 | B278: 51004167 | C278: Nguyễn Huỳnh Như | D278: ý | E278: 200792 | F278: MT10KHTN | G278: 95.00 | H278: 9.25 | I278: 6 | J278: 141 | K278: 9.30 | L278: 4860000 | N278: 225523635
A279: =A278+1 -> 278 | B279: 51002279 | C279: Phạm Hữu Đăng | D279: Nhật | E279: 071292 | F279: MT10KTTN | G279: 100.00 | H279: 9.11 | I279: 14 | J279: 143 | K279: 9.29 | L279: 4860000 | N279: 191763810
A280: =A279+1 -> 279 | B280: 51001489 | C280: Nguyễn Trung | D280: Khánh | E280: 191292 | F280: MT10KTTN | G280: 100.00 | H280: 9.00 | I280: 12 | J280: 143 | K280: 9.20 | L280: 4860000 | N280: 285317928
A281: =A280+1 -> 280 | B281: 51003405 | C281: Huỳnh Trung | D281: Tín | E281: 150992 | F281: MT10KTTN | G281: 100.00 | H281: 9.00 | I281: 12 | J281: 143 | K281: 9.20 | L281: 4860000 | N281: 341539066
A282: =A281+1 -> 281 | B282: 51003857 | C282: Trần Đường | D282: Tú | E282: 121292 | F282: MT10KHTN | G282: 90.00 | H282: 9.25 | I282: 6 | J282: 139 | K282: 9.20 | L282: 4860000 | N282: 352134681
A283: =A282+1 -> 282 | B283: 51000579 | C283: Vũ Tiến | D283: Dưỡng | E283: 080392 | F283: MT10KHTN | G283: 95.00 | H283: 9.00 | I283: 10 | J283: 148 | K283: 9.10 | L283: 4860000 | N283: 264412416
A284: =A283+1 -> 283 | B284: 51001056 | C284: Phạm Văn | D284: Hiệp | E284: 211290 | F284: MT10KTTN | G284: 100.00 | H284: 8.82 | I284: 14 | J284: 143 | K284: 9.06 | L284: 4860000 | N284: 272156423
A285: =A284+1 -> 284 | B285: 51001228 | C285: Nguyễn Anh | D285: Huy | E285: 160592 | F285: MT10KHTN | G285: 100.00 | H285: 8.83 | I285: 9 | J285: 138 | K285: 9.06 | L285: 4860000 | N285: 201646579
A286: =A285+1 -> 285 | B286: 51001658 | C286: Nguyễn Hoài | D286: Lâm | E286: 221092 | F286: MT10KHTN | G286: 95.00 | H286: 8.92 | I286: 13 | J286: 149 | K286: 9.04 | L286: 4860000 | N286: 031670733
A287: =A286+1 -> 286 | B287: 51100710 | C287: Bùi Minh | D287: Đạo | E287: 010293 | F287: MT11KHTN | G287: 100.00 | H287: 9.53 | I287: 15 | J287: 122 | K287: 9.62 | L287: 4860000 | N287: 205617350
A288: =A287+1 -> 287 | B288: 51102403 | C288: Nguyễn Minh | D288: Nhật | E288: 070993 | F288: MT11KHTN | G288: 100.00 | H288: 9.00 | I288: 15 | J288: 113 | K288: 9.20 | L288: 4860000 | N288: 215198298
A289: =A288+1 -> 288 | B289: 51100976 | C289: Nguyễn Đức | D289: Hải | E289: 070193 | F289: MT11KTTN | G289: 100.00 | H289: 8.86 | I289: 14 | J289: 119 | K289: 9.09 | L289: 4860000 | N289: 250934426
A290: =A289+1 -> 289 | B290: 51100812 | C290: Võ Trọng Kỳ | D290: Đỉnh | E290: 181093 | F290: MT11KHTN | G290: 90.00 | H290: 9.10 | I290: 15 | J290: 123 | K290: 9.08 | L290: 4860000 | N290: 024892720
A291: =A290+1 -> 290 | B291: 51100296 | C291: Nguyễn Đôn | D291: Bình | E291: 151093 | F291: MT11KHTN | G291: 100.00 | H291: 8.69 | I291: 21 | J291: 118 | K291: 8.95 | L291: 4050000 | N291: 241283312
A292: =A291+1 -> 291 | B292: 51100421 | C292: Nguyễn Hồng | D292: Công | E292: 190493 | F292: MT11KHTN | G292: 100.00 | H292: 8.67 | I292: 15 | J292: 113 | K292: 8.94 | L292: 4050000 | N292: 212708724
A293: =A292+1 -> 292 | B293: 51103691 | C293: Nguyễn Đức | D293: Toàn | E293: 050593 | F293: MT11KHTN | G293: 100.00 | H293: 8.67 | I293: 15 | J293: 122 | K293: 8.94 | L293: 4050000 | N293: 321459895
A294: =A293+1 -> 293 | B294: 51101934 | C294: Đinh Hữu | D294: Lộc | E294: 200993 | F294: MT11KHTN | G294: 100.00 | H294: 8.62 | I294: 17 | J294: 115 | K294: 8.90 | L294: 4050000 | N294: 225568619
A295: =A294+1 -> 294 | B295: 51101800 | C295: Phạm Văn | D295: Lập | E295: 200493 | F295: MT11KHTN | G295: 100.00 | H295: 8.59 | I295: 16 | J295: 115 | K295: 8.87 | L295: 4050000 | N295: 197280414
A296: =A295+1 -> 295 | B296: 51102146 | C296: Nguyễn Nhật | D296: Nam | E296: 121293 | F296: MT11KTTN | G296: 100.00 | H296: 8.59 | I296: 16 | J296: 115 | K296: 8.87 | L296: 4050000 | N296: 215329069
A297: =A296+1 -> 296 | B297: 51100091 | C297: Nguyễn Duy | D297: Anh | E297: 051093 | F297: MT11KHTN | G297: 100.00 | H297: 8.57 | I297: 15 | J297: 125 | K297: 8.86 | L297: 4050000 | N297: 024900847
A298: =A297+1 -> 297 | B298: 51104472 | C298: Cao Duy | D298: Thanh | E298: 161093 | F298: MT11KHTN | G298: 100.00 | H298: 8.53 | I298: 15 | J298: 125 | K298: 8.82 | L298: 4050000 | N298: 362366592
A299: =A298+1 -> 298 | B299: 51103284 | C299: Lê Cao | D299: Thăng | E299: 041293 | F299: MT11KHTN | G299: 100.00 | H299: 8.46 | I299: 13 | J299: 120 | K299: 8.77 | L299: 4050000 | N299: 221358116
A300: =A299+1 -> 299 | B300: 51101383 | C300: Thái Ngọc | D300: Huy | E300: 200893 | F300: MT11KHTN | G300: 100.00 | H300: 8.45 | I300: 20 | J300: 118 | K300: 8.76 | L300: 4050000 | N300: 191783136
A301: =A300+1 -> 300 | B301: 51101473 | C301: Nguyễn Chấn | D301: Hưng | E301: 100693 | F301: MT11KT01 | G301: 100.00 | H301: 8.40 | I301: 15 | J301: 116 | K301: 8.72 | L301: 4050000 | N301: 312120535
A302: =A301+1 -> 301 | B302: 51103305 | C302: Nguyễn Hữu | D302: Thắng | E302: 280893 | F302: MT11KHTN | G302: 100.00 | H302: 8.40 | I302: 15 | J302: 118 | K302: 8.72 | L302: 4050000 | N302: 205572424
A303: =A302+1 -> 302 | B303: 51200785 | C303: Trần Văn | D303: Định | E303: 100394 | F303: MT12KTTN | G303: 95.00 | H303: 9.00 | I303: 20 | J303: 73 | K303: 9.10 | L303: 4860000 | N303: 221362965
A304: =A303+1 -> 303 | B304: 51201200 | C304: Đỗ Nguyễn Khánh | D304: Hoàng | E304: 120494 | F304: MT12KHTN | G304: 95.00 | H304: 8.68 | I304: 17 | J304: 76 | K304: 8.84 | L304: 4050000 | N304: 197275987
A305: =A304+1 -> 304 | B305: 51201097 | C305: Nguyễn Kim Trung | D305: Hiếu | E305: 270494 | F305: MT12KHTN | G305: 95.00 | H305: 8.53 | I305: 17 | J305: 76 | K305: 8.72 | L305: 4050000 | N305: 272390896
A306: =A305+1 -> 305 | B306: 51204773 | C306: Lê Đức | D306: Quí | E306: 061194 | F306: MT12KHTN | G306: 99.00 | H306: 8.26 | I306: 21 | J306: 76 | K306: 8.59 | L306: 4050000 | N306: 272359431
A307: =A306+1 -> 306 | B307: 51200678 | C307: Trần Quốc | D307: Đại | E307: 201094 | F307: MT12KH01 | G307: 95.00 | H307: 8.25 | I307: 16 | J307: 83 | K307: 8.50 | L307: 4050000 | N307: 273534674
A308: =A307+1 -> 307 | B308: 51201327 | C308: Đào Quang | D308: Huy | E308: 050794 | F308: MT12KH02 | G308: 90.00 | H308: 8.38 | I308: 16 | J308: 83 | K308: 8.50 | L308: 4050000 | N308: 272331966
A309: =A308+1 -> 308 | B309: 51200482 | C309: Hồ Đức | D309: Dân | E309: 170294 | F309: MT12KHTN | G309: 100.00 | H309: 8.11 | I309: 23 | J309: 80 | K309: 8.49 | L309: 4050000 | N309: 215219752
A310: =A309+1 -> 309 | B310: 51204390 | C310: Hoàng Minh | D310: Tùng | E310: 081294 | F310: MT12KT03 | G310: 95.00 | H310: 8.22 | I310: 18 | J310: 73 | K310: 8.48 | L310: 4050000 | N310: 352272260
A311: =A310+1 -> 310 | B311: 51200324 | C311: Phạm Đức Minh | D311: Châu | E311: 120794 | F311: MT12KHTN | G311: 97.00 | H311: 8.16 | I311: 19 | J311: 78 | K311: 8.47 | L311: 4050000 | N311: 025360405
A312: =A311+1 -> 311 | B312: 51200669 | C312: Bùi Tuấn | D312: Đại | E312: 130394 | F312: MT12KH01 | G312: 90.00 | H312: 8.31 | I312: 21 | J312: 80 | K312: 8.45 | L312: 4050000 | N312: 261338600
A313: =A312+1 -> 312 | B313: 51200082 | C313: Nguyễn Thế | D313: Anh | E313: 250194 | F313: MT12KT01 | G313: 85.00 | H313: 8.42 | I313: 18 | J313: 77 | K313: 8.44 | L313: 4050000 | N313: 381626112
A314: =A313+1 -> 313 | B314: 51203374 | C314: Nguyễn Xuân | D314: Thái | E314: 291094 | F314: MT12KHTN | G314: 90.00 | H314: 8.26 | I314: 19 | J314: 80 | K314: 8.41 | L314: 4050000 | N314: 025073809
A315: =A314+1 -> 314 | B315: 51204518 | C315: Bùi Quang | D315: Vinh | E315: 090694 | F315: MT12KHTN | G315: 98.00 | H315: 8.06 | I315: 17 | J315: 76 | K315: 8.41 | L315: 4050000 | N315: 025333356
A316: =A315+1 -> 315 | B316: 51200868 | C316: Lê Hoàng | D316: Giang | E316: 060794 | F316: MT12KT01 | G316: 100.00 | H316: 8.00 | I316: 21 | J316: 77 | K316: 8.40 | L316: 4050000 | N316: 341702204
A317: =A316+1 -> 316 | B317: 51202655 | C317: Huỳnh Phạm So | D317: Ny | E317: 200794 | F317: MT12KTTN | G317: 100.00 | H317: 8.00 | I317: 20 | J317: 73 | K317: 8.40 | L317: 4050000 | N317: 272301638
A318: =A317+1 -> 317 | B318: 51204041 | C318: Lê Minh | D318: Trí | E318: 041294 | F318: MT12KHTN | G318: 100.00 | H318: 8.00 | I318: 17 | J318: 77 | K318: 8.40 | L318: 4050000 | N318: 212709147
A319: =A318+1 -> 318 | B319: 51201338 | C319: Đỗ Hoàng | D319: Huy | E319: 280994 | F319: MT12KH02 | G319: 100.00 | H319: 7.97 | I319: 19 | J319: 85 | K319: 8.38 | L319: 4050000 | N319: 272480590
A320: =A319+1 -> 319 | B320: 51303511 | C320: Lưu Đắc | D320: Tâm | E320: 260695 | F320: MT1309 | G320: 100.00 | H320: 9.14 | I320: 21 | J320: 42 | K320: 9.31 | L320: 4860000 | N320: 225525620
A321: =A320+1 -> 320 | B321: 51303436 | C321: Nguyễn Vũ | D321: Sơn | E321: 310795 | F321: MT1309 | G321: 95.00 | H321: 9.05 | I321: 21 | J321: 42 | K321: 9.14 | L321: 4860000 | N321: 225570844
A322: =A321+1 -> 321 | B322: 51302490 | C322: Nguyễn Thị Kim | D322: Ngân | E322: 170495 | F322: MT1308 | G322: 95.00 | H322: 8.98 | I322: 21 | J322: 42 | K322: 9.08 | L322: 4860000 | N322: 025329004
A323: =A322+1 -> 322 | B323: 51303451 | C323: Từ Thạch | D323: Sơn | E323: 260995 | F323: MT1309 | G323: 95.00 | H323: 8.90 | I323: 21 | J323: 42 | K323: 9.02 | L323: 4860000 | N323: 341850426
A324: =A323+1 -> 323 | B324: 51304508 | C324: Nguyễn | D324: Tuân | E324: 150595 | F324: MT1309 | G324: 100.00 | H324: 8.74 | I324: 21 | J324: 42 | K324: 8.99 | L324: 4050000 | N324: 225570885
A325: =A324+1 -> 324 | B325: 51305019 | C325: Nguyễn Minh Gia | D325: Huy | E325: 021295 | F325: MT1309 | G325: 90.00 | H325: 8.90 | I325: 21 | J325: 40 | K325: 8.92 | L325: 4050000 | N325: 241396789
A326: =A325+1 -> 325 | B326: 51304750 | C326: Chu Thanh | D326: Văn | E326: 201095 | F326: MT1307 | G326: 100.00 | H326: 8.55 | I326: 21 | J326: 40 | K326: 8.84 | L326: 4050000 | N326: 017274722
A327: =A326+1 -> 326 | B327: 51300947 | C327: Trịnh Ngọc | D327: Đức | E327: 270295 | F327: MT1305 | G327: 90.00 | H327: 8.76 | I327: 21 | J327: 42 | K327: 8.81 | L327: 4050000 | N327: 206002560
A328: =A327+1 -> 327 | B328: 51301376 | C328: Bùi Đắc | D328: Hòa | E328: 201095 | F328: MT1302 | G328: 85.00 | H328: 8.86 | I328: 21 | J328: 38 | K328: 8.79 | L328: 4050000 | N328: 291107290
A329: =A328+1 -> 328 | B329: 51303225 | C329: Nguyễn Mai Bảo | D329: Quân | E329: 070795 | F329: MT1309 | G329: 100.00 | H329: 8.48 | I329: 21 | J329: 42 | K329: 8.78 | L329: 4050000 | N329: 025155813
A330: =A329+1 -> 329 | B330: 51303474 | C330: Lê Tuấn | D330: Tài | E330: 070895 | F330: MT1309 | G330: 100.00 | H330: 8.48 | I330: 21 | J330: 42 | K330: 8.78 | L330: 4050000 | N330: 312243633
A331: =A330+1 -> 330 | B331: 51303268 | C331: Trần Minh | D331: Quốc | E331: 121195 | F331: MT1309 | G331: 90.00 | H331: 8.69 | I331: 21 | J331: 42 | K331: 8.75 | L331: 4050000 | N331: 025302917
A332: =A331+1 -> 331 | B332: 51303574 | C332: Tạ Chí | D332: Tây | E332: 120695 | F332: MT1308 | G332: 95.00 | H332: 8.52 | I332: 21 | J332: 42 | K332: 8.72 | L332: 4050000 | N332: 215359450
A333: =A332+1 -> 332 | B333: 51300327 | C333: Võ Văn | D333: Bương | E333: 210895 | F333: MT1301 | G333: 95.00 | H333: 8.48 | I333: 21 | J333: 40 | K333: 8.68 | L333: 4050000 | N333: 197336448
A334: =A333+1 -> 333 | B334: 51303576 | C334: Lê Hữu | D334: Tấn | E334: 250895 | F334: MT1304 | G334: 100.00 | H334: 8.26 | I334: 21 | J334: 40 | K334: 8.61 | L334: 4050000 | N334: 362444124
A335: =A334+1 -> 334 | B335: 51303433 | C335: Nguyễn Tùng | D335: Sơn | E335: 151095 | F335: MT1309 | G335: 95.00 | H335: 8.36 | I335: 21 | J335: 42 | K335: 8.59 | L335: 4050000 | N335: 025374176
A336: =A335+1 -> 335 | B336: 61002329 | C336: Phạm Lê Kiều | D336: Oanh | E336: 060692 | F336: HC10KSTN | G336: 99.00 | H336: 9.18 | I336: 11 | J336: 148 | K336: 9.32 | L336: 4860000 | N336: 191770914
A337: =A336+1 -> 336 | B337: 61001788 | C337: Bùi Nguyễn Tấn | D337: Lộc | E337: 050291 | F337: HC10SH | G337: 100.00 | H337: 9.12 | I337: 13 | J337: 148 | K337: 9.30 | L337: 4860000 | N337: 024440394
A338: =A337+1 -> 337 | B338: 61002913 | C338: Trần Hoài | D338: Tân | E338: 031192 | F338: HC10SH | G338: 100.00 | H338: 9.10 | I338: 15 | J338: 151 | K338: 9.28 | L338: 4860000 | N338: 281035853
A339: =A338+1 -> 338 | B339: 61001564 | C339: Trần Đỗ Anh | D339: Khoa | E339: 230792 | F339: HC10HD | G339: 95.00 | H339: 9.04 | I339: 13 | J339: 146 | K339: 9.13 | L339: 4860000 | N339: 024654921
A340: =A339+1 -> 339 | B340: 61000703 | C340: Lê Thành | D340: Đô | E340: 110892 | F340: HC10CHC | G340: 100.00 | H340: 8.88 | I340: 13 | J340: 146 | K340: 9.10 | L340: 4860000 | N340: 341630984
A341: =A340+1 -> 340 | B341: 61002594 | C341: Nguyễn Thanh | D341: Quang | E341: 280692 | F341: HC10KSTN | G341: 98.00 | H341: 8.88 | I341: 13 | J341: 146 | K341: 9.06 | L341: 4860000 | N341: 212747489
A342: =A341+1 -> 341 | B342: 61001392 | C342: Nguyễn Minh | D342: Hưng | E342: 010692 | F342: HC10HD | G342: 100.00 | H342: 8.80 | I342: 15 | J342: 146 | K342: 9.04 | L342: 4860000 | N342: 341569206
A343: =A342+1 -> 342 | B343: 61003309 | C343: Trương Thị Đăng | D343: Thùy | E343: 170192 | F343: HC10HD | G343: 90.00 | H343: 9.05 | I343: 11 | J343: 146 | K343: 9.04 | L343: 4860000 | N343: 264362286
A344: =A343+1 -> 343 | B344: 61001610 | C344: Huỳnh Bảo | D344: Kiên | E344: 110591 | F344: HC10SH | G344: 100.00 | H344: 8.77 | I344: 11 | J344: 149 | K344: 9.02 | L344: 4860000 | N344: 321380515
A345: =A344+1 -> 344 | B345: 61001783 | C345: Trương Văn Khánh | D345: Long | E345: 020992 | F345: HC10KSTN | G345: 98.00 | H345: 8.77 | I345: 13 | J345: 146 | K345: 8.98 | L345: 4050000 | N345: 205514227
A346: =A345+1 -> 345 | B346: 61000884 | C346: Phan Thiện | D346: Hảo | E346: 250992 | F346: HC10HD | G346: 90.00 | H346: 8.95 | I346: 11 | J346: 146 | K346: 8.96 | L346: 4050000 | N346: 352076013
A347: =A346+1 -> 346 | B347: 61004135 | C347: Hồ Thị | D347: Vượng | E347: 100292 | F347: HC10KSTN | G347: 100.00 | H347: 8.68 | I347: 14 | J347: 146 | K347: 8.94 | L347: 4050000 | N347: 261224753
A348: =A347+1 -> 347 | B348: 61000802 | C348: Lê Mạnh | D348: Hà | E348: 040492 | F348: HC10KSTN | G348: 94.00 | H348: 8.81 | I348: 13 | J348: 148 | K348: 8.93 | L348: 4050000 | N348: 191771228
A349: =A348+1 -> 348 | B349: 61000635 | C349: Nguyễn Phát | D349: Đạt | E349: 040392 | F349: HC10KSTN | G349: 100.00 | H349: 8.65 | I349: 13 | J349: 148 | K349: 8.92 | L349: 4050000 | N349: 024777406
A350: =A349+1 -> 349 | B350: 61000908 | C350: Dương Thị Thúy | D350: Hằng | E350: 190392 | F350: HC10CHC | G350: 97.00 | H350: 8.73 | I350: 15 | J350: 148 | K350: 8.92 | L350: 4050000 | N350: 197253567
A351: =A350+1 -> 350 | B351: 61001066 | C351: Phạm Thị Hồng | D351: Hoa | E351: 220592 | F351: HC10HD | G351: 100.00 | H351: 8.65 | I351: 13 | J351: 146 | K351: 8.92 | L351: 4050000 | N351: 225527442
A352: =A351+1 -> 351 | B352: 61000936 | C352: Đồng Thanh | D352: Hiếu | E352: 200992 | F352: HC10DK | G352: 99.00 | H352: 8.65 | I352: 13 | J352: 150 | K352: 8.90 | L352: 4050000 | N352: 285422782
A353: =A352+1 -> 352 | B353: 61003577 | C353: Lê Nguyễn Minh | D353: Trí | E353: 291292 | F353: HC10KSTN | G353: 100.00 | H353: 8.57 | I353: 15 | J353: 150 | K353: 8.86 | L353: 4050000 | N353: 191758315
A354: =A353+1 -> 353 | B354: 61101516 | C354: Nguyễn Thị Thanh | D354: Hương | E354: 150993 | F354: HC11MB | G354: 100.00 | H354: 8.74 | I354: 19 | J354: 124 | K354: 8.99 | L354: 4050000 | N354: 230903855
A355: =A354+1 -> 354 | B355: 61103566 | C355: Lê Thị Thuỷ | D355: Tiên | E355: 200993 | F355: HC11KSTN | G355: 92.00 | H355: 8.73 | I355: 20 | J355: 119 | K355: 8.82 | L355: 4050000 | N355: 197291781
A356: =A355+1 -> 355 | B356: 61100518 | C356: Phan Thị Hoài | D356: Diễm | E356: 180293 | F356: HC11KSTN | G356: 100.00 | H356: 8.45 | I356: 20 | J356: 120 | K356: 8.76 | L356: 4050000 | N356: 312199637
A357: =A356+1 -> 356 | B357: 61100071 | C357: Lâm Hoài Minh | D357: Anh | E357: 091193 | F357: HC11KSTN | G357: 92.00 | H357: 8.62 | I357: 21 | J357: 118 | K357: 8.74 | L357: 4050000 | N357: 024749303
A358: =A357+1 -> 357 | B358: 61101646 | C358: Nguyễn Ngọc | D358: Khoa | E358: 130693 | F358: HC11KTDK | G358: 100.00 | H358: 8.41 | I358: 23 | J358: 118 | K358: 8.73 | L358: 4050000 | N358: 205645206
A359: =A358+1 -> 358 | B359: 61101509 | C359: Huỳnh Lan | D359: Hương | E359: 121293 | F359: HC11KSTN | G359: 90.00 | H359: 8.65 | I359: 23 | J359: 118 | K359: 8.72 | L359: 4050000 | N359: 024894465
A360: =A359+1 -> 359 | B360: 61102619 | C360: Nguyễn Thiên | D360: Phúc | E360: 030693 | F360: HC11KSTN | G360: 100.00 | H360: 8.26 | I360: 23 | J360: 118 | K360: 8.61 | L360: 4050000 | N360: 025174623
A361: =A360+1 -> 360 | B361: 61101045 | C361: Châu Khiếu | D361: Hân | E361: 020993 | F361: HC11KSTN | G361: 94.00 | H361: 8.33 | I361: 20 | J361: 119 | K361: 8.54 | L361: 4050000 | N361: 194490230
A362: =A361+1 -> 361 | B362: 61103505 | C362: Võ Anh | D362: Thuận | E362: 201193 | F362: HC11MB | G362: 99.00 | H362: 8.19 | I362: 18 | J362: 126 | K362: 8.53 | L362: 4050000 | N362: 212790337
A363: =A362+1 -> 362 | B363: 61100940 | C363: Phan Hữu | D363: Hà | E363: 180393 | F363: HC11KSTN | G363: 95.00 | H363: 8.25 | I363: 22 | J363: 115 | K363: 8.50 | L363: 4050000 | N363: 024974550
A364: =A363+1 -> 363 | B364: 61103728 | C364: Nguyễn Đức Minh | D364: Trang | E364: 160893 | F364: HC11KSTN | G364: 95.00 | H364: 8.25 | I364: 18 | J364: 117 | K364: 8.50 | L364: 4050000 | N364: 024880095
A365: =A364+1 -> 364 | B365: 61103714 | C365: Vũ Xuân | D365: Toàn | E365: 261093 | F365: HC11HD | G365: 100.00 | H365: 8.11 | I365: 19 | J365: 117 | K365: 8.49 | L365: 4050000 | N365: 225483676
A366: =A365+1 -> 365 | B366: 61101538 | C366: Nguyễn Minh | D366: Kha | E366: 110293 | F366: HC11KSTN | G366: 92.00 | H366: 8.29 | I366: 21 | J366: 116 | K366: 8.47 | L366: 4050000 | N366: 024892186
A367: =A366+1 -> 366 | B367: 61102846 | C367: Nguyễn Văn | D367: Quý | E367: 080193 | F367: HC11KSTN | G367: 95.00 | H367: 8.19 | I367: 18 | J367: 122 | K367: 8.45 | L367: 4050000 | N367: 187217167
A368: =A367+1 -> 367 | B368: 61104179 | C368: Bùi Thị | D368: Vân | E368: 150293 | F368: HC11MB | G368: 100.00 | H368: 8.05 | I368: 21 | J368: 118 | K368: 8.44 | L368: 4050000 | N368: 272135958
A369: =A368+1 -> 368 | B369: 61101625 | C369: Huỳnh Anh | D369: Khoa | E369: 150293 | F369: HC11HD | G369: 100.00 | H369: 8.03 | I369: 19 | J369: 115 | K369: 8.42 | L369: 4050000 | N369: 264412753
A370: =A369+1 -> 369 | B370: 61104155 | C370: Lê Trần Phương | D370: Uyên | E370: 220693 | F370: HC11KSTN | G370: 92.00 | H370: 8.23 | I370: 20 | J370: 115 | K370: 8.42 | L370: 4050000 | N370: 024967467
A371: =A370+1 -> 370 | B371: 61100892 | C371: Dương Thị Bé | D371: Em | E371: 180193 | F371: HC11CHC | G371: 100.00 | H371: 8.00 | I371: 21 | J371: 120 | K371: 8.40 | L371: 4050000 | N371: 321521726
A372: =A371+1 -> 371 | B372: 61104254 | C372: Phạm Lễ | D372: Vinh | E372: 090893 | F372: HC11KSTN | G372: 91.00 | H372: 8.22 | I372: 23 | J372: 118 | K372: 8.40 | L372: 4050000 | N372: 024923575
A373: =A372+1 -> 372 | B373: 61103735 | C373: Phan Thị Bảo | D373: Trang | E373: 031293 | F373: HC11KSTN | G373: 95.00 | H373: 8.07 | I373: 21 | J373: 120 | K373: 8.36 | L373: 4050000 | N373: 301476701
A374: =A373+1 -> 373 | B374: 61203023 | C374: Lê Thị Kiều | D374: Quyên | E374: 300194 | F374: HC12HD | G374: 95.00 | H374: 9.05 | I374: 19 | J374: 75 | K374: 9.14 | L374: 4860000 | N374: 321479837
A375: =A374+1 -> 374 | B375: 61203284 | C375: Hồ Nguyễn Minh | D375: Tân | E375: 201294 | F375: HC12HD | G375: 90.00 | H375: 9.08 | I375: 24 | J375: 90 | K375: 9.06 | L375: 4860000 | N375: 312227273
A376: =A375+1 -> 375 | B376: 61200658 | C376: Hồ Linh | D376: Đa | E376: 100294 | F376: HC12KTDK | G376: 94.00 | H376: 8.88 | I376: 21 | J376: 88 | K376: 8.98 | L376: 4050000 | N376: 352240072
A377: =A376+1 -> 376 | B377: 61202012 | C377: Nguyễn Quang | D377: Lộc | E377: 061094 | F377: HC12CHC | G377: 90.00 | H377: 8.97 | I377: 19 | J377: 79 | K377: 8.98 | L377: 4050000 | N377: 025062179
A378: =A377+1 -> 377 | B378: 61202692 | C378: Phùng Gia | D378: Phát | E378: 271194 | F378: HC12CHC | G378: 90.00 | H378: 8.97 | I378: 17 | J378: 77 | K378: 8.98 | L378: 4050000 | N378: 312206528
A379: =A378+1 -> 378 | B379: 61202387 | C379: Trương Hữu | D379: Nghĩa | E379: 030193 | F379: HC12CHC | G379: 100.00 | H379: 8.71 | I379: 19 | J379: 75 | K379: 8.97 | L379: 4050000 | N379: 273446305
A380: =A379+1 -> 379 | B380: 61200056 | C380: Lê Phúc | D380: Anh | E380: 140194 | F380: HC12DK | G380: 90.00 | H380: 8.84 | I380: 19 | J380: 77 | K380: 8.87 | L380: 4050000 | N380: 352211873
A381: =A380+1 -> 380 | B381: 61202635 | C381: Trần Thị Quỳnh | D381: Như | E381: 220994 | F381: HC12CHC | G381: 85.00 | H381: 8.93 | I381: 21 | J381: 83 | K381: 8.84 | L381: 4050000 | N381: 281013441
A382: =A381+1 -> 381 | B382: 61200851 | C382: Phạm Hồng | D382: Đức | E382: 060494 | F382: HC12HD | G382: 95.00 | H382: 8.66 | I382: 19 | J382: 77 | K382: 8.83 | L382: 4050000 | N382: 281042904
A383: =A382+1 -> 382 | B383: 61201391 | C383: Tăng Quốc | D383: Huy | E383: 200594 | F383: HC12DK | G383: 95.00 | H383: 8.66 | I383: 19 | J383: 77 | K383: 8.83 | L383: 4050000 | N383: 024931832
A384: =A383+1 -> 383 | B384: 61203725 | C384: Nguyễn Thị Ngọc | D384: Thủy | E384: 020894 | F384: HC12HD | G384: 95.00 | H384: 8.66 | I384: 19 | J384: 77 | K384: 8.83 | L384: 4050000 | N384: 291075448
A385: =A384+1 -> 384 | B385: 61203841 | C385: Trần Việt | D385: Tiến | E385: 161294 | F385: HC12KTVS | G385: 100.00 | H385: 8.50 | I385: 21 | J385: 79 | K385: 8.80 | L385: 4050000 | N385: 272419761
A386: =A385+1 -> 385 | B386: 61200955 | C386: Nguyễn Đăng | D386: Hải | E386: 100594 | F386: HC12CHC | G386: 95.00 | H386: 8.61 | I386: 19 | J386: 79 | K386: 8.79 | L386: 4050000 | N386: 025080932
A387: =A386+1 -> 386 | B387: 61202330 | C387: Phạm Thị Kim | D387: Ngân | E387: 300194 | F387: HC12HD | G387: 90.00 | H387: 8.66 | I387: 22 | J387: 80 | K387: 8.73 | L387: 4050000 | N387: 250941926
A388: =A387+1 -> 387 | B388: 61204497 | C388: Nguyễn Đức | D388: Việt | E388: 271094 | F388: HC12KTHC | G388: 85.00 | H388: 8.78 | I388: 23 | J388: 90 | K388: 8.72 | L388: 4050000 | N388: 025510694
A389: =A388+1 -> 388 | B389: 61203734 | C389: Hồ Thị Anh | D389: Thư | E389: 050494 | F389: HC12CHC | G389: 80.00 | H389: 8.86 | I389: 21 | J389: 81 | K389: 8.69 | L389: 4050000 | N389: 025223151
A390: =A389+1 -> 389 | B390: 61200642 | C390: Lê Triều | D390: Dương | E390: 181094 | F390: HC12KTDK | G390: 87.00 | H390: 8.66 | I390: 19 | J390: 77 | K390: 8.67 | L390: 4050000 | N390: 331702665
A391: =A390+1 -> 390 | B391: 61201687 | C391: Hồ Ngọc | D391: Khoa | E391: 130194 | F391: HC12CHC | G391: 90.00 | H391: 8.56 | I391: 17 | J391: 79 | K391: 8.65 | L391: 4050000 | N391: 025100839
A392: =A391+1 -> 391 | B392: 61300256 | C392: Phạm Hoài Tiểu | D392: Bảo | E392: 030595 | F392: HC13CHC | G392: 90.00 | H392: 9.05 | I392: 20 | J392: 38 | K392: 9.04 | L392: 4860000 | N392: 321506552
A393: =A392+1 -> 392 | B393: 61301281 | C393: Phan Thị Thanh | D393: Hoa | E393: 160595 | F393: HC13TP1 | G393: 85.00 | H393: 8.94 | I393: 18 | J393: 34 | K393: 8.85 | L393: 4050000 | N393: 272541145
A394: =A393+1 -> 393 | B394: 61303154 | C394: Đồng Thanh | D394: Quang | E394: 160995 | F394: HC13MB | G394: 85.00 | H394: 8.93 | I394: 20 | J394: 40 | K394: 8.84 | L394: 4050000 | N394: 273585599
A395: =A394+1 -> 394 | B395: 61302369 | C395: Phan Hoàng | D395: Minh | E395: 270195 | F395: HC13TP2 | G395: 95.00 | H395: 8.61 | I395: 18 | J395: 34 | K395: 8.79 | L395: 4050000 | N395: 281084135
A396: =A395+1 -> 395 | B396: 61302687 | C396: Đỗ Nguyễn Thành | D396: Nhân | E396: 120795 | F396: HC13CHC | G396: 91.00 | H396: 8.68 | I396: 20 | J396: 40 | K396: 8.76 | L396: 4050000 | N396: 291100926
A397: =A396+1 -> 396 | B397: 61303093 | C397: Đinh Thị Hà | D397: Phương | E397: 060795 | F397: HC13DK | G397: 90.00 | H397: 8.70 | I397: 20 | J397: 40 | K397: 8.76 | L397: 4050000 | N397: 273637250
A398: =A397+1 -> 397 | B398: 61302860 | C398: Đường Thị Kiều | D398: Oanh | E398: 150495 | F398: HC13SH | G398: 100.00 | H398: 8.35 | I398: 20 | J398: 36 | K398: 8.68 | L398: 4050000 | N398: 192114660
A399: =A398+1 -> 398 | B399: 61304889 | C399: Nguyễn Hà Huy | D399: Vũ | E399: 040595 | F399: HC13CHC | G399: 93.00 | H399: 8.53 | I399: 20 | J399: 38 | K399: 8.68 | L399: 4050000 | N399: 281047852
A400: =A399+1 -> 399 | B400: 61300144 | C400: Trần Kỳ | D400: Anh | E400: 240595 | F400: HC13DK | G400: 95.00 | H400: 8.45 | I400: 20 | J400: 36 | K400: 8.66 | L400: 4050000 | N400: 362479105
A401: =A400+1 -> 400 | B401: 61302499 | C401: Phạm Thị Kiều | D401: Ngân | E401: 180195 | F401: HC13CHC | G401: 90.00 | H401: 8.58 | I401: 18 | J401: 42 | K401: 8.66 | L401: 4050000 | N401: 025342977
A402: =A401+1 -> 401 | B402: 61300824 | C402: Viên Mẫn | D402: Đạt | E402: 111195 | F402: HC13TP1 | G402: 85.00 | H402: 8.63 | I402: 20 | J402: 40 | K402: 8.60 | L402: 4050000 | N402: 025284128
A403: =A402+1 -> 402 | B403: 61300542 | C403: Nguyễn Thị Thùy | D403: Dung | E403: 290395 | F403: HC13DK | G403: 85.00 | H403: 8.60 | I403: 20 | J403: 36 | K403: 8.58 | L403: 4050000 | N403: 341809800
A404: =A403+1 -> 403 | B404: 61302089 | C404: Nguyễn Thị Thảo | D404: Linh | E404: 151295 | F404: HC13SH | G404: 83.00 | H404: 8.55 | I404: 20 | J404: 40 | K404: 8.50 | L404: 4050000 | N404: 230971895
A405: =A404+1 -> 404 | B405: 61302584 | C405: Nguyễn Thị Hồng | D405: Ngọc | E405: 140795 | F405: HC13CHC | G405: 90.00 | H405: 8.35 | I405: 20 | J405: 38 | K405: 8.48 | L405: 4050000 | N405: 025270231
A406: =A405+1 -> 405 | B406: 61304737 | C406: Nguyễn Ngọc | D406: Uyên | E406: 061095 | F406: HC13TP2 | G406: 80.00 | H406: 8.60 | I406: 20 | J406: 40 | K406: 8.48 | L406: 4050000 | N406: 273545080
A407: =A406+1 -> 406 | B407: 61303081 | C407: Bùi Văn | D407: Phục | E407: 121095 | F407: HC13CHC | G407: 82.00 | H407: 8.50 | I407: 20 | J407: 40 | K407: 8.44 | L407: 4050000 | N407: 321526826
A408: =A407+1 -> 407 | B408: 61304671 | C408: Trần Ngọc | D408: Tú | E408: 231193 | F408: HC13CHC | G408: 85.00 | H408: 8.43 | I408: 20 | J408: 40 | K408: 8.44 | L408: 4050000 | N408: 272235565
A409: =A408+1 -> 408 | B409: 61303062 | C409: Phạm Hoàng | D409: Phúc | E409: 021195 | F409: HC13CHC | G409: 75.00 | H409: 8.65 | I409: 20 | J409: 40 | K409: 8.42 | L409: 4050000 | N409: 273581093
A410: =A409+1 -> 409 | B410: 61304988 | C410: Lê Thị Như | D410: ý | E410: 040195 | F410: HC13CHC | G410: 87.00 | H410: 8.33 | I410: 18 | J410: 42 | K410: 8.40 | L410: 4050000 | N410: 191876889
A411: =A410+1 -> 410 | B411: 61301954 | C411: Lê Tuấn | D411: Kiệt | E411: 290995 | F411: HC13TP1 | G411: 85.00 | H411: 8.33 | I411: 20 | J411: 38 | K411: 8.36 | L411: 4050000 | N411: 272398700
A412: =A411+1 -> 411 | B412: 71003038 | C412: Phan Thị Phương | D412: Thảo | E412: 301192 | F412: QL10CN1 | G412: 100.00 | H412: 9.13 | I412: 12 | J412: 144 | K412: 9.30 | L412: 4860000 | N412: 024655475
A413: =A412+1 -> 412 | B413: 71003854 | C413: Phạm Cẩm | D413: Tú | E413: 200892 | F413: QL10CN1 | G413: 100.00 | H413: 8.93 | I413: 15 | J413: 144 | K413: 9.14 | L413: 4860000 | N413: 241352339
A414: =A413+1 -> 413 | B414: 71003879 | C414: Lê Thiện | D414: Tùng | E414: 131192 | F414: QL10KD1 | G414: 100.00 | H414: 8.93 | I414: 14 | J414: 144 | K414: 9.14 | L414: 4860000 | N414: 291047763
A415: =A414+1 -> 414 | B415: 71001332 | C415: Nguyễn Thái | D415: Hùng | E415: 100492 | F415: QL10CN2 | G415: 100.00 | H415: 8.71 | I415: 12 | J415: 144 | K415: 8.97 | L415: 4050000 | N415: 331626566
A416: =A415+1 -> 415 | B416: 71003839 | C416: Mai Thị Thanh | D416: Tú | E416: 290392 | F416: QL10KD1 | G416: 100.00 | H416: 8.65 | I416: 10 | J416: 144 | K416: 8.92 | L416: 4050000 | N416: 024616886
A417: =A416+1 -> 416 | B417: 71003461 | C417: Nguyễn Thanh | D417: Toàn | E417: 291292 | F417: QL10KD1 | G417: 100.00 | H417: 8.63 | I417: 12 | J417: 144 | K417: 8.90 | L417: 4050000 | N417: 331665441
A418: =A417+1 -> 417 | B418: 71000039 | C418: Đặng Thụy Quỳnh | D418: Anh | E418: 201192 | F418: QL10KD1 | G418: 100.00 | H418: 8.54 | I418: 12 | J418: 144 | K418: 8.83 | L418: 4050000 | N418: 024612870
A419: =A418+1 -> 418 | B419: 71003271 | C419: Nguyễn Hoàng Minh | D419: Thơ | E419: 190492 | F419: QL10KD1 | G419: 90.00 | H419: 8.67 | I419: 12 | J419: 144 | K419: 8.74 | L419: 4050000 | N419: 312113526
A420: =A419+1 -> 419 | B420: 71100333 | C420: Hồng Bữu | D420: Bữu | E420: 151093 | F420: QL11CN1 | G420: 100.00 | H420: 8.98 | I420: 21 | J420: 121 | K420: 9.18 | L420: 4860000 | N420: 024961833
A421: =A420+1 -> 420 | B421: 71104406 | C421: Lê Hồng | D421: Yến | E421: 200193 | F421: QL11CN1 | G421: 98.00 | H421: 9.00 | I421: 21 | J421: 118 | K421: 9.16 | L421: 4860000 | N421: 362358198
A422: =A421+1 -> 421 | B422: 71101035 | C422: Lê Thị Thu | D422: Hằng | E422: 300593 | F422: QL11CN1 | G422: 95.00 | H422: 8.90 | I422: 20 | J422: 115 | K422: 9.02 | L422: 4860000 | N422: 191780796
A423: =A422+1 -> 422 | B423: 71103725 | C423: Hồng | D423: Trang | E423: 020493 | F423: QL11CN2 | G423: 100.00 | H423: 8.60 | I423: 20 | J423: 117 | K423: 8.88 | L423: 4050000 | N423: 024945548
A424: =A423+1 -> 423 | B424: 71102011 | C424: Nguyễn Ngọc | D424: Mai | E424: 200893 | F424: QL11CN1 | G424: 95.00 | H424: 8.70 | I424: 20 | J424: 120 | K424: 8.86 | L424: 4050000 | N424: 024900664
A425: =A424+1 -> 424 | B425: 71100430 | C425: Nguyễn Thị Kim | D425: Cúc | E425: 110693 | F425: QL11CN1 | G425: 90.00 | H425: 8.73 | I425: 20 | J425: 112 | K425: 8.78 | L425: 4050000 | N425: 312157434
A426: =A425+1 -> 425 | B426: 71102413 | C426: Đào Vũ Thị Bích | D426: Nhi | E426: 200993 | F426: QL11CN1 | G426: 98.00 | H426: 8.47 | I426: 15 | J426: 115 | K426: 8.74 | L426: 4050000 | N426: 272268570
A427: =A426+1 -> 426 | B427: 71101502 | C427: Trương Quốc | D427: Hưng | E427: 100993 | F427: QL11CN1 | G427: 90.00 | H427: 8.64 | I427: 21 | J427: 116 | K427: 8.71 | L427: 4050000 | N427: 024827982
A428: =A427+1 -> 427 | B428: 71201032 | C428: Đinh Dương Phúc | D428: Hậu | E428: 040494 | F428: QL1201 | G428: 90.00 | H428: 8.73 | I428: 22 | J428: 79 | K428: 8.78 | L428: 4050000 | N428: 341782619
A429: =A428+1 -> 428 | B429: 71204703 | C429: Mai Thị Thanh | D429: Xuân | E429: 060394 | F429: QL1203 | G429: 88.00 | H429: 8.75 | I429: 20 | J429: 79 | K429: 8.76 | L429: 4050000 | N429: 273552440
A430: =A429+1 -> 429 | B430: 71203084 | C430: Nguyễn Thị Thu | D430: Sa | E430: 231294 | F430: QL1203 | G430: 95.00 | H430: 8.45 | I430: 20 | J430: 86 | K430: 8.66 | L430: 4050000 | N430: 212330953
A431: =A430+1 -> 430 | B431: 71204687 | C431: Nguyễn Thị Cẩm | D431: Vy | E431: 310194 | F431: QL1204 | G431: 90.00 | H431: 8.53 | I431: 20 | J431: 77 | K431: 8.62 | L431: 4050000 | N431: 205840765
A432: =A431+1 -> 431 | B432: 71200497 | C432: Hà Hảo | D432: Dinh | E432: 070194 | F432: QL1202 | G432: 95.00 | H432: 8.33 | I432: 23 | J432: 84 | K432: 8.56 | L432: 4050000 | N432: 025015018
A433: =A432+1 -> 432 | B433: 71204169 | C433: Trần Văn | D433: Trung | E433: 110394 | F433: QL1204 | G433: 100.00 | H433: 8.20 | I433: 22 | J433: 77 | K433: 8.56 | L433: 4050000 | N433: 273474899
A434: =A433+1 -> 433 | B434: 71204343 | C434: Nguyễn Thị Thanh | D434: Tuyền | E434: 130394 | F434: QL1204 | G434: 90.00 | H434: 8.40 | I434: 20 | J434: 82 | K434: 8.52 | L434: 4050000 | N434: 225557367
A435: =A434+1 -> 434 | B435: 71203921 | C435: Nguyễn Phùng Đức | D435: Toàn | E435: 030894 | F435: QL1202 | G435: 95.00 | H435: 8.23 | I435: 20 | J435: 79 | K435: 8.48 | L435: 4050000 | N435: 362375184
A436: =A435+1 -> 435 | B436: 71303948 | C436: Trần Phước | D436: Thọ | E436: 051087 | F436: QL1303 | G436: 100.00 | H436: 9.03 | I436: 19 | J436: 39 | K436: 9.22 | L436: 4860000 | N436: 023961135
A437: =A436+1 -> 436 | B437: 71304956 | C437: Nguyễn Xuân Phương | D437: Vy | E437: 200495 | F437: QL1303 | G437: 100.00 | H437: 8.18 | I437: 19 | J437: 39 | K437: 8.54 | L437: 4050000 | N437: 025250804
A438: =A437+1 -> 437 | B438: 71302189 | C438: Hà Văn | D438: Lộc | E438: 180995 | F438: QL1303 | G438: 100.00 | H438: 8.03 | I438: 19 | J438: 39 | K438: 8.42 | L438: 4050000 | N438: 191856804
A439: =A438+1 -> 438 | B439: 71303981 | C439: Hà | D439: Thu | E439: 210895 | F439: QL1303 | G439: 100.00 | H439: 7.95 | I439: 19 | J439: 39 | K439: 8.36 | L439: 4050000 | N439: 025449636
A440: =A439+1 -> 439 | B440: 71300204 | C440: Lê Thị Thu | D440: Ba | E440: 260695 | F440: QL1301 | G440: 95.00 | H440: 7.92 | I440: 19 | J440: 37 | K440: 8.24 | L440: 4050000 | N440: 205826920
A441: =A440+1 -> 440 | B441: 71301185 | C441: Nguyễn Trung | D441: Hiếu | E441: 180695 | F441: QL1301 | G441: 100.00 | H441: 7.76 | I441: 19 | J441: 37 | K441: 8.21 | L441: 4050000 | N441: 272480773
A442: =A441+1 -> 441 | B442: 71300047 | C442: Dương Tuấn | D442: Anh | E442: 090695 | F442: QL1301 | G442: 95.00 | H442: 7.82 | I442: 19 | J442: 35 | K442: 8.16 | L442: 4050000 | N442: 301546751
A443: =A442+1 -> 442 | B443: 71303597 | C443: Nguyễn Đăng | D443: Thanh | E443: 240595 | F443: QL1304 | G443: 90.00 | H443: 7.95 | I443: 19 | J443: 35 | K443: 8.16 | L443: 4050000 | N443: 272398604
A444: =A443+1 -> 443 | B444: 81000433 | C444: Nguyễn Quang | D444: Du | E444: 190592 | F444: XD10CD1 | G444: 100.00 | H444: 9.32 | I444: 14 | J444: 140 | K444: 9.46 | L444: 4860000 | N444: 215305922
A445: =A444+1 -> 444 | B445: 81000023 | C445: Trần Minh | D445: An | E445: 100892 | F445: XD10CD1 | G445: 100.00 | H445: 9.13 | I445: 16 | J445: 142 | K445: 9.30 | L445: 4860000 | N445: 212706279
A446: =A445+1 -> 445 | B446: 81002928 | C446: Lê Văn | D446: Tể | E446: 061292 | F446: XD10CD3 | G446: 100.00 | H446: 9.03 | I446: 16 | J446: 140 | K446: 9.22 | L446: 4860000 | N446: 212597239
A447: =A446+1 -> 446 | B447: 81001531 | C447: Huỳnh Đăng | D447: Khoa | E447: 121192 | F447: XD10CD1 | G447: 100.00 | H447: 9.00 | I447: 14 | J447: 145 | K447: 9.20 | L447: 4860000 | N447: 024654195
A448: =A447+1 -> 447 | B448: 81000069 | C448: Nguyễn Minh | D448: Anh | E448: 200992 | F448: XD10CD1 | G448: 100.00 | H448: 8.92 | I448: 12 | J448: 140 | K448: 9.14 | L448: 4860000 | N448: 264410199
A449: =A448+1 -> 448 | B449: 81003597 | C449: Trần Nguyên Minh | D449: Trí | E449: 270792 | F449: XD10KSTN | G449: 100.00 | H449: 8.93 | I449: 15 | J449: 140 | K449: 9.14 | L449: 4860000 | N449: 261294087
A450: =A449+1 -> 449 | B450: 81002228 | C450: Lê Thành | D450: Nhân | E450: 021292 | F450: XD10CD2 | G450: 100.00 | H450: 8.91 | I450: 17 | J450: 140 | K450: 9.13 | L450: 4860000 | N450: 225499871
A451: =A450+1 -> 450 | B451: 81003401 | C451: Đỗ Văn | D451: Tín | E451: 200492 | F451: XD10KSTN | G451: 100.00 | H451: 8.80 | I451: 15 | J451: 140 | K451: 9.04 | L451: 4860000 | N451: 245160396
A452: =A451+1 -> 451 | B452: 81000664 | C452: Lê Hải | D452: Đăng | E452: 240792 | F452: XD10CD1 | G452: 100.00 | H452: 8.78 | I452: 16 | J452: 142 | K452: 9.02 | L452: 4860000 | N452: 301435015
A453: =A452+1 -> 452 | B453: 81003288 | C453: Nguyễn Ngọc | D453: Thuận | E453: 290992 | F453: XD10CD3 | G453: 100.00 | H453: 8.74 | I453: 17 | J453: 142 | K453: 8.99 | L453: 4050000 | N453: 241233162
A454: =A453+1 -> 453 | B454: 81001846 | C454: Nguyễn Tấn | D454: Luân | E454: 161192 | F454: XD10DD2 | G454: 100.00 | H454: 8.71 | I454: 17 | J454: 141 | K454: 8.97 | L454: 4050000 | N454: 212753365
A455: =A454+1 -> 454 | B455: 81001691 | C455: Trần Văn | D455: Lên | E455: 170892 | F455: XD10DD2 | G455: 90.00 | H455: 8.95 | I455: 11 | J455: 143 | K455: 8.96 | L455: 4050000 | N455: 264410717
A456: =A455+1 -> 455 | B456: 81000649 | C456: Phạm Xuân | D456: Đạt | E456: 220692 | F456: XD10CD1 | G456: 100.00 | H456: 8.66 | I456: 16 | J456: 142 | K456: 8.93 | L456: 4050000 | N456: 205657127
A457: =A456+1 -> 456 | B457: 81000086 | C457: Nguyễn Tuấn | D457: Anh | E457: 200292 | F457: XD10DD1 | G457: 100.00 | H457: 8.64 | I457: 18 | J457: 140 | K457: 8.91 | L457: 4050000 | N457: 272642340
A458: =A457+1 -> 457 | B458: 81002628 | C458: Phạm Hùng | D458: Quân | E458: 080192 | F458: XD10CD2 | G458: 100.00 | H458: 8.57 | I458: 14 | J458: 140 | K458: 8.86 | L458: 4050000 | N458: 205652654
A459: =A458+1 -> 458 | B459: 81004003 | C459: Nguyễn Nhật | D459: Vinh | E459: 200292 | F459: XD10DD4 | G459: 96.00 | H459: 8.66 | I459: 19 | J459: 141 | K459: 8.85 | L459: 4050000 | N459: 245196070
A460: =A459+1 -> 459 | B460: 81004063 | C460: Lê Tuấn | D460: Vũ | E460: 201292 | F460: XD10CD3 | G460: 100.00 | H460: 8.53 | I460: 17 | J460: 140 | K460: 8.82 | L460: 4050000 | N460: 215253208
A461: =A460+1 -> 460 | B461: 81000213 | C461: Đỗ Thanh | D461: Bình | E461: 201092 | F461: XD10DD1 | G461: 92.00 | H461: 8.67 | I461: 15 | J461: 141 | K461: 8.78 | L461: 4050000 | N461: 191747684
A462: =A461+1 -> 461 | B462: 81003157 | C462: Mai Xuân | D462: Thiện | E462: 290592 | F462: XD10DD4 | G462: 100.00 | H462: 8.47 | I462: 17 | J462: 141 | K462: 8.78 | L462: 4050000 | N462: 261254033
A463: =A462+1 -> 462 | B463: 81003112 | C463: Nguyễn Văn | D463: Thân | E463: 081092 | F463: XD10CD3 | G463: 100.00 | H463: 8.44 | I463: 16 | J463: 142 | K463: 8.75 | L463: 4050000 | N463: 215246897
A464: =A463+1 -> 463 | B464: 81002359 | C464: Trần Hồng | D464: Phát | E464: 250792 | F464: XD10DD3 | G464: 90.00 | H464: 8.67 | I464: 15 | J464: 141 | K464: 8.74 | L464: 4050000 | N464: 024763520
A465: =A464+1 -> 464 | B465: 81003896 | C465: Phạm Thanh | D465: Tùng | E465: 290392 | F465: XD10KSTN | G465: 85.00 | H465: 8.80 | I465: 15 | J465: 140 | K465: 8.74 | L465: 4050000 | N465: 024782849
A466: =A465+1 -> 465 | B466: 81000504 | C466: Võ | D466: Duy | E466: 080592 | F466: XD10KSTN | G466: 95.00 | H466: 8.53 | I466: 15 | J466: 140 | K466: 8.72 | L466: 4050000 | N466: 261257359
A467: =A466+1 -> 466 | B467: 81002044 | C467: Nguyễn Thế | D467: Nam | E467: 270492 | F467: XD10DD2 | G467: 95.00 | H467: 8.53 | I467: 15 | J467: 141 | K467: 8.72 | L467: 4050000 | N467: 183806162
A468: =A467+1 -> 467 | B468: 81000424 | C468: Nguyễn Quang | D468: Diệu | E468: 070492 | F468: XD10VL2 | G468: 100.00 | H468: 9.22 | I468: 16 | J468: 140 | K468: 9.38 | L468: 4860000 | N468: 312077588
A469: =A468+1 -> 468 | B469: 81000147 | C469: Đinh Hữu | D469: Bá | E469: 151192 | F469: XD10VL2 | G469: 90.00 | H469: 8.59 | I469: 16 | J469: 141 | K469: 8.67 | L469: 4050000 | N469: 187188079
A470: =A469+1 -> 469 | B470: 81004152 | C470: Nguyễn Thị Hồng | D470: Xuyến | E470: 071092 | F470: XD10VL2 | G470: 100.00 | H470: 8.22 | I470: 18 | J470: 138 | K470: 8.58 | L470: 4050000 | N470: 221291350
A471: =A470+1 -> 470 | B471: 81001419 | C471: Tô Lê | D471: Hương | E471: 060892 | F471: XD10VL2 | G471: 95.00 | H471: 8.34 | I471: 16 | J471: 140 | K471: 8.57 | L471: 4050000 | N471: 024700274
A472: =A471+1 -> 471 | B472: 81000277 | C472: Nguyễn Minh | D472: Châu | E472: 100591 | F472: XD10KT | G472: 100.00 | H472: 9.31 | I472: 18 | J472: 157 | K472: 9.45 | L472: 4860000 | N472: 272280027
A473: =A472+1 -> 472 | B473: 81002148 | C473: Phạm Thị Yến | D473: Ngọc | E473: 020991 | F473: XD10KT | G473: 95.00 | H473: 8.97 | I473: 18 | J473: 157 | K473: 9.08 | L473: 4860000 | N473: 312096998
A474: =A473+1 -> 473 | B474: 81000364 | C474: Huỳnh Việt | D474: Cường | E474: 090192 | F474: XD10TD1 | G474: 100.00 | H474: 7.56 | I474: 17 | J474: 143 | K474: 8.05 | L474: 4050000 | N474: 221336879
A475: =A474+1 -> 474 | B475: 81000597 | C475: Đinh Hoàng | D475: Đạo | E475: 250792 | F475: XD10TD1 | G475: 90.00 | H475: 7.34 | I475: 16 | J475: 146 | K475: 7.67 | L475: 3240000 | N475: 381607595
A476: =A475+1 -> 475 | B476: 81000692 | C476: Dương Hoàng | D476: Định | E476: 030792 | F476: XD10TD1 | G476: 100.00 | H476: 6.72 | I476: 18 | J476: 149 | K476: 7.38 | L476: 3240000 | N476: 312132108
A477: =A476+1 -> 476 | B477: 81100304 | C477: Nguyễn Thanh | D477: Bình | E477: 160192 | F477: XD11KT | G477: 100.00 | H477: 8.40 | I477: 20 | J477: 118 | K477: 8.72 | L477: 4050000 | N477: 225515551
A478: =A477+1 -> 477 | B478: 81100746 | C478: Nguyễn Văn | D478: Đạt | E478: 290393 | F478: XD11KT | G478: 85.00 | H478: 8.30 | I478: 20 | J478: 125 | K478: 8.34 | L478: 4050000 | N478: 025330972
A479: =A478+1 -> 478 | B479: 81100348 | C479: Phạm | D479: Cần | E479: 160493 | F479: XD11TD1 | G479: 95.00 | H479: 7.82 | I479: 19 | J479: 114 | K479: 8.16 | L479: 4050000 | N479: 215204620
A480: =A479+1 -> 479 | B480: 81100916 | C480: Trần Đông | D480: Giang | E480: 070193 | F480: XD11TD2 | G480: 95.00 | H480: 7.59 | I480: 23 | J480: 113 | K480: 7.97 | L480: 3240000 | N480: 301458332
A481: =A480+1 -> 480 | B481: 81100581 | C481: Nguyễn Ngọc | D481: Duy | E481: 010693 | F481: XD11DC | G481: 95.00 | H481: 6.95 | I481: 19 | J481: 117 | K481: 7.46 | L481: 3240000 | N481: 221335556
A482: =A481+1 -> 481 | B482: 81101278 | C482: Lê Thái | D482: Hòa | E482: 151293 | F482: XD11CB1 | G482: 100.00 | H482: 9.13 | I482: 24 | J482: 107 | K482: 9.30 | L482: 4860000 | N482: 230874393
A483: =A482+1 -> 482 | B483: 81103919 | C483: Trần Đoàn | D483: Trương | E483: 210693 | F483: XD11CD3 | G483: 95.00 | H483: 8.91 | I483: 17 | J483: 111 | K483: 9.03 | L483: 4860000 | N483: 225444762
A484: =A483+1 -> 483 | B484: 81003735 | C484: Cao Anh | D484: Tuấn | E484: 270592 | F484: XD11DD3 | G484: 95.00 | H484: 8.77 | I484: 15 | J484: 110 | K484: 8.92 | L484: 4050000 | N484: 241282074
A485: =A484+1 -> 484 | B485: 81100872 | C485: Nguyễn Phúc | D485: Đức | E485: 161293 | F485: XD11DD1 | G485: 94.00 | H485: 8.71 | I485: 17 | J485: 110 | K485: 8.85 | L485: 4050000 | N485: 285424967
A486: =A485+1 -> 485 | B486: 81103421 | C486: Nguyễn Tấn | D486: Thịnh | E486: 200693 | F486: XD11KSTN | G486: 85.00 | H486: 8.82 | I486: 17 | J486: 110 | K486: 8.76 | L486: 4050000 | N486: 241412609
A487: =A486+1 -> 486 | B487: 81101504 | C487: Võ Hồng | D487: Hưng | E487: 030893 | F487: XD11DD1 | G487: 95.00 | H487: 8.50 | I487: 15 | J487: 110 | K487: 8.70 | L487: 4050000 | N487: 215210329
A488: =A487+1 -> 487 | B488: 81100842 | C488: Thái Văn | D488: Đương | E488: 250393 | F488: XD11DD3 | G488: 100.00 | H488: 8.32 | I488: 17 | J488: 112 | K488: 8.66 | L488: 4050000 | N488: 187036214
A489: =A488+1 -> 488 | B489: 81102100 | C489: Lê Lưu Thiết | D489: Mộc | E489: 210493 | F489: XD11KSTN | G489: 85.00 | H489: 8.68 | I489: 20 | J489: 110 | K489: 8.64 | L489: 4050000 | N489: 272230706
A490: =A489+1 -> 489 | B490: 81102955 | C490: Phạm Quang | D490: Sơn | E490: 130793 | F490: XD11DD2 | G490: 92.00 | H490: 8.50 | I490: 17 | J490: 110 | K490: 8.64 | L490: 4050000 | N490: 241482607
A491: =A490+1 -> 490 | B491: 81103448 | C491: Võ Minh | D491: Thoại | E491: 190393 | F491: XD11DD5 | G491: 95.00 | H491: 8.42 | I491: 19 | J491: 105 | K491: 8.64 | L491: 4050000 | N491: 221336720
A492: =A491+1 -> 491 | B492: 81101794 | C492: Võ Tùng | D492: Lâm | E492: 150793 | F492: XD11DD1 | G492: 95.00 | H492: 8.40 | I492: 25 | J492: 110 | K492: 8.62 | L492: 4050000 | N492: 197319276
A493: =A492+1 -> 492 | B493: 81101465 | C493: Đỗ Quang | D493: Hưng | E493: 100993 | F493: XD11DD1 | G493: 95.00 | H493: 8.37 | I493: 15 | J493: 110 | K493: 8.60 | L493: 4050000 | N493: 312165717
A494: =A493+1 -> 493 | B494: 81100218 | C494: Lê Công | D494: Bảo | E494: 051093 | F494: XD11DD1 | G494: 100.00 | H494: 8.21 | I494: 17 | J494: 110 | K494: 8.57 | L494: 4050000 | N494: 212759442
A495: =A494+1 -> 494 | B495: 81102977 | C495: Chung Lê Tú | D495: Tài | E495: 061093 | F495: XD11KSTN | G495: 100.00 | H495: 8.21 | I495: 17 | J495: 110 | K495: 8.57 | L495: 4050000 | N495: 352177052
A496: =A495+1 -> 495 | B496: 81102003 | C496: Nguyễn Trần Hà | D496: Ly | E496: 151293 | F496: XD11KSTN | G496: 100.00 | H496: 8.20 | I496: 15 | J496: 110 | K496: 8.56 | L496: 4050000 | N496: 250947403
A497: =A496+1 -> 496 | B497: 81102781 | C497: Hồ Hoàng Phú | D497: Quí | E497: 160493 | F497: XD11DD4 | G497: 100.00 | H497: 8.19 | I497: 18 | J497: 108 | K497: 8.55 | L497: 4050000 | N497: 341714237
A498: =A497+1 -> 497 | B498: 81102246 | C498: Trần Thị | D498: Ngoan | E498: 030393 | F498: XD11KSTN | G498: 95.00 | H498: 8.30 | I498: 20 | J498: 110 | K498: 8.54 | L498: 4050000 | N498: 381630251
A499: =A498+1 -> 498 | B499: 81102872 | C499: Bùi Hữu Minh | D499: Sang | E499: 291093 | F499: XD11DD2 | G499: 94.00 | H499: 8.29 | I499: 17 | J499: 110 | K499: 8.51 | L499: 4050000 | N499: 025119254
A500: =A499+1 -> 499 | B500: 81103932 | C500: Nguyễn Văn | D500: Trường | E500: 270992 | F500: XD11DD3 | G500: 90.00 | H500: 8.39 | I500: 19 | J500: 112 | K500: 8.51 | L500: 4050000 | N500: 272182171
A501: =A500+1 -> 500 | B501: 81103957 | C501: Bùi Thanh | D501: Tuấn | E501: 240393 | F501: XD11DD3 | G501: 97.00 | H501: 8.17 | I501: 18 | J501: 110 | K501: 8.48 | L501: 4050000 | N501: 261229232
A502: =A501+1 -> 501 | B502: 81101111 | C502: Nguyễn Trọng | D502: Hiếu | E502: 200793 | F502: XD11KSTN | G502: 95.00 | H502: 8.21 | I502: 17 | J502: 110 | K502: 8.47 | L502: 4050000 | N502: 291040016
A503: =A502+1 -> 502 | B503: 81101206 | C503: Bùi Minh | D503: Hoàng | E503: 101193 | F503: XD11DD1 | G503: 95.00 | H503: 8.21 | I503: 17 | J503: 110 | K503: 8.47 | L503: 4050000 | N503: 164497656
A504: =A503+1 -> 503 | B504: 81102682 | C504: Đào Quý | D504: Phước | E504: 020493 | F504: XD11DD2 | G504: 92.00 | H504: 8.29 | I504: 14 | J504: 123 | K504: 8.47 | L504: 4050000 | N504: 261237404
A505: =A504+1 -> 504 | B505: 81101611 | C505: Phan Văn Hoàng | D505: Khăm | E505: 051093 | F505: XD11DD4 | G505: 95.00 | H505: 8.20 | I505: 20 | J505: 110 | K505: 8.46 | L505: 4050000 | N505: 191798940
A506: =A505+1 -> 505 | B506: 81100439 | C506: Bùi Hữu | D506: Cường | E506: 040493 | F506: XD11CD1 | G506: 92.00 | H506: 8.24 | I506: 17 | J506: 113 | K506: 8.43 | L506: 4050000 | N506: 024895652
A507: =A506+1 -> 506 | B507: 81102236 | C507: Trần Phúc | D507: Nghĩa | E507: 310893 | F507: XD11VL2 | G507: 100.00 | H507: 8.65 | I507: 17 | J507: 119 | K507: 8.92 | L507: 4050000 | N507: 024890577
A508: =A507+1 -> 507 | B508: 81101801 | C508: Trần Thị Diễm | D508: Lê | E508: 200693 | F508: XD11VL2 | G508: 95.00 | H508: 8.59 | I508: 22 | J508: 107 | K508: 8.77 | L508: 4050000 | N508: 025100620
A509: =A508+1 -> 508 | B509: 81100347 | C509: Lê Thanh | D509: Cần | E509: 200993 | F509: XD11VL2 | G509: 90.00 | H509: 8.53 | I509: 18 | J509: 117 | K509: 8.62 | L509: 4050000 | N509: 363726283
A510: =A509+1 -> 509 | B510: 81103780 | C510: Nguyễn Thị Lệ | D510: Trinh | E510: 010593 | F510: XD11VL2 | G510: 95.00 | H510: 8.31 | I510: 18 | J510: 112 | K510: 8.55 | L510: 4050000 | N510: 273534029
A511: =A510+1 -> 510 | B511: 81204452 | C511: Phan Văn | D511: Vàng | E511: 270594 | F511: XD12KT | G511: 100.00 | H511: 7.60 | I511: 21 | J511: 80 | K511: 8.08 | L511: 4050000 | N511: 025301305
A512: =A511+1 -> 511 | B512: 81202393 | C512: Bùi Thị Kim | D512: Ngọc | E512: 050494 | F512: XD12KT | G512: 90.00 | H512: 7.81 | I512: 21 | J512: 80 | K512: 8.05 | L512: 4050000 | N512: 301492405
A513: =A512+1 -> 512 | B513: 81204016 | C513: Đặng Thị Tuyết | D513: Trinh | E513: 150894 | F513: XD12TD2 | G513: 96.00 | H513: 8.03 | I513: 17 | J513: 77 | K513: 8.34 | L513: 4050000 | N513: 230967537
A514: =A513+1 -> 513 | B514: 81201216 | C514: Nguyễn Huy | D514: Hoàng | E514: 300794 | F514: XD12TD1 | G514: 89.00 | H514: 7.59 | I514: 17 | J514: 71 | K514: 7.85 | L514: 3240000 | N514: 273549156
A515: =A514+1 -> 514 | B515: 81201760 | C515: Trần Hoàng | D515: Khương | E515: 311094 | F515: XD12TD1 | G515: 87.00 | H515: 7.41 | I515: 16 | J515: 73 | K515: 7.67 | L515: 3240000 | N515: 250941677
A516: =A515+1 -> 515 | B516: 81203484 | C516: Trịnh Ngọc | D516: Thạch | E516: 070594 | F516: XD12TD1 | G516: 85.00 | H516: 7.24 | I516: 19 | J516: 73 | K516: 7.49 | L516: 3240000 | N516: 273488953
A517: =A516+1 -> 516 | B517: 81204025 | C517: Trần Thị Tuyết | D517: Trinh | E517: 211193 | F517: XD12TD1 | G517: 82.00 | H517: 6.76 | I517: 19 | J517: 75 | K517: 7.05 | L517: 3240000 | N517: 371519808
A518: =A517+1 -> 517 | B518: 81203625 | C518: Nguyễn Khả | D518: Thịnh | E518: 261294 | F518: XD12VL2 | G518: 95.00 | H518: 8.83 | I518: 18 | J518: 73 | K518: 8.96 | L518: 4050000 | N518: 215406448
A519: =A518+1 -> 518 | B519: 81203645 | C519: Đặng Văn | D519: Thoàn | E519: 100294 | F519: XD12VL2 | G519: 95.00 | H519: 8.31 | I519: 18 | J519: 78 | K519: 8.55 | L519: 4050000 | N519: 321477739
A520: =A519+1 -> 519 | B520: 81201035 | C520: Huỳnh Công | D520: Hậu | E520: 280594 | F520: XD12VL2 | G520: 80.00 | H520: 8.31 | I520: 18 | J520: 71 | K520: 8.25 | L520: 4050000 | N520: 272258567
A521: =A520+1 -> 520 | B521: 81200421 | C521: Hồ Vũ | D521: Cường | E521: 010194 | F521: XD12VL1 | G521: 90.00 | H521: 8.03 | I521: 16 | J521: 67 | K521: 8.22 | L521: 4050000 | N521: 215261339
A522: =A521+1 -> 521 | B522: 81201052 | C522: Trần Quang | D522: Hậu | E522: 261194 | F522: XD12KSTN | G522: 95.00 | H522: 9.44 | I522: 16 | J522: 71 | K522: 9.45 | L522: 4860000 | N522: 273571471
A523: =A522+1 -> 522 | B523: 81200203 | C523: Trần Minh | D523: Bảo | E523: 260794 | F523: XD12DD1 | G523: 97.00 | H523: 9.28 | I523: 18 | J523: 74 | K523: 9.36 | L523: 4860000 | N523: 230922973
A524: =A523+1 -> 523 | B524: 81203287 | C524: Lê Thanh | D524: Tân | E524: 200994 | F524: XD12DD2 | G524: 98.00 | H524: 9.22 | I524: 16 | J524: 71 | K524: 9.34 | L524: 4860000 | N524: 215321750
A525: =A524+1 -> 524 | B525: 81204187 | C525: Trương Hoài | D525: Trúc | E525: 200893 | F525: XD12DD3 | G525: 98.00 | H525: 9.13 | I525: 15 | J525: 73 | K525: 9.26 | L525: 4860000 | N525: 241479457
A526: =A525+1 -> 525 | B526: 81201657 | C526: Nguyễn Duy | D526: Khả | E526: 070294 | F526: XD12KSTN | G526: 95.00 | H526: 9.16 | I526: 16 | J526: 71 | K526: 9.23 | L526: 4860000 | N526: 225703509
A527: =A526+1 -> 526 | B527: 81200277 | C527: Nguyễn Quang Thiên | D527: Bửu | E527: 290394 | F527: XD12KSTN | G527: 95.00 | H527: 9.08 | I527: 18 | J527: 71 | K527: 9.16 | L527: 4860000 | N527: 273488458
A528: =A527+1 -> 527 | B528: 81201626 | C528: Ngô Đình | D528: Khánh | E528: 160394 | F528: XD12DD4 | G528: 95.00 | H528: 9.06 | I528: 16 | J528: 71 | K528: 9.15 | L528: 4860000 | N528: 212709645
A529: =A528+1 -> 528 | B529: 81202131 | C529: Huỳnh Nhật | D529: Minh | E529: 261094 | F529: XD12KSTN | G529: 95.00 | H529: 9.03 | I529: 18 | J529: 71 | K529: 9.12 | L529: 4860000 | N529: 225525225
A530: =A529+1 -> 529 | B530: 81201619 | C530: Huỳnh | D530: Khánh | E530: 180494 | F530: XD12DD1 | G530: 95.00 | H530: 9.00 | I530: 18 | J530: 69 | K530: 9.10 | L530: 4860000 | N530: 261303722
A531: =A530+1 -> 530 | B531: 81204533 | C531: Lê Thành | D531: Vinh | E531: 250794 | F531: XD12KSTN | G531: 95.00 | H531: 8.97 | I531: 17 | J531: 69 | K531: 9.08 | L531: 4860000 | N531: 261301358
A532: =A531+1 -> 531 | B532: 81204634 | C532: Phạm Anh | D532: Vũ | E532: 280394 | F532: XD12KSTN | G532: 95.00 | H532: 8.97 | I532: 18 | J532: 71 | K532: 9.08 | L532: 4860000 | N532: 273570721
A533: =A532+1 -> 532 | B533: 81201164 | C533: Nguyễn Lục Hoàng | D533: Hiệp | E533: 281094 | F533: XD12DD1 | G533: 98.00 | H533: 8.81 | I533: 16 | J533: 71 | K533: 9.01 | L533: 4860000 | N533: 334794241
A534: =A533+1 -> 533 | B534: 81203831 | C534: Nguyễn Viết | D534: Tiến | E534: 200494 | F534: XD12KSTN | G534: 95.00 | H534: 8.88 | I534: 16 | J534: 71 | K534: 9.00 | L534: 4860000 | N534: 272336457
A535: =A534+1 -> 534 | B535: 81204555 | C535: Phạm Bá | D535: Vinh | E535: 060393 | F535: XD12KSTN | G535: 96.00 | H535: 8.85 | I535: 17 | J535: 69 | K535: 9.00 | L535: 4860000 | N535: 241289355
A536: =A535+1 -> 535 | B536: 81203692 | C536: Bùi Hữu | D536: Thuận | E536: 090794 | F536: XD12DD3 | G536: 93.00 | H536: 8.89 | I536: 18 | J536: 73 | K536: 8.97 | L536: 4050000 | N536: 312259855
A537: =A536+1 -> 536 | B537: 81201020 | C537: Bùi Cao | D537: Hân | E537: 101194 | F537: XD12KSTN | G537: 95.00 | H537: 8.83 | I537: 18 | J537: 76 | K537: 8.96 | L537: 4050000 | N537: 312294789
A538: =A537+1 -> 537 | B538: 81201185 | C538: Nguyễn Tấn | D538: Hoài | E538: 010894 | F538: XD12KSTN | G538: 95.00 | H538: 8.83 | I538: 18 | J538: 76 | K538: 8.96 | L538: 4050000 | N538: 312207429
A539: =A538+1 -> 538 | B539: 81202776 | C539: Đinh Hữu | D539: Phúc | E539: 020294 | F539: XD12KSTN | G539: 95.00 | H539: 8.81 | I539: 18 | J539: 71 | K539: 8.95 | L539: 4050000 | N539: 241422596
A540: =A539+1 -> 539 | B540: 81202966 | C540: Đỗ Trường | D540: Quân | E540: 090694 | F540: XD12KSTN | G540: 98.00 | H540: 8.73 | I540: 15 | J540: 71 | K540: 8.94 | L540: 4050000 | N540: 197294013
A541: =A540+1 -> 540 | B541: 81203071 | C541: Nguyễn Thị Sơn | D541: Quỳnh | E541: 221094 | F541: XD12DD2 | G541: 100.00 | H541: 8.67 | I541: 18 | J541: 78 | K541: 8.94 | L541: 4050000 | N541: 341740988
A542: =A541+1 -> 541 | B542: 81200291 | C542: Nguyễn Tuấn | D542: Cảnh | E542: 160494 | F542: XD12CD1 | G542: 92.00 | H542: 8.83 | I542: 18 | J542: 76 | K542: 8.90 | L542: 4050000 | N542: 230873988
A543: =A542+1 -> 542 | B543: 81200457 | C543: Trần Tố | D543: Cường | E543: 150794 | F543: XD12KSTN | G543: 95.00 | H543: 8.75 | I543: 16 | J543: 71 | K543: 8.90 | L543: 4050000 | N543: 191808343
A544: =A543+1 -> 543 | B544: 81204699 | C544: Nguyễn Đức Bắc | D544: Xế | E544: 101294 | F544: XD12KSTN | G544: 95.00 | H544: 8.75 | I544: 16 | J544: 71 | K544: 8.90 | L544: 4050000 | N544: 191813940
A545: =A544+1 -> 544 | B545: 81304490 | C545: Ng Đăng Hoàng Nhật | D545: Trường | E545: 270195 | F545: XD13KT | G545: 96.00 | H545: 8.30 | I545: 20 | J545: 42 | K545: 8.56 | L545: 4050000 | N545: 272420161
A546: =A545+1 -> 545 | B546: 81300813 | C546: Phạm Xuân | D546: Đạt | E546: 010595 | F546: XD13KT | G546: 93.00 | H546: 8.10 | I546: 20 | J546: 38 | K546: 8.34 | L546: 4050000 | N546: 197322263
A547: =A546+1 -> 546 | B547: 81300358 | C547: Mai Bảo | D547: Châu | E547: 021095 | F547: XD13VL1 | G547: 100.00 | H547: 8.81 | I547: 18 | J547: 36 | K547: 9.05 | L547: 4860000 | N547: 272486620
A548: =A547+1 -> 547 | B548: 81304788 | C548: Phan Lâm | D548: Vẹn | E548: 130489 | F548: XD13VL2 | G548: 99.00 | H548: 8.06 | I548: 16 | J548: 32 | K548: 8.43 | L548: 4050000 | N548: 312024825
A549: =A548+1 -> 548 | B549: 81300106 | C549: Nguyễn Nhật | D549: Anh | E549: 091095 | F549: XD13VL1 | G549: 88.00 | H549: 8.17 | I549: 18 | J549: 38 | K549: 8.30 | L549: 4050000 | N549: 025324268
A550: =A549+1 -> 549 | B550: 81302924 | C550: Nguyễn Văn | D550: Phi | E550: 280794 | F550: XD13VL1 | G550: 94.00 | H550: 7.69 | I550: 18 | J550: 38 | K550: 8.03 | L550: 4050000 | N550: 291073009
A551: =A550+1 -> 550 | B551: 81304311 | C551: Hoàng Ngọc | D551: Triều | E551: 251295 | F551: XD13XD11 | G551: 95.00 | H551: 8.97 | I551: 18 | J551: 36 | K551: 9.08 | L551: 4860000 | N551: 250989054
A552: =A551+1 -> 551 | B552: 81304151 | C552: Nguyễn Minh | D552: Tín | E552: 111294 | F552: XD13XD10 | G552: 95.00 | H552: 8.78 | I552: 18 | J552: 36 | K552: 8.92 | L552: 4050000 | N552: 215325789
A553: =A552+1 -> 552 | B553: 81301353 | C553: Phan Thanh | D553: Hoàng | E553: 021295 | F553: XD13XD08 | G553: 90.00 | H553: 8.72 | I553: 18 | J553: 38 | K553: 8.78 | L553: 4050000 | N553: 225579179
A554: =A553+1 -> 553 | B554: 81302833 | C554: Trương Quang | D554: Như | E554: 100195 | F554: XD13XD09 | G554: 90.00 | H554: 8.72 | I554: 18 | J554: 34 | K554: 8.78 | L554: 4050000 | N554: 212769175
A555: =A554+1 -> 554 | B555: 81304966 | C555: Nguyễn Quốc | D555: Vỹ | E555: 310595 | F555: XD13XD11 | G555: 95.00 | H555: 8.58 | I555: 18 | J555: 36 | K555: 8.76 | L555: 4050000 | N555: 261409350
A556: =A555+1 -> 555 | B556: 81303748 | C556: Trần Châu Bảo | D556: Thạch | E556: 020795 | F556: XD13XD08 | G556: 95.00 | H556: 8.53 | I556: 18 | J556: 38 | K556: 8.72 | L556: 4050000 | N556: 273533733
A557: =A556+1 -> 556 | B557: 81304513 | C557: Võ Quang | D557: Tuân | E557: 241295 | F557: XD13XD13 | G557: 95.00 | H557: 8.50 | I557: 16 | J557: 32 | K557: 8.70 | L557: 4050000 | N557: 194589485
A558: =A557+1 -> 557 | B558: 81304148 | C558: Nguyễn Đắc | D558: Tín | E558: 290495 | F558: XD13XD10 | G558: 95.00 | H558: 8.44 | I558: 18 | J558: 36 | K558: 8.65 | L558: 4050000 | N558: 192115714
A559: =A558+1 -> 558 | B559: 81303649 | C559: Đoàn Trần Tấn | D559: Thành | E559: 290995 | F559: XD13XD10 | G559: 95.00 | H559: 8.39 | I559: 18 | J559: 36 | K559: 8.61 | L559: 4050000 | N559: 273568075
A560: =A559+1 -> 559 | B560: 81304502 | C560: Huỳnh Công | D560: Trứ | E560: 260195 | F560: XD13XD13 | G560: 95.00 | H560: 8.33 | I560: 18 | J560: 34 | K560: 8.56 | L560: 4050000 | N560: 225755251
A561: =A560+1 -> 560 | B561: 81300784 | C561: Lộ Thành | D561: Đạt | E561: 051095 | F561: XD13XD05 | G561: 80.00 | H561: 8.69 | I561: 18 | J561: 38 | K561: 8.55 | L561: 4050000 | N561: 264462027
A562: =A561+1 -> 561 | B562: 81304174 | C562: Nguyễn Thanh | D562: Tịnh | E562: 201195 | F562: XD13XD11 | G562: 95.00 | H562: 8.28 | I562: 18 | J562: 34 | K562: 8.52 | L562: 4050000 | N562: 197323780
A563: =A562+1 -> 562 | B563: 81301876 | C563: Nguyễn Trần Đăng | D563: Khoa | E563: 110295 | F563: XD13XD04 | G563: 85.00 | H563: 8.47 | I563: 18 | J563: 34 | K563: 8.48 | L563: 4050000 | N563: 371611674
A564: =A563+1 -> 563 | B564: 81303780 | C564: Nguyễn Công | D564: Thắng | E564: 101095 | F564: XD13XD12 | G564: 95.00 | H564: 8.19 | I564: 18 | J564: 34 | K564: 8.45 | L564: 4050000 | N564: 291068659
A565: =A564+1 -> 564 | B565: 81304507 | C565: Lương Văn | D565: Tuân | E565: 241095 | F565: XD13XD13 | G565: 95.00 | H565: 8.19 | I565: 16 | J565: 32 | K565: 8.45 | L565: 4050000 | N565: 163342435
A566: =A565+1 -> 565 | B566: 81301791 | C566: Nguyễn Mai | D566: Khánh | E566: 160895 | F566: XD13XD04 | G566: 90.00 | H566: 8.25 | I566: 16 | J566: 32 | K566: 8.40 | L566: 4050000 | N566: 184096010
A567: =A566+1 -> 566 | B567: 81304266 | C567: Hồ Phi | D567: Trâm | E567: 140595 | F567: XD13XD12 | G567: 95.00 | H567: 8.08 | I567: 18 | J567: 33 | K567: 8.36 | L567: 4050000 | N567: 184112715
A568: =A567+1 -> 567 | B568: 81304844 | C568: Nguyễn Phước | D568: Vinh | E568: 160694 | F568: XD13XD11 | G568: 95.00 | H568: 8.08 | I568: 18 | J568: 34 | K568: 8.36 | L568: 4050000 | N568: 272398272
A569: =A568+1 -> 568 | B569: 81301573 | C569: Trần Ngọc | D569: Huỳnh | E569: 110495 | F569: XD13XD06 | G569: 80.00 | H569: 8.44 | I569: 18 | J569: 35 | K569: 8.35 | L569: 4050000 | N569: 312270846
A570: =A569+1 -> 569 | B570: 81304279 | C570: Cao Bảo | D570: Trân | E570: 031095 | F570: XD13XD06 | G570: 90.00 | H570: 8.19 | I570: 18 | J570: 36 | K570: 8.35 | L570: 4050000 | N570: 261344590
A571: =A570+1 -> 570 | B571: 81304462 | C571: Nguyễn Thanh | D571: Truyền | E571: 260395 | F571: XD13XD11 | G571: 90.00 | H571: 8.17 | I571: 18 | J571: 36 | K571: 8.34 | L571: 4050000 | N571: 212666612
A572: =A571+1 -> 571 | B572: 81305010 | C572: Hứa Văn | D572: Đào | E572: 050194 | F572: XD13XD13 | G572: 90.00 | H572: 8.16 | I572: 16 | J572: 32 | K572: 8.33 | L572: 4050000 | N572: 245213379
A573: =A572+1 -> 572 | B573: 81303185 | C573: Trần Đăng | D573: Quang | E573: 050995 | F573: XD13XD09 | G573: 90.00 | H573: 8.14 | I573: 18 | J573: 34 | K573: 8.31 | L573: 4050000 | N573: 205873397
A574: =A573+1 -> 573 | B574: 81301412 | C574: Đặng Văn | D574: Hợi | E574: 210395 | F574: XD13XD06 | G574: 95.00 | H574: 7.94 | I574: 18 | J574: 36 | K574: 8.25 | L574: 4050000 | N574: 241572775
A575: =A574+1 -> 574 | B575: 81300475 | C575: Nguyễn Tuấn | D575: Cường | E575: 140494 | F575: XD13BXD1 | G575: 90.00 | H575: 8.03 | I575: 16 | J575: 40 | K575: 8.22 | L575: 4050000 | N575: 025336223
A576: =A575+1 -> 575 | B576: 81304927 | C576: Phan Minh | D576: Vương | E576: 250895 | F576: XD13XD13 | G576: 90.00 | H576: 8.03 | I576: 16 | J576: 32 | K576: 8.22 | L576: 4050000 | N576: 215397688
A577: =A576+1 -> 576 | B577: 81302829 | C577: Phạm Hải | D577: Như | E577: 040394 | F577: XD13TD1 | G577: 98.00 | H577: 8.00 | I577: 20 | J577: 38 | K577: 8.36 | L577: 4050000 | N577: 312227096
A578: =A577+1 -> 577 | B578: 81300831 | C578: Hoàng Văn | D578: Đăng | E578: 051192 | F578: XD13TD1 | G578: 90.00 | H578: 7.38 | I578: 20 | J578: 36 | K578: 7.70 | L578: 3240000 | N578: 163109190
A579: =A578+1 -> 578 | B579: 81301151 | C579: Huỳnh Chí | D579: Hiếu | E579: 140795 | F579: XD13TD1 | G579: 90.00 | H579: 7.33 | I579: 20 | J579: 36 | K579: 7.66 | L579: 3240000 | N579: 321506550
A580: =A579+1 -> 579 | B580: 91000051 | C580: Lê Hoàng | D580: Anh | E580: 151192 | F580: MO10QLMT | G580: 95.00 | H580: 9.10 | I580: 10 | J580: 142 | K580: 9.18 | L580: 4860000 | N580: 312135379
A581: =A580+1 -> 580 | B581: 91003069 | C581: Trương Anh | D581: Thắm | E581: 020392 | F581: MO10KMT2 | G581: 100.00 | H581: 8.81 | I581: 13 | J581: 141 | K581: 9.05 | L581: 4860000 | N581: 312113024
A582: =A581+1 -> 581 | B582: 91000566 | C582: Nguyễn Thị Trùng | D582: Dương | E582: 050992 | F582: MO10KMT1 | G582: 100.00 | H582: 8.68 | I582: 11 | J582: 141 | K582: 8.94 | L582: 4050000 | N582: 212446101
A583: =A582+1 -> 582 | B583: 91003820 | C583: Lê Thị Bạch | D583: Tuyết | E583: 010791 | F583: MO10QLMT | G583: 90.00 | H583: 8.86 | I583: 14 | J583: 144 | K583: 8.89 | L583: 4050000 | N583: 331614888
A584: =A583+1 -> 583 | B584: 91002078 | C584: Lê Nguyễn Tuyết | D584: Ngân | E584: 060492 | F584: MO10QLMT | G584: 85.00 | H584: 8.80 | I584: 10 | J584: 142 | K584: 8.74 | L584: 4050000 | N584: 221335114
A585: =A584+1 -> 584 | B585: 91001975 | C585: Tạ Uyên | D585: Minh | E585: 170292 | F585: MO10QLMT | G585: 90.00 | H585: 8.61 | I585: 14 | J585: 144 | K585: 8.69 | L585: 4050000 | N585: 272235204
A586: =A585+1 -> 585 | B586: 91000080 | C586: Nguyễn Thị Lan | D586: Anh | E586: 010992 | F586: MO10QLMT | G586: 85.00 | H586: 8.71 | I586: 12 | J586: 142 | K586: 8.67 | L586: 4050000 | N586: 331657022
A587: =A586+1 -> 586 | B587: 91002322 | C587: Nguyễn Thành | D587: Ninh | E587: 251192 | F587: MO10KMT2 | G587: 90.00 | H587: 8.55 | I587: 11 | J587: 141 | K587: 8.64 | L587: 4050000 | N587: 215230253
A588: =A587+1 -> 587 | B588: 91101883 | C588: Nguyễn Thị Thanh | D588: Loan | E588: 030993 | F588: MO11QLMT | G588: 100.00 | H588: 8.97 | I588: 15 | J588: 115 | K588: 9.18 | L588: 4860000 | N588: 025390830
A589: =A588+1 -> 588 | B589: 91102480 | C589: Nguyễn Minh Kiều | D589: Oanh | E589: 120993 | F589: MO11QLMT | G589: 100.00 | H589: 8.71 | I589: 19 | J589: 117 | K589: 8.97 | L589: 4050000 | N589: 301464051
A590: =A589+1 -> 589 | B590: 91103534 | C590: Hồ Võ Vân | D590: Thư | E590: 010193 | F590: MO11QLMT | G590: 100.00 | H590: 8.41 | I590: 17 | J590: 117 | K590: 8.73 | L590: 4050000 | N590: 321450687
A591: =A590+1 -> 590 | B591: 91103346 | C591: Lê Hoàng | D591: Thiên | E591: 260993 | F591: MO11QLMT | G591: 100.00 | H591: 8.36 | I591: 18 | J591: 106 | K591: 8.69 | L591: 4050000 | N591: 291103416
A592: =A591+1 -> 591 | B592: 91100368 | C592: Nguyễn Phạm Kim | D592: Chi | E592: 210293 | F592: MO11QLMT | G592: 90.00 | H592: 8.57 | I592: 15 | J592: 113 | K592: 8.66 | L592: 4050000 | N592: 272253245
A593: =A592+1 -> 592 | B593: 91100289 | C593: Lê Thị Y | D593: Bình | E593: 101193 | F593: MO11KMT1 | G593: 95.00 | H593: 8.39 | I593: 18 | J593: 115 | K593: 8.61 | L593: 4050000 | N593: 212751427
A594: =A593+1 -> 593 | B594: 91100292 | C594: Ngô Long | D594: Bình | E594: 180793 | F594: MO11QLMT | G594: 100.00 | H594: 8.24 | I594: 17 | J594: 111 | K594: 8.59 | L594: 4050000 | N594: 301462988
A595: =A594+1 -> 594 | B595: 91100025 | C595: Nguyễn Trường | D595: An | E595: 090393 | F595: MO11QLMT | G595: 100.00 | H595: 8.15 | I595: 17 | J595: 111 | K595: 8.52 | L595: 4050000 | N595: 025164334
A596: =A595+1 -> 595 | B596: 91202849 | C596: Ngô Lê Tài | D596: Phương | E596: 270294 | F596: MO12KMT2 | G596: 94.00 | H596: 8.58 | I596: 18 | J596: 76 | K596: 8.74 | L596: 4050000 | N596: 301512959
A597: =A596+1 -> 596 | B597: 91200428 | C597: Nguyễn Chí | D597: Cường | E597: 080794 | F597: MO12KMT2 | G597: 90.00 | H597: 8.58 | I597: 18 | J597: 76 | K597: 8.66 | L597: 4050000 | N597: 025134170
A598: =A597+1 -> 597 | B598: 91202637 | C598: Mai Công | D598: Nhựt | E598: 020593 | F598: MO12QLMT | G598: 100.00 | H598: 8.17 | I598: 18 | J598: 76 | K598: 8.54 | L598: 4050000 | N598: 281052228
A599: =A598+1 -> 598 | B599: 91204722 | C599: Nguyễn Thị | D599: Yến | E599: 100694 | F599: MO12KMT1 | G599: 95.00 | H599: 8.28 | I599: 18 | J599: 76 | K599: 8.52 | L599: 4050000 | N599: 245268308
A600: =A599+1 -> 599 | B600: 91200796 | C600: Nguyễn Đắc | D600: Đông | E600: 021094 | F600: MO12QLMT | G600: 98.00 | H600: 8.14 | I600: 18 | J600: 71 | K600: 8.47 | L600: 4050000 | N600: 191809355
A601: =A600+1 -> 600 | B601: 91202459 | C601: Phạm Hoàng | D601: Nguyên | E601: 220594 | F601: MO12KMT2 | G601: 94.00 | H601: 8.19 | I601: 16 | J601: 76 | K601: 8.43 | L601: 4050000 | N601: 331783669
A602: =A601+1 -> 601 | B602: 91200966 | C602: Nguyễn Thị | D602: Hải | E602: 161094 | F602: MO12KMT1 | G602: 93.00 | H602: 8.09 | I602: 16 | J602: 76 | K602: 8.33 | L602: 4050000 | N602: 281097878
A603: =A602+1 -> 602 | B603: 91202080 | C603: Phạm Trường | D603: Lực | E603: 090394 | F603: MO12KMT1 | G603: 91.00 | H603: 8.14 | I603: 18 | J603: 78 | K603: 8.33 | L603: 4050000 | N603: 301497736
A604: =A603+1 -> 603 | B604: 91302781 | C604: Ng Thanh Huyền | D604: Nhi | E604: 290695 | F604: MO1301 | G604: 93.00 | H604: 7.68 | I604: 20 | J604: 39 | K604: 8.00 | L604: 4050000 | N604: 264409321
A605: =A604+1 -> 604 | B605: 91300572 | C605: Lương Anh | D605: Duy | E605: 090995 | F605: MO1301 | G605: 93.00 | H605: 7.70 | I605: 20 | J605: 37 | K605: 8.02 | L605: 4050000 | N605: 352227372
A606: =A605+1 -> 605 | B606: 91301428 | C606: Trần Thị | D606: Huế | E606: 110395 | F606: MO1301 | G606: 93.00 | H606: 7.70 | I606: 20 | J606: 39 | K606: 8.02 | L606: 4050000 | N606: 285567912
A607: =A606+1 -> 606 | B607: 91301403 | C607: Lý Sở | D607: Hồng | E607: 240395 | F607: MO1304 | G607: 95.00 | H607: 7.73 | I607: 20 | J607: 41 | K607: 8.08 | L607: 4050000 | N607: 025340482
A608: =A607+1 -> 607 | B608: 91304235 | C608: Nguyễn Thị Thùy | D608: Trang | E608: 200595 | F608: MO1302 | G608: 93.00 | H608: 7.78 | I608: 20 | J608: 39 | K608: 8.08 | L608: 4050000 | N608: 215371198
A609: =A608+1 -> 608 | B609: 91301740 | C609: Nguyễn Duy | D609: Khang | E609: 241295 | F609: MO1302 | G609: 93.00 | H609: 7.83 | I609: 20 | J609: 37 | K609: 8.12 | L609: 4050000 | N609: 272532779
A610: =A609+1 -> 609 | B610: 91303389 | C610: Phan Bùi Minh | D610: Sinh | E610: 120295 | F610: MO1302 | G610: 93.00 | H610: 7.88 | I610: 20 | J610: 39 | K610: 8.16 | L610: 4050000 | N610: 215302874
A611: =A610+1 -> 610 | B611: 91304472 | C611: Nguyễn Thuý | D611: Trúc | E611: 280295 | F611: MO1302 | G611: 98.00 | H611: 8.15 | I611: 20 | J611: 39 | K611: 8.48 | L611: 4050000 | N611: 381714179
A612: =A611+1 -> 611 | B612: G1003223 | C612: Thái Quang | D612: Thịnh | E612: 120792 | F612: GT10HK | G612: 100.00 | H612: 9.27 | I612: 13 | J612: 147 | K612: 9.42 | L612: 4860000 | N612: 225477371
A613: =A612+1 -> 612 | B613: G1002369 | C613: Lê Nguyễn Hoàng | D613: Phi | E613: 031192 | F613: GT10HK | G613: 100.00 | H613: 8.93 | I613: 15 | J613: 147 | K613: 9.14 | L613: 4860000 | N613: 024639481
A614: =A613+1 -> 613 | B614: G1001386 | C614: Nguyễn Hiệp | D614: Hưng | E614: 290992 | F614: GT10HK | G614: 100.00 | H614: 8.70 | I614: 15 | J614: 147 | K614: 8.96 | L614: 4050000 | N614: 024956261
A615: =A614+1 -> 614 | B615: G1002844 | C615: Lê Minh | D615: Tâm | E615: 271292 | F615: GT10OTO1 | G615: 95.00 | H615: 8.82 | I615: 17 | J615: 147 | K615: 8.96 | L615: 4050000 | N615: 291009342
A616: =A615+1 -> 615 | B616: G1004039 | C616: Đào Hồng | D616: Vũ | E616: 061292 | F616: GT10OTO1 | G616: 90.00 | H616: 8.82 | I616: 17 | J616: 147 | K616: 8.86 | L616: 4050000 | N616: 250919046
A617: =A616+1 -> 616 | B617: G1002229 | C617: Lê Trọng | D617: Nhân | E617: 181192 | F617: GT10HK | G617: 95.00 | H617: 8.67 | I617: 15 | J617: 147 | K617: 8.84 | L617: 4050000 | N617: 024751768
A618: =A617+1 -> 617 | B618: G1002398 | C618: Nguyễn Thanh | D618: Phong | E618: 250292 | F618: GT10HK | G618: 100.00 | H618: 8.53 | I618: 15 | J618: 147 | K618: 8.82 | L618: 4050000 | N618: 290994890
A619: =A618+1 -> 618 | B619: G1001461 | C619: Mai Văn | D619: Khanh | E619: 290691 | F619: GT10TAU | G619: 95.00 | H619: 8.50 | I619: 14 | J619: 147 | K619: 8.70 | L619: 4050000 | N619: 225530696
A620: =A619+1 -> 619 | B620: G1103841 | C620: Lương Hữu | D620: Trọng | E620: 160993 | F620: GT11HK | G620: 100.00 | H620: 9.23 | I620: 20 | J620: 118 | K620: 9.38 | L620: 4860000 | N620: 312231408
A621: =A620+1 -> 620 | B621: G1102910 | C621: Đặng Hoàng | D621: Sơn | E621: 230793 | F621: GT11TAU1 | G621: 100.00 | H621: 8.12 | I621: 21 | J621: 116 | K621: 8.50 | L621: 4050000 | N621: 312234971
A622: =A621+1 -> 621 | B622: G1103325 | C622: Nguyễn Thành | D622: Thêm | E622: 201093 | F622: GT11HK | G622: 100.00 | H622: 8.13 | I622: 19 | J622: 116 | K622: 8.50 | L622: 4050000 | N622: 212661397
A623: =A622+1 -> 622 | B623: G1102778 | C623: Trương Đình | D623: Quế | E623: 050893 | F623: GT11HK | G623: 95.00 | H623: 8.00 | I623: 15 | J623: 114 | K623: 8.30 | L623: 4050000 | N623: 025375824
A624: =A623+1 -> 623 | B624: G1103504 | C624: Trương Văn | D624: Thuận | E624: 161092 | F624: GT11HK | G624: 95.00 | H624: 7.90 | I624: 20 | J624: 116 | K624: 8.22 | L624: 4050000 | N624: 194502854
A625: =A624+1 -> 624 | B625: G1104180 | C625: Huỳnh Thanh | D625: Vân | E625: 260793 | F625: GT11HK | G625: 99.00 | H625: 7.68 | I625: 20 | J625: 114 | K625: 8.12 | L625: 4050000 | N625: 385525663
A626: =A625+1 -> 625 | B626: G1100824 | C626: Đặng Nhựt | D626: Đông | E626: 030993 | F626: GT11OTO1 | G626: 100.00 | H626: 7.61 | I626: 18 | J626: 115 | K626: 8.09 | L626: 4050000 | N626: 321478524
A627: =A626+1 -> 626 | B627: G1102245 | C627: Trần Thanh | D627: Ngoan | E627: 260893 | F627: GT11HK | G627: 98.00 | H627: 7.63 | I627: 20 | J627: 114 | K627: 8.06 | L627: 4050000 | N627: 385537460
A628: =A627+1 -> 627 | B628: G1103526 | C628: Nguyễn Xuân | D628: Thủy | E628: 250893 | F628: GT11HK | G628: 98.00 | H628: 7.53 | I628: 17 | J628: 116 | K628: 7.98 | L628: 3240000 | N628: 197262275
A629: =A628+1 -> 628 | B629: G1201864 | C629: Thượng Công | D629: Lập | E629: 271194 | F629: GT12TAU1 | G629: 98.00 | H629: 8.93 | I629: 20 | J629: 80 | K629: 9.10 | L629: 4860000 | N629: 025091113
A630: =A629+1 -> 629 | B630: G1203886 | C630: Trần Trung | D630: Tín | E630: 071192 | F630: GT12OTO1 | G630: 95.00 | H630: 8.37 | I630: 19 | J630: 79 | K630: 8.60 | L630: 4050000 | N630: 024738366
A631: =A630+1 -> 630 | B631: G1200548 | C631: Nguyễn Hoàng | D631: Duy | E631: 050794 | F631: GT12OTO1 | G631: 95.00 | H631: 8.08 | I631: 19 | J631: 79 | K631: 8.36 | L631: 4050000 | N631: 272383032
A632: =A631+1 -> 631 | B632: G1203896 | C632: Lê Hữu | D632: Tình | E632: 101294 | F632: GT12OTO1 | G632: 95.00 | H632: 8.00 | I632: 19 | J632: 75 | K632: 8.30 | L632: 4050000 | N632: 025275948
A633: =A632+1 -> 632 | B633: G1202511 | C633: Hồ Kỳ | D633: Nhân | E633: 220494 | F633: GT12HK | G633: 90.00 | H633: 8.03 | I633: 18 | J633: 76 | K633: 8.22 | L633: 4050000 | N633: 212373134
A634: =A633+1 -> 633 | B634: G1202826 | C634: Lê Văn | D634: Phục | E634: 200994 | F634: GT12OTO1 | G634: 95.00 | H634: 7.61 | I634: 18 | J634: 72 | K634: 7.99 | L634: 3240000 | N634: 331702750
A635: =A634+1 -> 634 | B635: G1202465 | C635: Trần Minh | D635: Nguyên | E635: 190794 | F635: GT12OTO1 | G635: 98.00 | H635: 7.53 | I635: 19 | J635: 73 | K635: 7.98 | L635: 3240000 | N635: 230980371
A636: =A635+1 -> 635 | B636: G1200073 | C636: Nguyễn Hoàng | D636: Anh | E636: 240994 | F636: GT12HK | G636: 98.00 | H636: 7.44 | I636: 16 | J636: 73 | K636: 7.91 | L636: 3240000 | N636: 025067710
A637: =A636+1 -> 636 | B637: G1202702 | C637: Điền Hồng | D637: Phi | E637: 070694 | F637: GT12OTO1 | G637: 85.00 | H637: 7.74 | I637: 19 | J637: 77 | K637: 7.89 | L637: 3240000 | N637: 025014736
A638: =A637+1 -> 637 | B638: G1302526 | C638: Mai Xuân | D638: Nghĩa | E638: 040995 | F638: GT1305 | G638: 95.00 | H638: 8.43 | I638: 20 | J638: 38 | K638: 8.64 | L638: 4050000 | N638: 273590200
A639: =A638+1 -> 638 | B639: G1304180 | C639: Đào Quang | D639: Toàn | E639: 230895 | F639: GT1305 | G639: 90.00 | H639: 8.33 | I639: 20 | J639: 38 | K639: 8.46 | L639: 4050000 | N639: 273620353
A640: =A639+1 -> 639 | B640: G1303417 | C640: Nguyễn Cao Trường | D640: Sơn | E640: 010395 | F640: GT1305 | G640: 95.00 | H640: 8.15 | I640: 20 | J640: 38 | K640: 8.42 | L640: 4050000 | N640: 201667694
A641: =A640+1 -> 640 | B641: G1304368 | C641: Trần Thiện | D641: Trí | E641: 021295 | F641: GT1305 | G641: 81.00 | H641: 8.20 | I641: 20 | J641: 36 | K641: 8.18 | L641: 4050000 | N641: 331798678
A642: =A641+1 -> 641 | B642: G1304540 | C642: Lê Ngọc | D642: Tuấn | E642: 100295 | F642: GT1305 | G642: 80.00 | H642: 8.18 | I642: 20 | J642: 36 | K642: 8.14 | L642: 4050000 | N642: 272450576
A643: =A642+1 -> 642 | B643: G1300597 | C643: Nguyễn Phan Bảo | D643: Duy | E643: 150795 | F643: GT1301 | G643: 100.00 | H643: 7.63 | I643: 20 | J643: 36 | K643: 8.10 | L643: 4050000 | N643: 341839976
A644: =A643+1 -> 643 | B644: G1304756 | C644: Mai Nguyễn | D644: Văn | E644: 171093 | F644: GT1302 | G644: 85.00 | H644: 7.98 | I644: 20 | J644: 40 | K644: 8.08 | L644: 4050000 | N644: 225487828
A645: =A644+1 -> 644 | B645: G1300808 | C645: Nguyễn Văn | D645: Đạt | E645: 220495 | F645: GT1303 | G645: 95.00 | H645: 7.63 | I645: 20 | J645: 38 | K645: 8.00 | L645: 4050000 | N645: 250987842
A646: =A645+1 -> 645 | B646: G1300994 | C646: Nguyễn Hải | D646: Hà | E646: 240495 | F646: GT1302 | G646: 85.00 | H646: 7.88 | I646: 20 | J646: 40 | K646: 8.00 | L646: 4050000 | N646: 025189359
A647: =A646+1 -> 646 | B647: K1000241 | C647: Vũ Nguyễn Thanh | D647: Bình | E647: 250292 | F647: KU10CKT | G647: 100.00 | H647: 9.50 | I647: 15 | J647: 146 | K647: 9.60 | L647: 4860000 | N647: 241376927
A648: =A647+1 -> 647 | B648: K1000477 | C648: Nguyễn Ngọc | D648: Duy | E648: 140492 | F648: KU10CKT | G648: 100.00 | H648: 9.30 | I648: 15 | J648: 146 | K648: 9.44 | L648: 4860000 | N648: 272377360
A649: =A648+1 -> 648 | B649: K1001811 | C649: Phan An | D649: Lộc | E649: 070892 | F649: KU10CKT | G649: 95.00 | H649: 9.23 | I649: 15 | J649: 146 | K649: 9.28 | L649: 4860000 | N649: 261243053
A650: =A649+1 -> 649 | B650: K1001772 | C650: Nguyễn Thành | D650: Long | E650: 241292 | F650: KU10CKT | G650: 100.00 | H650: 9.07 | I650: 15 | J650: 146 | K650: 9.26 | L650: 4860000 | N650: 230924066
A651: =A650+1 -> 650 | B651: K1002282 | C651: Trần Lý Minh | D651: Nhật | E651: 250992 | F651: KU10CKT | G651: 100.00 | H651: 8.97 | I651: 15 | J651: 146 | K651: 9.18 | L651: 4860000 | N651: 025207860
A652: =A651+1 -> 651 | B652: K1002897 | C652: Nguyễn Hoàng | D652: Tân | E652: 280292 | F652: KU10VLY | G652: 100.00 | H652: 8.95 | I652: 10 | J652: 146 | K652: 9.16 | L652: 4860000 | N652: 351997736
A653: =A652+1 -> 652 | B653: K1000271 | C653: Dương Thái Minh | D653: Châu | E653: 050492 | F653: KU10CKT | G653: 100.00 | H653: 8.90 | I653: 15 | J653: 146 | K653: 9.12 | L653: 4860000 | N653: 250895746
A654: =A653+1 -> 653 | B654: K1104084 | C654: Phạm Thanh | D654: Tú | E654: 250693 | F654: KU11VLY | G654: 100.00 | H654: 8.75 | I654: 20 | J654: 114 | K654: 9.00 | L654: 4860000 | N654: 281020260
A655: =A654+1 -> 654 | B655: K1103151 | C655: Phạm Ngọc | D655: Thanh | E655: 200893 | F655: KU11VLY | G655: 90.00 | H655: 8.65 | I655: 20 | J655: 145 | K655: 8.72 | L655: 4050000 | N655: 230913756
A656: =A655+1 -> 655 | B656: K1103494 | C656: Nguyễn Bình | D656: Thuận | E656: 041293 | F656: KU11CKT | G656: 90.00 | H656: 8.50 | I656: 20 | J656: 113 | K656: 8.60 | L656: 4050000 | N656: 194480519
A657: =A656+1 -> 656 | B657: K1101338 | C657: Huỳnh Quang | D657: Huy | E657: 090393 | F657: KU11VLY | G657: 97.00 | H657: 7.93 | I657: 20 | J657: 115 | K657: 8.28 | L657: 4050000 | N657: 312138699
A658: =A657+1 -> 657 | B658: K1103011 | C658: Võ Thành | D658: Tạ | E658: 291293 | F658: KU11CKT | G658: 75.00 | H658: 8.47 | I658: 18 | J658: 117 | K658: 8.28 | L658: 4050000 | N658: 301449880
A659: =A658+1 -> 658 | B659: K1100340 | C659: Ngô Tiến | D659: Cảnh | E659: 140692 | F659: KU11VLY | G659: 100.00 | H659: 7.73 | I659: 20 | J659: 114 | K659: 8.18 | L659: 4050000 | N659: 273481477
A660: =A659+1 -> 659 | B660: K1102995 | C660: Nguyễn Phước | D660: Tài | E660: 080193 | F660: KU11VLY | G660: 90.00 | H660: 7.93 | I660: 20 | J660: 107 | K660: 8.14 | L660: 4050000 | N660: 331669654
A661: =A660+1 -> 660 | B661: K1103488 | C661: Nguyễn Bé | D661: Thuần | E661: 050492 | F661: KU11VLY | G661: 90.00 | H661: 7.90 | I661: 20 | J661: 110 | K661: 8.12 | L661: 4050000 | N661: 385587981
A662: =A661+1 -> 661 | B662: K1201632 | C662: Nguyễn Duy | D662: Khánh | E662: 230194 | F662: KU12VLY | G662: 98.00 | H662: 8.47 | I662: 17 | J662: 74 | K662: 8.74 | L662: 4050000 | N662: 312192781
A663: =A662+1 -> 662 | B663: K1200343 | C663: Hứa Mộc | D663: Chiêu | E663: 050694 | F663: KU12CKT | G663: 100.00 | H663: 8.06 | I663: 17 | J663: 77 | K663: 8.45 | L663: 4050000 | N663: 385648004
A664: =A663+1 -> 663 | B664: K1200935 | C664: Nguyễn Tấn | D664: Hào | E664: 261094 | F664: KU12VLY | G664: 90.00 | H664: 8.29 | I664: 17 | J664: 70 | K664: 8.43 | L664: 4050000 | N664: 352173772
A665: =A664+1 -> 664 | B665: K1202717 | C665: Lữ Thành | D665: Phong | E665: 020294 | F665: KU12CKT | G665: 95.00 | H665: 8.11 | I665: 19 | J665: 77 | K665: 8.39 | L665: 4050000 | N665: 212268201
A666: =A665+1 -> 665 | B666: K1202611 | C666: Lê Thị Hồng | D666: Nhung | E666: 070294 | F666: KU12CKT | G666: 100.00 | H666: 7.94 | I666: 17 | J666: 71 | K666: 8.35 | L666: 4050000 | N666: 273521210
A667: =A666+1 -> 666 | B667: K1203355 | C667: Hoàng Thi | D667: Thao | E667: 251287 | F667: KU12CKT | G667: 100.00 | H667: 7.94 | I667: 17 | J667: 77 | K667: 8.35 | L667: 4050000 | N667: 371102659
A668: =A667+1 -> 667 | B668: K1201172 | C668: Lê Thị ái | D668: Hoa | E668: 050994 | F668: KU12CKT | G668: 100.00 | H668: 7.89 | I668: 19 | J668: 83 | K668: 8.31 | L668: 4050000 | N668: 025091693
A669: =A668+1 -> 668 | B669: K1204105 | C669: Trần Ngọc | D669: Trọng | E669: 100694 | F669: KU12CKT | G669: 100.00 | H669: 7.68 | I669: 20 | J669: 80 | K669: 8.14 | L669: 4050000 | N669: 301494011
A670: =A669+1 -> 669 | B670: K1301685 | C670: Phạm Xuân | D670: Hương | E670: 241095 | F670: KU1303 | G670: 95.00 | H670: 8.17 | I670: 18 | J670: 37 | K670: 8.44 | L670: 4050000 | N670: 312266124
A671: =A670+1 -> 670 | B671: K1302586 | C671: Nguyễn Thị Yến | D671: Ngọc | E671: 260695 | F671: KU1302 | G671: 100.00 | H671: 8.00 | I671: 18 | J671: 35 | K671: 8.40 | L671: 4050000 | N671: 321517032
A672: =A671+1 -> 671 | B672: K1303300 | C672: Nguyễn Phú | D672: Quý | E672: 150795 | F672: KU1301 | G672: 95.00 | H672: 8.06 | I672: 18 | J672: 39 | K672: 8.35 | L672: 4050000 | N672: 341849790
A673: =A672+1 -> 672 | B673: K1304942 | C673: Dương Ngọc Khánh | D673: Vy | E673: 271195 | F673: KU1301 | G673: 100.00 | H673: 7.94 | I673: 18 | J673: 39 | K673: 8.35 | L673: 4050000 | N673: 312254951
A674: =A673+1 -> 673 | B674: K1300956 | C674: Lê Thị Thanh | D674: Giang | E674: 180595 | F674: KU1303 | G674: 100.00 | H674: 7.83 | I674: 18 | J674: 37 | K674: 8.26 | L674: 4050000 | N674: 273620864
A675: =A674+1 -> 674 | B675: K1300151 | C675: Trần Vân | D675: Anh | E675: 160394 | F675: KU1303 | G675: 95.00 | H675: 7.78 | I675: 18 | J675: 34 | K675: 8.12 | L675: 4050000 | N675: 273541173
A676: =A675+1 -> 675 | B676: K1300508 | C676: Nguyễn Trí | D676: Dân | E676: 231195 | F676: KU1301 | G676: 100.00 | H676: 7.61 | I676: 18 | J676: 39 | K676: 8.09 | L676: 4050000 | N676: 025691900
A677: =A676+1 -> 676 | B677: K1303314 | C677: Nguyễn Ngọc | D677: Quỳnh | E677: 220295 | F677: KU1304 | G677: 95.00 | H677: 7.72 | I677: 18 | J677: 35 | K677: 8.08 | L677: 4050000 | N677: 321508202
A678: =A677+1 -> 677 | B678: V1001073 | C678: Lại Đình | D678: Hoài | E678: 250292 | F678: VL10KL | G678: 95.00 | H678: 9.13 | I678: 16 | J678: 140 | K678: 9.20 | L678: 4860000 | N678: 024928684
A679: =A678+1 -> 678 | B679: V1000791 | C679: Nguyễn Lê Bích | D679: Giao | E679: 010192 | F679: VL10SI | G679: 90.00 | H679: 9.20 | I679: 15 | J679: 140 | K679: 9.16 | L679: 4860000 | N679: 264412173
A680: =A679+1 -> 679 | B680: V1000457 | C680: Lê Thái Minh | D680: Duy | E680: 061092 | F680: VL10PO | G680: 100.00 | H680: 8.85 | I680: 20 | J680: 140 | K680: 9.08 | L680: 4860000 | N680: 024692054
A681: =A680+1 -> 680 | B681: V1003490 | C681: Bùi Thị Phương | D681: Trang | E681: 071192 | F681: VL10SI | G681: 95.00 | H681: 8.87 | I681: 15 | J681: 138 | K681: 9.00 | L681: 4860000 | N681: 025252302
A682: =A681+1 -> 681 | B682: V1002070 | C682: Huỳnh Thị | D682: Nga | E682: 020292 | F682: VL10SI | G682: 90.00 | H682: 8.93 | I682: 15 | J682: 140 | K682: 8.94 | L682: 4050000 | N682: 205534630
A683: =A682+1 -> 682 | B683: V1001440 | C683: Châu Minh | D683: Khang | E683: 91 | F683: VL10KL | G683: 95.00 | H683: 8.78 | I683: 16 | J683: 140 | K683: 8.92 | L683: 4050000 | N683: 321451704
A684: =A683+1 -> 683 | B684: V1003425 | C684: Trần Trung | D684: Tín | E684: 010492 | F684: VL10SI | G684: 95.00 | H684: 8.71 | I684: 17 | J684: 142 | K684: 8.87 | L684: 4050000 | N684: 024508741
A685: =A684+1 -> 684 | B685: V1000565 | C685: Nguyễn Sỹ | D685: Dương | E685: 201092 | F685: VL10PO | G685: 100.00 | H685: 8.50 | I685: 20 | J685: 140 | K685: 8.80 | L685: 4050000 | N685: 187040411
A686: =A685+1 -> 685 | B686: V1001702 | C686: Cao Hoàng | D686: Linh | E686: 240692 | F686: VL10SI | G686: 100.00 | H686: 8.50 | I686: 17 | J686: 142 | K686: 8.80 | L686: 4050000 | N686: 205558124
A687: =A686+1 -> 686 | B687: V1003328 | C687: Phan Thị Anh | D687: Thư | E687: 200192 | F687: VL10PO | G687: 100.00 | H687: 8.50 | I687: 16 | J687: 140 | K687: 8.80 | L687: 4050000 | N687: 331626034
A688: =A687+1 -> 687 | B688: V1103333 | C688: Lê Anh | D688: Thi | E688: 170393 | F688: VL11SI | G688: 100.00 | H688: 8.18 | I688: 17 | J688: 109 | K688: 8.54 | L688: 4050000 | N688: 312145219
A689: =A688+1 -> 688 | B689: V1101169 | C689: Trương Văn | D689: Hiển | E689: 130293 | F689: VL11SI | G689: 90.00 | H689: 8.38 | I689: 17 | J689: 114 | K689: 8.50 | L689: 4050000 | N689: 215285972
A690: =A689+1 -> 689 | B690: V1101055 | C690: Hồ Văn | D690: Hậu | E690: 160393 | F690: VL11PO | G690: 90.00 | H690: 8.06 | I690: 17 | J690: 110 | K690: 8.25 | L690: 4050000 | N690: 212365606
A691: =A690+1 -> 690 | B691: V1102650 | C691: Huỳnh Ngọc Diễm | D691: Phương | E691: 270793 | F691: VL11PO | G691: 90.00 | H691: 7.97 | I691: 15 | J691: 107 | K691: 8.18 | L691: 4050000 | N691: 024960732
A692: =A691+1 -> 691 | B692: V1101220 | C692: Hồ Trần | D692: Hoàng | E692: 201093 | F692: VL11PO | G692: 99.00 | H692: 7.59 | I692: 17 | J692: 114 | K692: 8.05 | L692: 4050000 | N692: 024963401
A693: =A692+1 -> 692 | B693: V1103072 | C693: Ngô Đình Duy | D693: Tân | E693: 180393 | F693: VL11PO | G693: 100.00 | H693: 7.50 | I693: 15 | J693: 112 | K693: 8.00 | L693: 4050000 | N693: 272210481
A694: =A693+1 -> 693 | B694: V1102725 | C694: Nguyễn Thanh | D694: Quang | E694: 140893 | F694: VL11KL | G694: 94.00 | H694: 7.63 | I694: 19 | J694: 113 | K694: 7.98 | L694: 3240000 | N694: 341631611
A695: =A694+1 -> 694 | B695: V1102263 | C695: Nguyễn Huỳnh Minh | D695: Ngọc | E695: 241193 | F695: VL11SI | G695: 87.00 | H695: 7.79 | I695: 17 | J695: 106 | K695: 7.97 | L695: 3240000 | N695: 291110836
A696: =A695+1 -> 695 | B696: V1103039 | C696: Nguyễn Minh | D696: Tâm | E696: 160793 | F696: VL11KL | G696: 90.00 | H696: 7.69 | I696: 16 | J696: 111 | K696: 7.95 | L696: 3240000 | N696: 312151048
A697: =A696+1 -> 696 | B697: V1103158 | C697: Trần Văn | D697: Thanh | E697: 150693 | F697: VL11SI | G697: 100.00 | H697: 7.43 | I697: 20 | J697: 114 | K697: 7.94 | L697: 3240000 | N697: 025101551
A698: =A697+1 -> 697 | B698: V1100891 | C698: Vũ Minh | D698: Đức | E698: 261293 | F698: VL11SI | G698: 90.00 | H698: 7.58 | I698: 13 | J698: 112 | K698: 7.86 | L698: 3240000 | N698: 272323606
A699: =A698+1 -> 698 | B699: V1103740 | C699: Trần Thị Thu | D699: Trang | E699: 200293 | F699: VL11SI | G699: 90.00 | H699: 7.56 | I699: 17 | J699: 114 | K699: 7.85 | L699: 3240000 | N699: 352086026
A700: =A699+1 -> 699 | B700: V1203771 | C700: Nguyễn Thanh | D700: Thương | E700: 171094 | F700: VL1202 | G700: 90.00 | H700: 8.86 | I700: 21 | J700: 78 | K700: 8.89 | L700: 4050000 | N700: 273529191
A701: =A700+1 -> 700 | B701: V1204035 | C701: Hồ Thanh | D701: Trí | E701: 221194 | F701: VL1205 | G701: 95.00 | H701: 8.71 | I701: 21 | J701: 76 | K701: 8.87 | L701: 4050000 | N701: 312203853
A702: =A701+1 -> 701 | B702: V1201273 | C702: Trịnh Đức | D702: Hòa | E702: 050194 | F702: VL1201 | G702: 100.00 | H702: 8.14 | I702: 18 | J702: 78 | K702: 8.51 | L702: 4050000 | N702: 272480337
A703: =A702+1 -> 702 | B703: V1203027 | C703: Nguyễn Thị Anh | D703: Quyên | E703: 270594 | F703: VL1204 | G703: 95.00 | H703: 8.26 | I703: 21 | J703: 74 | K703: 8.51 | L703: 4050000 | N703: 272279000
A704: =A703+1 -> 703 | B704: V1203662 | C704: Nguyễn Đức | D704: Thông | E704: 190294 | F704: VL1202 | G704: 90.00 | H704: 8.39 | I704: 19 | J704: 78 | K704: 8.51 | L704: 4050000 | N704: 025091648
A705: =A704+1 -> 704 | B705: V1203447 | C705: Lương Thị Ngọc | D705: Thảo | E705: 110994 | F705: VL1204 | G705: 100.00 | H705: 8.00 | I705: 19 | J705: 72 | K705: 8.40 | L705: 4050000 | N705: 321503494
A706: =A705+1 -> 705 | B706: V1200692 | C706: Đặng Quốc | D706: Đạt | E706: 271194 | F706: VL1202 | G706: 90.00 | H706: 8.17 | I706: 21 | J706: 70 | K706: 8.34 | L706: 4050000 | N706: 273490741
A707: =A706+1 -> 706 | B707: V1203030 | C707: Trần Tịnh | D707: Quyên | E707: 071294 | F707: VL1204 | G707: 100.00 | H707: 7.93 | I707: 21 | J707: 76 | K707: 8.34 | L707: 4050000 | N707: 312229499
A708: =A707+1 -> 707 | B708: V1204212 | C708: Nguyễn Hữu | D708: Trường | E708: 020294 | F708: VL1205 | G708: 100.00 | H708: 7.83 | I708: 18 | J708: 78 | K708: 8.26 | L708: 4050000 | N708: 215279949
A709: =A708+1 -> 708 | B709: V1200293 | C709: Phạm Minh | D709: Cảnh | E709: 010694 | F709: VL1202 | G709: 95.00 | H709: 7.88 | I709: 16 | J709: 76 | K709: 8.20 | L709: 4050000 | N709: 212267526
A710: =A709+1 -> 709 | B710: V1201232 | C710: Nguyễn Vũ | D710: Hoàng | E710: 190394 | F710: VL1201 | G710: 75.00 | H710: 8.38 | I710: 12 | J710: 76 | K710: 8.20 | L710: 4050000 | N710: 024938792
A711: =A710+1 -> 710 | B711: V1300066 | C711: Lâm Quế | D711: Anh | E711: 250595 | F711: VL1302 | G711: 91.00 | H711: 8.18 | I711: 20 | J711: 41 | K711: 8.36 | L711: 4050000 | N711: 321536360
A712: =A711+1 -> 711 | B712: V1302243 | C712: Huỳnh Vũ | D712: Luân | E712: 160395 | F712: VL1304 | G712: 95.00 | H712: 7.90 | I712: 20 | J712: 37 | K712: 8.22 | L712: 4050000 | N712: 352269899
A713: =A712+1 -> 712 | B713: V1302270 | C713: Huỳnh Du | D713: Lượng | E713: 130795 | F713: VL1301 | G713: 95.00 | H713: 7.88 | I713: 20 | J713: 39 | K713: 8.20 | L713: 4050000 | N713: 025462443
A714: =A713+1 -> 713 | B714: V1301709 | C714: Đỗ Việt | D714: Kha | E714: 180995 | F714: VL1302 | G714: 88.00 | H714: 7.83 | I714: 20 | J714: 41 | K714: 8.02 | L714: 4050000 | N714: 321550096
A715: =A714+1 -> 714 | B715: V1303365 | C715: Trương Đặng Linh | D715: Sang | E715: 181095 | F715: VL1303 | G715: 92.00 | H715: 7.60 | I715: 20 | J715: 39 | K715: 7.92 | L715: 3240000 | N715: 250943072
A716: =A715+1 -> 715 | B716: V1304305 | C716: Lương Nguyễn Đại | D716: Triết | E716: 010195 | F716: VL1302 | G716: 80.00 | H716: 7.90 | I716: 20 | J716: 41 | K716: 7.92 | L716: 3240000 | N716: 212475971
A717: =A716+1 -> 716 | B717: V1305072 | C717: Hứa Thị Thanh | D717: Hằng | E717: 130195 | F717: VL1305 | G717: 90.00 | H717: 7.55 | I717: 20 | J717: 37 | K717: 7.84 | L717: 3240000 | N717: 272322592
A718: =A717+1 -> 717 | B718: V1302505 | C718: Vũ Hoàng Tuyết | D718: Ngân | E718: 230695 | F718: VL1301 | G718: 100.00 | H718: 7.30 | I718: 20 | J718: 39 | K718: 7.84 | L718: 3240000 | N718: 273630868
A719: =A718+1 -> 718 | B719: V1304620 | C719: Lê Nguyễn Mộng | D719: Tuyền | E719: 290195 | F719: VL1302 | G719: 89.00 | H719: 7.55 | I719: 20 | J719: 41 | K719: 7.82 | L719: 3240000 | N719: 025669697
A720: =A719+1 -> 719 | B720: V1302598 | C720: Trương Thiên | D720: Ngọc | E720: 300695 | F720: VL1304 | G720: 90.00 | H720: 7.45 | I720: 20 | J720: 37 | K720: 7.76 | L720: 3240000 | N720: 331795702
A721: =A720+1 -> 720 | B721: V1302669 | C721: Võ Thị ánh | D721: Nguyệt | E721: 021095 | F721: VL1304 | G721: 90.00 | H721: 7.30 | I721: 20 | J721: 36 | K721: 7.64 | L721: 3240000 | N721: 272490902
A722: =A721+1 -> 721 | B722: 50901152 | C722: Võ Anh | D722: Kha | E722: 240691 | F722: VP09VT | G722: 90.00 | H722: 9.63 | I722: 10 | J722: 277 | K722: 9.50 | L722: 4860000 | N722: 024468004
A723: =A722+1 -> 722 | B723: 40902947 | C723: Lê Thúc | D723: Trình | E723: 060591 | F723: VP09VT | G723: 90.00 | H723: 9.50 | I723: 10 | J723: 277 | K723: 9.40 | L723: 4860000 | N723: 191784862
A724: =A723+1 -> 723 | B724: V0901952 | C724: Nguyễn Trần | D724: Phong | E724: 071191 | F724: VP09VL | G724: 96.00 | H724: 9.30 | I724: 10 | J724: 271 | K724: 9.36 | L724: 4860000 | N724: 280976927
A725: =A724+1 -> 724 | B725: 60901225 | C725: Hoàng Vũ Xuân | D725: Khoa | E725: 191091 | F725: VP09VT | G725: 100.00 | H725: 9.19 | I725: 10 | J725: 277 | K725: 9.35 | L725: 4860000 | N725: 024459757
A726: =A725+1 -> 725 | B726: 40902371 | C726: Lưu Hoàng | D726: Tân | E726: 290891 | F726: VP09VT | G726: 100.00 | H726: 9.19 | I726: 10 | J726: 277 | K726: 9.35 | L726: 4860000 | N726: 291011183
A727: =A726+1 -> 726 | B727: 40903113 | C727: Nguyễn Oanh | D727: Tuấn | E727: 020191 | F727: VP09VT | G727: 90.00 | H727: 9.40 | I727: 10 | J727: 267 | K727: 9.32 | L727: 4860000 | N727: 024430368
A728: =A727+1 -> 727 | B728: 20902516 | C728: Lưu Cẩn | D728: Thạch | E728: 121191 | F728: VP09HK | G728: 100.00 | H728: 9.14 | I728: 10 | J728: 274 | K728: 9.31 | L728: 4860000 | N728: 272156500
A729: =A728+1 -> 728 | B729: 40901817 | C729: Nguyễn Văn | D729: Nhân | E729: 201291 | F729: VP09VT | G729: 100.00 | H729: 9.06 | I729: 10 | J729: 277 | K729: 9.25 | L729: 4860000 | N729: 285385858
A730: =A729+1 -> 729 | B730: 40901570 | C730: Nguyễn Quang | D730: Minh | E730: 111291 | F730: VP09CDT | G730: 100.00 | H730: 8.93 | I730: 10 | J730: 268 | K730: 9.14 | L730: 4860000 | N730: 025554034
A731: =A730+1 -> 730 | B731: 40903123 | C731: Phạm Hoàng | D731: Tuấn | E731: 011091 | F731: VP09VT | G731: 90.00 | H731: 9.13 | I731: 10 | J731: 277 | K731: 9.10 | L731: 4860000 | N731: 205520193
A732: =A731+1 -> 731 | B732: 40901485 | C732: Nguyễn Thành | D732: Luân | E732: 151291 | F732: VP09NL | G732: 100.00 | H732: 8.79 | I732: 10 | J732: 276 | K732: 9.03 | L732: 4860000 | N732: 132150160
A733: =A732+1 -> 732 | B733: 40901561 | C733: Nguyễn Duy | D733: Minh | E733: 010491 | F733: VP09NL | G733: 100.00 | H733: 8.79 | I733: 10 | J733: 275 | K733: 9.03 | L733: 4860000 | N733: 024394039
A734: =A733+1 -> 733 | B734: K0902138 | C734: Nguyễn Minh | D734: Quân | E734: 201091 | F734: VP09VL | G734: 91.00 | H734: 9.00 | I734: 10 | J734: 271 | K734: 9.02 | L734: 4860000 | N734: 024511233
A735: =A734+1 -> 734 | B735: 40901556 | C735: Ngô Hoàng Nhật | D735: Minh | E735: 140291 | F735: VP09VT | G735: 90.00 | H735: 9.00 | I735: 10 | J735: 278 | K735: 9.00 | L735: 4860000 | N735: 024984598
A736: =A735+1 -> 735 | B736: 40902364 | C736: Đoàn Nhựt | D736: Tân | E736: 230491 | F736: VP09VT | G736: 90.00 | H736: 9.00 | I736: 10 | J736: 277 | K736: 9.00 | L736: 4860000 | N736: 321447420
A737: =A736+1 -> 736 | B737: V0902056 | C737: Thái | D737: Phương | E737: 260391 | F737: VP09VL | G737: 98.00 | H737: 8.70 | I737: 10 | J737: 271 | K737: 8.92 | L737: 4050000 | N737: 221303249
A738: =A737+1 -> 737 | B738: 40902764 | C738: Trần Văn | D738: Tiến | E738: 110691 | F738: VP09VL | G738: 90.00 | H738: 8.90 | I738: 10 | J738: 269 | K738: 8.92 | L738: 4050000 | N738: 280979852
A739: =A738+1 -> 738 | B739: 20901599 | C739: Lê Duy | D739: Mỹ | E739: 040891 | F739: VP09NL | G739: 100.00 | H739: 8.50 | I739: 10 | J739: 275 | K739: 8.80 | L739: 4050000 | N739: 271972017
A740: =A739+1 -> 739 | B740: 40902244 | C740: Lê Ngọc | D740: Sáng | E740: 260191 | F740: VP09NL | G740: 100.00 | H740: 8.50 | I740: 10 | J740: 275 | K740: 8.80 | L740: 4050000 | N740: 285282382
A741: =A740+1 -> 740 | B741: 40903148 | C741: Hoàng Anh | D741: Tuyến | E741: 070991 | F741: VP09HK | G741: 100.00 | H741: 8.36 | I741: 10 | J741: 274 | K741: 8.69 | L741: 4050000 | N741: 285197994
A742: =A741+1 -> 741 | B742: 40902355 | C742: Phạm Văn | D742: Tâm | E742: 180791 | F742: VP09NL | G742: 100.00 | H742: 8.31 | I742: 12 | J742: 275 | K742: 8.65 | L742: 4050000 | N742: 285270435
A743: =A742+1 -> 742 | B743: 40902662 | C743: Đinh Xuân | D743: Thu | E743: 230991 | F743: VP09NL | G743: 100.00 | H743: 8.20 | I743: 12 | J743: 275 | K743: 8.56 | L743: 4050000 | N743: 272056826
A744: =A743+1 -> 743 | B744: 50900889 | C744: Nguyễn Vũ | D744: Hoài | E744: 020991 | F744: VP09NL | G744: 100.00 | H744: 8.18 | I744: 11 | J744: 275 | K744: 8.54 | L744: 4050000 | N744: 212695525
A745: =A744+1 -> 744 | B745: 60901250 | C745: Phan Nguyễn Đăng | D745: Khoa | E745: 110591 | F745: VP09NL | G745: 100.00 | H745: 8.14 | I745: 10 | J745: 273 | K745: 8.51 | L745: 4050000 | N745: 024472301
A746: =A745+1 -> 745 | B746: 40901843 | C746: Phạm Minh | D746: Nhật | E746: 210891 | F746: VP09NL | G746: 100.00 | H746: 8.14 | I746: 10 | J746: 275 | K746: 8.51 | L746: 4050000 | N746: 212702226
A747: =A746+1 -> 746 | B747: 50902130 | C747: Lê Minh | D747: Quân | E747: 170691 | F747: VP09HK | G747: 100.00 | H747: 8.14 | I747: 10 | J747: 274 | K747: 8.51 | L747: 4050000 | N747: 291033426
A748: =A747+1 -> 747 | B748: 50901136 | C748: Phan Thanh | D748: Hưởng | E748: 120591 | F748: VP09VT | G748: 90.00 | H748: 8.38 | I748: 10 | J748: 277 | K748: 8.50 | L748: 4050000 | N748: 205697681
A749: =A748+1 -> 748 | B749: 20902419 | C749: Ung Nhật | D749: Thanh | E749: 150691 | F749: VP09CDT | G749: 90.00 | H749: 8.36 | I749: 10 | J749: 268 | K749: 8.49 | L749: 4050000 | N749: 201622061
A750: =A749+1 -> 749 | B750: K0900499 | C750: Tạ Lê Anh | D750: Đào | E750: 131291 | F750: VP09NL | G750: 100.00 | H750: 8.09 | I750: 14 | J750: 276 | K750: 8.47 | L750: 4050000 | N750: 272047284
A751: =A750+1 -> 750 | B751: 20902139 | C751: Nguyễn Nam | D751: Quân | E751: 170291 | F751: VP09HK | G751: 100.00 | H751: 8.04 | I751: 10 | J751: 274 | K751: 8.43 | L751: 4050000 | N751: 291008458
A752: =A751+1 -> 751 | B752: 20902276 | C752: Nguyễn Minh | D752: Sơn | E752: 130991 | F752: VP09CDT | G752: 90.00 | H752: 8.29 | I752: 10 | J752: 268 | K752: 8.43 | L752: 4050000 | N752: 024461604
A753: =A752+1 -> 752 | B753: 20903066 | C753: Cao Đỗ Nam | D753: Tuấn | E753: 240291 | F753: VP09CDT | G753: 95.00 | H753: 8.10 | I753: 10 | J753: 268 | K753: 8.38 | L753: 4050000 | N753: 290969680
A754: =A753+1 -> 753 | B754: 60900290 | C754: Dương Phú | D754: Cường | E754: 081191 | F754: VP09NL | G754: 100.00 | H754: 7.86 | I754: 10 | J754: 276 | K754: 8.29 | L754: 4050000 | N754: 212565263
A755: =A754+1 -> 754 | B755: 80902940 | C755: Trương Hoàng | D755: Trí | E755: 101191 | F755: VP09VT | G755: 90.00 | H755: 8.08 | I755: 13 | J755: 277 | K755: 8.26 | L755: 4050000 | N755: 024598590
A756: =A755+1 -> 755 | B756: P0910003 | C756: Vũ Đình | D756: Hùng | E756: 091091 | F756: VP09CDT | G756: 100.00 | H756: 7.79 | I756: 14 | J756: 154 | K756: 8.23 | L756: 4050000 | N756: 201635757
A757: =A756+1 -> 756 | B757: 40902635 | C757: Phạm Ngọc | D757: Thoan | E757: 210791 | F757: VP09VT | G757: 100.00 | H757: 7.69 | I757: 10 | J757: 274 | K757: 8.15 | L757: 4050000 | N757: 285220448
A758: =A757+1 -> 757 | B758: P0910001 | C758: Trần Đình | D758: Dũng | E758: 160590 | F758: VP09HK | G758: 100.00 | H758: 7.68 | I758: 10 | J758: 160 | K758: 8.14 | L758: 4050000 | N758: 197235616
A759: =A758+1 -> 758 | B759: 20901458 | C759: Nguyễn Tấn | D759: Lộc | E759: 270991 | F759: VP09CDT | G759: 100.00 | H759: 7.57 | I759: 10 | J759: 268 | K759: 8.06 | L759: 4050000 | N759: 024692532
A760: =A759+1 -> 759 | B760: 20900132 | C760: Đỗ Huỳnh | D760: Bảo | E760: 280491 | F760: VP09CDT | G760: 95.00 | H760: 7.29 | I760: 10 | J760: 268 | K760: 7.73 | L760: 3240000 | N760: 321385342
A761: =A760+1 -> 760 | B761: 20901873 | C761: Lưu Minh | D761: Nhựt | E761: 120391 | F761: VP09HK | G761: 100.00 | H761: 7.07 | I761: 10 | J761: 274 | K761: 7.66 | L761: 3240000 | N761: 272075873
A762: =A761+1 -> 761 | B762: 20901078 | C762: Phạm Công | D762: Hùng | E762: 140191 | F762: VP09CDT | G762: 95.00 | H762: 7.14 | I762: 10 | J762: 268 | K762: 7.61 | L762: 3240000 | N762: 301366040
A763: =A762+1 -> 762 | B763: 80902189 | C763: Nguyễn Văn | D763: Quyền | E763: 220891 | F763: VP09HK | G763: 100.00 | H763: 7.00 | I763: 10 | J763: 274 | K763: 7.60 | L763: 3240000 | N763: 212657116
A764: =A763+1 -> 763 | B764: 20902006 | C764: Mai Thái Thiên | D764: Phúc | E764: 310891 | F764: VP09CDT | G764: 95.00 | H764: 7.00 | I764: 10 | J764: 268 | K764: 7.50 | L764: 3240000 | N764: 024550354
A765: =A764+1 -> 764 | B765: 40901268 | C765: Vũ Nguyễn Đăng | D765: Khoa | E765: 300891 | F765: VP09CDT | G765: 90.00 | H765: 6.64 | I765: 10 | J765: 268 | K765: 7.11 | L765: 3240000 | N765: 250790635
A766: =A765+1 -> 765 | B766: V1002583 | C766: Nguyễn Anh | D766: Quang | E766: 110192 | F766: VP10HK | G766: 100.00 | H766: 8.64 | I766: 28 | J766: 232 | K766: 8.91 | L766: 4050000 | N766: 024655446
A767: =A766+1 -> 766 | B767: 41002368 | C767: Huỳnh Viết | D767: Phi | E767: 030892 | F767: VP10VT | G767: 100.00 | H767: 8.22 | I767: 32 | J767: 234 | K767: 8.58 | L767: 4050000 | N767: 205672881
A768: =A767+1 -> 767 | B768: 41003086 | C768: Nguyễn Lê Việt | D768: Thắng | E768: 180292 | F768: VP10HK | G768: 95.00 | H768: 8.30 | I768: 28 | J768: 232 | K768: 8.54 | L768: 4050000 | N768: 285276852
A769: =A768+1 -> 768 | B769: 81003471 | C769: Võ Minh | D769: Toàn | E769: 101092 | F769: VP10XDC | G769: 100.00 | H769: 8.15 | I769: 26 | J769: 228 | K769: 8.52 | L769: 4050000 | N769: 225441879
A770: =A769+1 -> 769 | B770: 41001968 | C770: Ôn Vũ Ngọc | D770: Minh | E770: 250592 | F770: VP10VT | G770: 100.00 | H770: 8.14 | I770: 32 | J770: 232 | K770: 8.51 | L770: 4050000 | N770: 205582456
A771: =A770+1 -> 770 | B771: 41003094 | C771: Phạm Ngọc | D771: Thắng | E771: 270992 | F771: VP10NL | G771: 100.00 | H771: 8.03 | I771: 32 | J771: 236 | K771: 8.42 | L771: 4050000 | N771: 197293374
A772: =A771+1 -> 771 | B772: 41003772 | C772: Nguyễn Hoàng | D772: Tuấn | E772: 270792 | F772: VP10VT | G772: 100.00 | H772: 7.95 | I772: 32 | J772: 234 | K772: 8.36 | L772: 4050000 | N772: 205711107
A773: =A772+1 -> 772 | B773: 41000462 | C773: Nguyễn Bảo | D773: Duy | E773: 251192 | F773: VP10VT | G773: 100.00 | H773: 7.84 | I773: 34 | J773: 234 | K773: 8.27 | L773: 4050000 | N773: 321495074
A774: =A773+1 -> 773 | B774: 41001269 | C774: Phùng Thanh | D774: Huy | E774: 071292 | F774: VP10CDT | G774: 100.00 | H774: 7.82 | I774: 28 | J774: 232 | K774: 8.26 | L774: 4050000 | N774: 273415578
A775: =A774+1 -> 774 | B775: 21000540 | C775: Nguyễn Trí | D775: Dũng | E775: 100992 | F775: VP10CDT | G775: 95.00 | H775: 7.93 | I775: 28 | J775: 232 | K775: 8.24 | L775: 4050000 | N775: 321466129
A776: =A775+1 -> 775 | B776: 41000793 | C776: Lương Quang | D776: Giáp | E776: 051092 | F776: VP10VT | G776: 100.00 | H776: 7.80 | I776: 32 | J776: 234 | K776: 8.24 | L776: 4050000 | N776: 191725713
A777: =A776+1 -> 776 | B777: 21001750 | C777: Đàm Thành | D777: Long | E777: 110392 | F777: VP10CDT | G777: 95.00 | H777: 7.84 | I777: 28 | J777: 232 | K777: 8.17 | L777: 4050000 | N777: 212785226
A778: =A777+1 -> 777 | B778: 41003220 | C778: Phan Hồng | D778: Thịnh | E778: 011192 | F778: VP10CDT | G778: 95.00 | H778: 7.81 | I778: 31 | J778: 232 | K778: 8.15 | L778: 4050000 | N778: 285368413
A779: =A778+1 -> 778 | B779: 21001604 | C779: Nguyễn Lê Duy | D779: Khương | E779: 080492 | F779: VP10CDT | G779: 95.00 | H779: 7.80 | I779: 28 | J779: 232 | K779: 8.14 | L779: 4050000 | N779: 272144921
A780: =A779+1 -> 779 | B780: 41000134 | C780: Dương Hoài | D780: Ân | E780: 041192 | F780: VP10CDT | G780: 95.00 | H780: 7.64 | I780: 28 | J780: 232 | K780: 8.01 | L780: 4050000 | N780: 024663928
A781: =A780+1 -> 780 | B781: 51001377 | C781: Lê Khánh | D781: Hưng | E781: 010192 | F781: VP10VT | G781: 100.00 | H781: 7.41 | I781: 32 | J781: 236 | K781: 7.93 | L781: 3240000 | N781: 290969215
A782: =A781+1 -> 781 | B782: 21003871 | C782: Huỳnh Nguyễn Minh | D782: Tùng | E782: 061192 | F782: VP10HK | G782: 100.00 | H782: 7.25 | I782: 28 | J782: 222 | K782: 7.80 | L782: 3240000 | N782: 280982873
A783: =A782+1 -> 782 | B783: 61000581 | C783: Tô Đình | D783: Dự | E783: 060892 | F783: VP10NL | G783: 90.00 | H783: 7.32 | I783: 34 | J783: 236 | K783: 7.66 | L783: 3240000 | N783: 205765024
A784: =A783+1 -> 783 | B784: G1002167 | C784: Nguyễn Khôi | D784: Nguyên | E784: 010192 | F784: VP10HK | G784: 100.00 | H784: 7.07 | I784: 28 | J784: 232 | K784: 7.66 | L784: 3240000 | N784: 025034243
A785: =A784+1 -> 784 | B785: 21000833 | C785: Hà Tiến | D785: Hải | E785: 060892 | F785: VP10CDT | G785: 80.00 | H785: 7.45 | I785: 28 | J785: 232 | K785: 7.56 | L785: 3240000 | N785: 024936924
A786: =A785+1 -> 785 | B786: 21003842 | C786: Nguyễn Cung | D786: Tú | E786: 151092 | F786: VP10XDC | G786: 90.00 | H786: 7.15 | I786: 30 | J786: 214 | K786: 7.52 | L786: 3240000 | N786: 024677615
A787: =A786+1 -> 786 | B787: 21101416 | C787: Đỗ Mạnh | D787: Hùng | E787: 080693 | F787: VP11CDT | G787: 95.00 | H787: 9.16 | I787: 22 | J787: 165 | K787: 9.23 | L787: 4860000 | N787: 024941386
A788: =A787+1 -> 787 | B788: 21103415 | C788: Nguyễn Ngọc | D788: Thịnh | E788: 160893 | F788: VP11CDT | G788: 95.00 | H788: 8.86 | I788: 22 | J788: 165 | K788: 8.99 | L788: 4050000 | N788: 024843769
A789: =A788+1 -> 788 | B789: 21103330 | C789: Trịnh Quốc | D789: Thế | E789: 020293 | F789: VP11CDT | G789: 80.00 | H789: 8.92 | I789: 24 | J789: 165 | K789: 8.74 | L789: 4050000 | N789: 312138660
A790: =A789+1 -> 789 | B790: 81102306 | C790: Nguyễn Trung | D790: Nguyên | E790: 270893 | F790: VP11XDC | G790: 95.00 | H790: 8.54 | I790: 27 | J790: 173 | K790: 8.73 | L790: 4050000 | N790: 272208453
A791: =A790+1 -> 790 | B791: 81101390 | C791: Trần Quang | D791: Huy | E791: 250493 | F791: VP11XDC | G791: 100.00 | H791: 8.34 | I791: 25 | J791: 173 | K791: 8.67 | L791: 4050000 | N791: 250861602
A792: =A791+1 -> 791 | B792: 41102905 | C792: Dương Nguyễn Hoàng | D792: Sơn | E792: 060593 | F792: VP11VT | G792: 100.00 | H792: 8.28 | I792: 27 | J792: 168 | K792: 8.62 | L792: 4050000 | N792: 312138692
A793: =A792+1 -> 792 | B793: 61104161 | C793: Trần Đỗ Phương | D793: Uyên | E793: 100393 | F793: VP11NL | G793: 95.00 | H793: 8.40 | I793: 25 | J793: 171 | K793: 8.62 | L793: 4050000 | N793: 025011897
A794: =A793+1 -> 793 | B794: 51100674 | C794: Nguyễn Văn | D794: Dương | E794: 120593 | F794: VP11VT | G794: 100.00 | H794: 8.24 | I794: 23 | J794: 168 | K794: 8.59 | L794: 4050000 | N794: 241245951
A795: =A794+1 -> 794 | B795: 41102648 | C795: Hồ Thanh | D795: Phương | E795: 100193 | F795: VP11CDT | G795: 85.00 | H795: 8.46 | I795: 24 | J795: 165 | K795: 8.47 | L795: 4050000 | N795: 197295334
A796: =A795+1 -> 795 | B796: 41104033 | C796: Võ Anh | D796: Tuấn | E796: 181093 | F796: VP11NL | G796: 90.00 | H796: 8.32 | I796: 25 | J796: 171 | K796: 8.46 | L796: 4050000 | N796: 272217757
A797: =A796+1 -> 796 | B797: 41101920 | C797: Phùng Nguyễn Hoàng | D797: Long | E797: 160693 | F797: VP11XDC | G797: 90.00 | H797: 8.30 | I797: 27 | J797: 173 | K797: 8.44 | L797: 4050000 | N797: 312165095
A798: =A797+1 -> 797 | B798: 81100744 | C798: Nguyễn Tiến | D798: Đạt | E798: 171093 | F798: VP11XDC | G798: 85.00 | H798: 8.41 | I798: 27 | J798: 173 | K798: 8.43 | L798: 4050000 | N798: 385576687
A799: =A798+1 -> 798 | B799: 41100184 | C799: Trần Bảo | D799: Ân | E799: 221093 | F799: VP11CDT | G799: 80.00 | H799: 8.42 | I799: 24 | J799: 165 | K799: 8.34 | L799: 4050000 | N799: 024805620
A800: =A799+1 -> 799 | B800: 31100370 | C800: Bùi Quang | D800: Chiêu | E800: 280893 | F800: VP11VL | G800: 95.00 | H800: 7.96 | I800: 26 | J800: 165 | K800: 8.27 | L800: 4050000 | N800: 025302278
A801: =A800+1 -> 800 | B801: 81101961 | C801: Trình Quang | D801: Lộc | E801: 051293 | F801: VP11XDC | G801: 85.00 | H801: 8.20 | I801: 25 | J801: 173 | K801: 8.26 | L801: 4050000 | N801: 261312003
A802: =A801+1 -> 801 | B802: 21101315 | C802: Phan Công | D802: Huân | E802: 240193 | F802: VP11HK | G802: 90.00 | H802: 7.94 | I802: 26 | J802: 167 | K802: 8.15 | L802: 4050000 | N802: 024885918
A803: =A802+1 -> 802 | B803: 51103837 | C803: Huỳnh Hữu | D803: Trọng | E803: 230993 | F803: VP11VT | G803: 85.00 | H803: 7.69 | I803: 27 | J803: 168 | K803: 7.85 | L803: 3240000 | N803: 301455946
A804: =A803+1 -> 803 | B804: 61103727 | C804: Ngô Thụy Đoan | D804: Trang | E804: 100293 | F804: VP11VL | G804: 95.00 | H804: 7.41 | I804: 22 | J804: 161 | K804: 7.83 | L804: 3240000 | N804: 025191375
A805: =A804+1 -> 804 | B805: 81104384 | C805: Phan Văn Hoàng | D805: Vỹ | E805: 220593 | F805: VP11NL | G805: 95.00 | H805: 7.41 | I805: 27 | J805: 171 | K805: 7.83 | L805: 3240000 | N805: 205677125
A806: =A805+1 -> 805 | B806: 41100385 | C806: Trần Thiện | D806: Chí | E806: 080393 | F806: VP11CDT | G806: 85.00 | H806: 7.64 | I806: 22 | J806: 165 | K806: 7.81 | L806: 3240000 | N806: 261339481
A807: =A806+1 -> 806 | B807: 41102145 | C807: Nguyễn Nhật | D807: Nam | E807: 260793 | F807: VP11NL | G807: 90.00 | H807: 7.46 | I807: 27 | J807: 171 | K807: 7.77 | L807: 3240000 | N807: 024832558
A808: =A807+1 -> 807 | B808: 41102766 | C808: Nguyễn Ngọc Hoàng | D808: Quân | E808: 100893 | F808: VP11HK | G808: 90.00 | H808: 7.38 | I808: 26 | J808: 167 | K808: 7.70 | L808: 3240000 | N808: 024894231
A809: =A808+1 -> 808 | B809: 21101370 | C809: Nguyễn Vũ Bảo | D809: Huy | E809: 241093 | F809: VP11NL | G809: 85.00 | H809: 7.41 | I809: 27 | J809: 168 | K809: 7.63 | L809: 3240000 | N809: 261320039
A810: =A809+1 -> 809 | B810: 41100764 | C810: Trần Tuấn | D810: Đạt | E810: 050393 | F810: VP11NL | G810: 90.00 | H810: 7.19 | I810: 27 | J810: 171 | K810: 7.55 | L810: 3240000 | N810: 352064356
A811: =A810+1 -> 810 | B811: 21102693 | C811: Nguyễn Hữu | D811: Phước | E811: 290793 | F811: VP11CDT | G811: 80.00 | H811: 7.44 | I811: 24 | J811: 165 | K811: 7.55 | L811: 3240000 | N811: 191806992
A812: =A811+1 -> 811 | B812: 81101014 | C812: Nguyễn Ngọc | D812: Hảo | E812: 030893 | F812: VP11XDC | G812: 85.00 | H812: 7.25 | I812: 28 | J812: 168 | K812: 7.50 | L812: 3240000 | N812: 285360927
A813: =A812+1 -> 812 | B813: 81103873 | C813: Nguyễn Hữu | D813: Trung | E813: 020193 | F813: VP11XDC | G813: 85.00 | H813: 7.04 | I813: 27 | J813: 170 | K813: 7.33 | L813: 3240000 | N813: 365936936
A814: =A813+1 -> 813 | B814: 41104135 | C814: Hoàng Mạnh | D814: Tường | E814: 040893 | F814: VP11CDT | G814: 85.00 | H814: 6.88 | I814: 24 | J814: 162 | K814: 7.20 | L814: 3240000 | N814: 205699365
A815: =A814+1 -> 814 | B815: G1204056 | C815: Nguyễn Hữu | D815: Trí | E815: 150194 | F815: VP2012/2 | G815: 100.00 | H815: 8.78 | I815: 29 | J815: 114 | K815: 9.02 | L815: 4860000 | N815: 024825978
A816: =A815+1 -> 815 | B816: 51200977 | C816: Trương Trần Phúc | D816: Hải | E816: 240894 | F816: VP2012/1 | G816: 100.00 | H816: 8.59 | I816: 29 | J816: 114 | K816: 8.87 | L816: 4050000 | N816: 221373521
A817: =A816+1 -> 816 | B817: 41201862 | C817: Hà Văn | D817: Lập | E817: 050694 | F817: VP2012/1 | G817: 100.00 | H817: 8.52 | I817: 31 | J817: 114 | K817: 8.82 | L817: 4050000 | N817: 215372847
A818: =A817+1 -> 817 | B818: 41201358 | C818: Nguyễn Đình | D818: Huy | E818: 120594 | F818: VP2012/2 | G818: 100.00 | H818: 8.10 | I818: 29 | J818: 114 | K818: 8.48 | L818: 4050000 | N818: 321509833
A819: =A818+1 -> 818 | B819: V1202239 | C819: Lê | D819: Nam | E819: 040590 | F819: VP2012/2 | G819: 90.00 | H819: 8.21 | I819: 29 | J819: 114 | K819: 8.37 | L819: 4050000 | N819: 024791456
A820: =A819+1 -> 819 | B820: 81203527 | C820: Vũ Trí | D820: Thắng | E820: 040594 | F820: VP2012/2 | G820: 95.00 | H820: 8.09 | I820: 29 | J820: 114 | K820: 8.37 | L820: 4050000 | N820: 025080048
A821: =A820+1 -> 820 | B821: 41200068 | C821: Nguyễn Đặng Việt | D821: Anh | E821: 100894 | F821: VP2012/1 | G821: 100.00 | H821: 7.95 | I821: 29 | J821: 114 | K821: 8.36 | L821: 4050000 | N821: 371523465
A822: =A821+1 -> 821 | B822: G1203430 | C822: Võ Ngọc | D822: Thành | E822: 061094 | F822: VP2012/2 | G822: 100.00 | H822: 7.93 | I822: 29 | J822: 114 | K822: 8.34 | L822: 4050000 | N822: 312258464
A823: =A822+1 -> 822 | B823: 41201663 | C823: Nguyễn Trần Quang | D823: Khải | E823: 040994 | F823: VP2012/1 | G823: 100.00 | H823: 7.52 | I823: 29 | J823: 114 | K823: 8.02 | L823: 4050000 | N823: 221374475
A824: =A823+1 -> 823 | B824: 81203564 | C824: Đỗ Xuân | D824: Thiện | E824: 240293 | F824: VP2012/2 | G824: 100.00 | H824: 7.47 | I824: 29 | J824: 114 | K824: 7.98 | L824: 3240000 | N824: 312161953
A825: =A824+1 -> 824 | B825: 41201413 | C825: Trương Quang | D825: Huy | E825: 130694 | F825: VP2012/2 | G825: 100.00 | H825: 7.45 | I825: 29 | J825: 114 | K825: 7.96 | L825: 3240000 | N825: 201693882
A826: =A825+1 -> 825 | B826: 41202020 | C826: Trương Quang | D826: Lộc | E826: 070294 | F826: VP2012/1 | G826: 90.00 | H826: 7.48 | I826: 31 | J826: 114 | K826: 7.78 | L826: 3240000 | N826: 321503165
A827: =A826+1 -> 826 | B827: 31203656 | C827: Lê Bá | D827: Thông | E827: 050894 | F827: VP2012/1 | G827: 100.00 | H827: 6.83 | I827: 29 | J827: 114 | K827: 7.46 | L827: 3240000 | N827: 273490061
A828: =A827+1 -> 827 | B828: 81201342 | C828: Hoàng Nhật | D828: Huy | E828: 070494 | F828: VP2012/1 | G828: 85.00 | H828: 6.76 | I828: 31 | J828: 114 | K828: 7.11 | L828: 3240000 | N828: 285501141
A829: =A828+1 -> 828 | B829: 81302445 | C829: Nguyễn Hoàng | D829: Nam | E829: 060195 | F829: VP2013/2 | G829: 100.00 | H829: 9.64 | I829: 28 | J829: 56 | K829: 9.71 | L829: 4860000 | N829: 025111680
A830: =A829+1 -> 829 | B830: 41301360 | C830: Trần Đình | D830: Hoàng | E830: 130395 | F830: VP2013/2 | G830: 95.00 | H830: 9.02 | I830: 28 | J830: 54 | K830: 9.12 | L830: 4860000 | N830: 272409927
A831: =A830+1 -> 830 | B831: 81301522 | C831: Phạm Xuân | D831: Huy | E831: 060695 | F831: VP2013/2 | G831: 95.00 | H831: 8.84 | I831: 28 | J831: 54 | K831: 8.97 | L831: 4050000 | N831: 025196803
A832: =A831+1 -> 831 | B832: 51301377 | C832: Bùi Minh | D832: Hòa | E832: 230195 | F832: VP2013/2 | G832: 92.00 | H832: 8.84 | I832: 28 | J832: 54 | K832: 8.91 | L832: 4050000 | N832: 366076448
A833: =A832+1 -> 832 | B833: G1300124 | C833: Nguyễn Tường | D833: Anh | E833: 010295 | F833: VP2013/2 | G833: 95.00 | H833: 8.64 | I833: 28 | J833: 56 | K833: 8.81 | L833: 4050000 | N833: 331759988
A834: =A833+1 -> 833 | B834: G1301415 | C834: Đinh Thị Bích | D834: Hợp | E834: 121195 | F834: VP2013/2 | G834: 97.00 | H834: 8.50 | I834: 28 | J834: 54 | K834: 8.74 | L834: 4050000 | N834: 221406091
A835: =A834+1 -> 834 | B835: 41300302 | C835: Lê Quang | D835: Bình | E835: 251095 | F835: VP2013/1 | G835: 90.00 | H835: 8.65 | I835: 26 | J835: 48 | K835: 8.72 | L835: 4050000 | N835: 285560258
A836: =A835+1 -> 835 | B836: 21300571 | C836: Lê Trần Gia | D836: Duy | E836: 110194 | F836: VP2013/2 | G836: 91.00 | H836: 8.54 | I836: 26 | J836: 56 | K836: 8.65 | L836: 4050000 | N836: 025316672
A837: =A836+1 -> 836 | B837: 41302841 | C837: Ngô Minh | D837: Nhựt | E837: 020995 | F837: VP2013/2 | G837: 90.00 | H837: 8.39 | I837: 28 | J837: 54 | K837: 8.51 | L837: 4050000 | N837: 025380148
A838: =A837+1 -> 837 | B838: 61301368 | C838: Triệu | D838: Hoàng | E838: 190394 | F838: VP2013/2 | G838: 95.00 | H838: 8.23 | I838: 28 | J838: 54 | K838: 8.48 | L838: 4050000 | N838: 366066215
A839: =A838+1 -> 838 | B839: 61304776 | C839: Nguyễn Thị Hải | D839: Vân | E839: 040895 | F839: VP2013/1 | G839: 95.00 | H839: 8.16 | I839: 28 | J839: 52 | K839: 8.43 | L839: 4050000 | N839: 201672332
A840: =A839+1 -> 839 | B840: 81301936 | C840: Nguyễn Trung | D840: Kiên | E840: 280995 | F840: VP2013/1 | G840: 95.00 | H840: 7.96 | I840: 26 | J840: 48 | K840: 8.27 | L840: 4050000 | N840: 281143634
A841: =A840+1 -> 840 | B841: 81304561 | C841: Nguyễn Mạnh | D841: Tuấn | E841: 190395 | F841: VP2013/2 | G841: 80.00 | H841: 8.34 | I841: 28 | J841: 54 | K841: 8.27 | L841: 4050000 | N841: 025514555
A842: =A841+1 -> 841 | B842: 21301593 | C842: Nguyễn Mạnh | D842: Hùng | E842: 090995 | F842: VP2013/1 | G842: 90.00 | H842: 8.04 | I842: 28 | J842: 52 | K842: 8.23 | L842: 4050000 | N842: 261346527
A843: =A842+1 -> 842 | B843: 41304711 | C843: Võ Thanh | D843: Tùng | E843: 010795 | F843: VP2013/1 | G843: 90.00 | H843: 7.80 | I843: 28 | J843: 52 | K843: 8.04 | L843: 4050000 | N843: 272365106
A844: =A843+1 -> 843 | B844: V1302986 | C844: Nguyễn Duy | D844: Phú | E844: 100595 | F844: VP2013/1 | G844: 90.00 | H844: 7.64 | I844: 28 | J844: 52 | K844: 7.91 | L844: 3240000 | N844: 250986097
A845: =A844+1 -> 844 | B845: 21302141 | C845: Nguyễn Công | D845: Long | E845: 051095 | F845: VP2013/2 | G845: 90.00 | H845: 7.34 | I845: 28 | J845: 54 | K845: 7.67 | L845: 3240000 | N845: 025331855
A846: =A845+1 -> 845 | B846: 41301348 | C846: Nguyễn Viết | D846: Hoàng | E846: 200295 | F846: VP2013/1 | G846: 95.00 | H846: 7.11 | I846: 28 | J846: 52 | K846: 7.59 | L846: 3240000 | N846: 225568157
A847: =A846+1 -> 846 | B847: 21301824 | C847: Nguyễn Tấn | D847: Khiêm | E847: 290695 | F847: VP2013/1 | G847: 90.00 | H847: 7.13 | I847: 28 | J847: 52 | K847: 7.50 | L847: 3240000 | N847: 215361750
A848: =A847+1 -> 847 | B848: 21300533 | C848: Võ Đình | D848: Duệ | E848: 100895 | F848: VP2013/1 | G848: 85.00 | H848: 7.17 | I848: 26 | J848: 48 | K848: 7.44 | L848: 3240000 | N848: 212668928
A849: =A848+1 -> 848 | B849: K1302449 | C849: Nguyễn Lĩnh | D849: Nam | E849: 040395 | F849: VP2013/1 | G849: 95.00 | H849: 6.75 | I849: 26 | J849: 48 | K849: 7.30 | L849: 3240000 | N849: 273586811
A850: =A849+1 -> 849 | B850: 41301643 | C850: Nguyễn Lê | D850: Hưng | E850: 191195 | F850: VP2013/2 | G850: 86.00 | H850: 6.80 | I850: 28 | J850: 54 | K850: 7.16 | L850: 3240000 | N850: 025620777
A851: =A850+1 -> 850 | B851: 21302234 | C851: Phan Thành | D851: Lợi | E851: 150195 | F851: VP2013/2 | G851: 81.00 | H851: 6.91 | I851: 28 | J851: 54 | K851: 7.15 | L851: 3240000 | N851: 272448388
A852: =A851+1 -> 851 | B852: 21108300 | C852: Nguyễn Hải Hiền | D852: Khanh | E852: 010893 | F852: BD11CN01 | G852: 98.00 | H852: 9.69 | I852: 8 | J852: 108 | K852: 9.71 | L852: 4860000 | N852: 024946077
A853: =A852+1 -> 852 | B853: 21108197 | C853: Huỳnh Thanh | D853: Tuấn | E853: 110592 | F853: BD11CN01 | G853: 98.00 | H853: 9.69 | I853: 8 | J853: 106 | K853: 9.71 | L853: 4860000 | N853: 215205625
A854: =A853+1 -> 853 | B854: 21108164 | C854: Nguyễn Trọng | D854: Thiên | E854: 190893 | F854: BD11CN01 | G854: 93.00 | H854: 9.69 | I854: 8 | J854: 108 | K854: 9.61 | L854: 4860000 | N854: 024901677
A855: =A854+1 -> 854 | B855: 21108345 | C855: Nguyễn Quang | D855: Nhựt | E855: 070193 | F855: BD11CN01 | G855: 98.00 | H855: 9.50 | I855: 8 | J855: 108 | K855: 9.56 | L855: 4860000 | N855: 321450235
A856: =A855+1 -> 855 | B856: 21108271 | C856: Lương Hồ Tấn | D856: Đạt | E856: 040293 | F856: BD11CN01 | G856: 98.00 | H856: 9.38 | I856: 8 | J856: 108 | K856: 9.46 | L856: 4860000 | N856: 341755757
A857: =A856+1 -> 856 | B857: 21108306 | C857: Hồ Anh | D857: Khoa | E857: 280993 | F857: BD11CN02 | G857: 85.00 | H857: 9.69 | I857: 8 | J857: 108 | K857: 9.45 | L857: 4860000 | N857: 024871994
A858: =A857+1 -> 857 | B858: 21108302 | C858: Lại Thị Kim | D858: Khánh | E858: 010793 | F858: BD11CN01 | G858: 97.00 | H858: 9.38 | I858: 8 | J858: 110 | K858: 9.44 | L858: 4860000 | N858: 301512058
A859: =A858+1 -> 858 | B859: 21108157 | C859: Trần Văn | D859: Tân | E859: 150892 | F859: BD11CN01 | G859: 91.00 | H859: 9.38 | I859: 8 | J859: 102 | K859: 9.32 | L859: 4860000 | N859: 272377962
A860: =A859+1 -> 859 | B860: 21208415 | C860: Bạch Ngọc Hồng | D860: Kiệt | E860: 190494 | F860: BD12CN03 | G860: 100.00 | H860: 8.53 | I860: 20 | J860: 82 | K860: 8.82 | L860: 4050000 | N860: 212665545
A861: =A860+1 -> 860 | B861: 21208245 | C861: Nguyễn Tấn | D861: Tiên | E861: 100894 | F861: BD12CN01 | G861: 90.00 | H861: 8.53 | I861: 20 | J861: 77 | K861: 8.62 | L861: 4050000 | N861: 025155622
A862: =A861+1 -> 861 | B862: 21208205 | C862: Nguyễn ánh | D862: Sáng | E862: 010192 | F862: BD12CN01 | G862: 90.00 | H862: 8.48 | I862: 20 | J862: 79 | K862: 8.58 | L862: 4050000 | N862: 272339301
A863: =A862+1 -> 862 | B863: 21208581 | C863: Trịnh Thanh | D863: Tùng | E863: 201294 | F863: BD12CN01 | G863: 90.00 | H863: 8.38 | I863: 20 | J863: 79 | K863: 8.50 | L863: 4050000 | N863: 025281847
A864: =A863+1 -> 863 | B864: 21208212 | C864: Lưu Minh | D864: Tài | E864: 080694 | F864: BD12CN01 | G864: 95.00 | H864: 8.13 | I864: 20 | J864: 79 | K864: 8.40 | L864: 4050000 | N864: 281048935
A865: =A864+1 -> 864 | B865: 21208117 | C865: Hồ Thiện | D865: Khiêm | E865: 281294 | F865: BD12CN01 | G865: 90.00 | H865: 8.10 | I865: 20 | J865: 82 | K865: 8.28 | L865: 4050000 | N865: 291082471
A866: =A865+1 -> 865 | B866: 21208495 | C866: Huỳnh Minh | D866: Quân | E866: 201094 | F866: BD12CN02 | G866: 95.00 | H866: 7.91 | I866: 17 | J866: 76 | K866: 8.23 | L866: 4050000 | N866: 025178165
A867: =A866+1 -> 866 | B867: 21208219 | C867: Trương Hoàng | D867: Tến | E867: 241094 | F867: BD12CN01 | G867: 95.00 | H867: 7.90 | I867: 20 | J867: 79 | K867: 8.22 | L867: 4050000 | N867: 371586596
A868: =A867+1 -> 867 | B868: 21208436 | C868: Đặng Công | D868: Luân | E868: 141089 | F868: BD12CN03 | G868: 90.00 | H868: 7.80 | I868: 20 | J868: 80 | K868: 8.04 | L868: 4050000 | N868: 024191736
A869: =A868+1 -> 868 | B869: 21208066 | C869: Phan Nhân | D869: Hậu | E869: 131094 | F869: BD12CN01 | G869: 90.00 | H869: 7.70 | I869: 20 | J869: 79 | K869: 7.96 | L869: 3240000 | N869: 025077325
A870: =A869+1 -> 869 | B870: 21308494 | C870: Nguyễn Phạm Ngọc | D870: Tuyền | E870: 300495 | F870: BD13CN04 | G870: 90.00 | H870: 7.20 | I870: 20 | J870: 39 | K870: 7.56 | L870: 3240000 | N870: 025288798

A1: 1 | B1: 21004536 | C1: Nguyễn Trần Quỳnh | D1: Như | E1: 231192 | F1: CK10MAY | G1: 90.00 | H1: 8.50 | I1: 11 | J1: 147 | K1: 8.60 | L1: 4050000 | N1: Sinh viên chưa cập nhật thông tin số CMND và tài khoản OCB. Sinh viên liên hệ đến cửa tiếp số 3 tại PĐT để bổ sung trước ngày 19/11/2014.
A2: 2 | B2: 21302673 | C2: Phạm Thị Thanh | D2: Nhàn | E2: 200595 | F2: CK13DM | G2: 90.00 | H2: 8.21 | I2: 21 | J2: 37 | K2: 8.37 | L2: 4050000
A3: 3 | B3: 21304953 | C3: Nguyễn Thị Phương | D3: Vy | E3: 260795 | F3: CK13HT2 | G3: 100.00 | H3: 8.15 | I3: 20 | J3: 34 | K3: 8.52 | L3: 4050000
A4: 4 | B4: 31201973 | C4: Phan Hữu | D4: Long | E4: 041193 | F4: DC12DK | G4: 95.00 | H4: 8.57 | I4: 15 | J4: 75 | K4: 8.76 | L4: 4050000
A5: 5 | B5: 41203542 | C5: Trần Công | D5: Thi | E5: 241194 | F5: DD12LT14 | G5: 95.00 | H5: 8.47 | I5: 16 | J5: 75 | K5: 8.68 | L5: 4050000
A6: 6 | B6: 41201827 | C6: Lê Nguyên | D6: Lãm | E6: 060194 | F6: DD12LT05 | G6: 95.00 | H6: 8.41 | I6: 16 | J6: 77 | K6: 8.63 | L6: 4050000
A7: 7 | B7: 41200120 | C7: Võ Đại Hoàng | D7: Anh | E7: 280194 | F7: DD12LT01 | G7: 90.00 | H7: 8.11 | I7: 14 | J7: 75 | K7: 8.29 | L7: 4050000
A8: 8 | B8: 61001836 | C8: Từ Gia | D8: Lợi | E8: 280892 | F8: HC10KTTP | G8: 100.00 | H8: 8.58 | I8: 13 | J8: 147 | K8: 8.86 | L8: 4050000
A9: 9 | B9: 61200087 | C9: Nguyễn Thị Quế | D9: Anh | E9: 181294 | F9: HC12SH | G9: 100.00 | H9: 9.00 | I9: 14 | J9: 77 | K9: 9.20 | L9: 4860000
A10: 10 | B10: 61200860 | C10: Nguyễn Hoàng | D10: Ga | E10: 130594 | F10: HC12DK | G10: 95.00 | H10: 8.50 | I10: 18 | J10: 78 | K10: 8.70 | L10: 4050000
A11: 11 | B11: 81003743 | C11: Hoàng Ngọc | D11: Tuấn | E11: 251092 | F11: XD10DD4 | G11: 93.00 | H11: 8.87 | I11: 15 | J11: 141 | K11: 8.96 | L11: 4050000
A12: 12 | B12: 81001068 | C12: Đỗ Công | D12: Hoan | E12: 171091 | F12: XD10DC | G12: 90.00 | H12: 7.00 | I12: 12 | J12: 146 | K12: 7.40 | L12: 3240000
A13: 13 | B13: 81100645 | C13: Trần Tiến | D13: Dũng | E13: 201093 | F13: XD11CB1 | G13: 100.00 | H13: 8.75 | I13: 16 | J13: 107 | K13: 9.00 | L13: 4860000
A14: 14 | B14: 81204361 | C14: Nguyễn Anh | D14: Tú | E14: 160694 | F14: XD12TD2 | G14: 78.00 | H14: 7.15 | I14: 17 | J14: 77 | K14: 7.28 | L14: 3240000
A15: 15 | B15: 81304437 | C15: Nguyễn Thành | D15: Trung | E15: 101095 | F15: XD13TD2 | G15: 94.00 | H15: 7.69 | I15: 18 | J15: 34 | K15: 8.03 | L15: 4050000